,Date,ISO_CountryID,Country/Region,ISO_CountryName,Province/State,Last Update,Confirmed,Deaths,Recovered,ISO_2,ISO_3
0,01-22-2020,156,Mainland China,China,Anhui,1/22/2020 17:00,1.0,,,CN,CHN
1,01-22-2020,156,Mainland China,China,Beijing,1/22/2020 17:00,14.0,,,CN,CHN
2,01-22-2020,156,Mainland China,China,Chongqing,1/22/2020 17:00,6.0,,,CN,CHN
3,01-22-2020,156,Mainland China,China,Fujian,1/22/2020 17:00,1.0,,,CN,CHN
4,01-22-2020,156,Mainland China,China,Gansu,1/22/2020 17:00,,,,CN,CHN
5,01-22-2020,156,Mainland China,China,Guangdong,1/22/2020 17:00,26.0,,,CN,CHN
6,01-22-2020,156,Mainland China,China,Guangxi,1/22/2020 17:00,2.0,,,CN,CHN
7,01-22-2020,156,Mainland China,China,Guizhou,1/22/2020 17:00,1.0,,,CN,CHN
8,01-22-2020,156,Mainland China,China,Hainan,1/22/2020 17:00,4.0,,,CN,CHN
9,01-22-2020,156,Mainland China,China,Hebei,1/22/2020 17:00,1.0,,,CN,CHN
10,01-22-2020,156,Mainland China,China,Heilongjiang,1/22/2020 17:00,,,,CN,CHN
11,01-22-2020,156,Mainland China,China,Henan,1/22/2020 17:00,5.0,,,CN,CHN
12,01-22-2020,156,Mainland China,China,Hubei,1/22/2020 17:00,444.0,17.0,28.0,CN,CHN
13,01-22-2020,156,Mainland China,China,Hunan,1/22/2020 17:00,4.0,,,CN,CHN
14,01-22-2020,156,Mainland China,China,Inner Mongolia,1/22/2020 17:00,,,,CN,CHN
15,01-22-2020,156,Mainland China,China,Jiangsu,1/22/2020 17:00,1.0,,,CN,CHN
16,01-22-2020,156,Mainland China,China,Jiangxi,1/22/2020 17:00,2.0,,,CN,CHN
17,01-22-2020,156,Mainland China,China,Jilin,1/22/2020 17:00,,,,CN,CHN
18,01-22-2020,156,Mainland China,China,Liaoning,1/22/2020 17:00,2.0,,,CN,CHN
19,01-22-2020,156,Mainland China,China,Ningxia,1/22/2020 17:00,1.0,,,CN,CHN
20,01-22-2020,156,Mainland China,China,Qinghai,1/22/2020 17:00,,,,CN,CHN
21,01-22-2020,156,Mainland China,China,Shaanxi,1/22/2020 17:00,,,,CN,CHN
22,01-22-2020,156,Mainland China,China,Shandong,1/22/2020 17:00,2.0,,,CN,CHN
23,01-22-2020,156,Mainland China,China,Shanghai,1/22/2020 17:00,9.0,,,CN,CHN
24,01-22-2020,156,Mainland China,China,Shanxi,1/22/2020 17:00,1.0,,,CN,CHN
25,01-22-2020,156,Mainland China,China,Sichuan,1/22/2020 17:00,5.0,,,CN,CHN
26,01-22-2020,156,Mainland China,China,Tianjin,1/22/2020 17:00,4.0,,,CN,CHN
27,01-22-2020,156,Mainland China,China,Tibet,1/22/2020 17:00,,,,CN,CHN
28,01-22-2020,156,Mainland China,China,Xinjiang,1/22/2020 17:00,,,,CN,CHN
29,01-22-2020,156,Mainland China,China,Yunnan,1/22/2020 17:00,1.0,,,CN,CHN
30,01-22-2020,156,Mainland China,China,Zhejiang,1/22/2020 17:00,10.0,,,CN,CHN
31,01-23-2020,156,Mainland China,China,Anhui,1/23/20 17:00,9.0,,,CN,CHN
32,01-23-2020,156,Mainland China,China,Beijing,1/23/20 17:00,22.0,,,CN,CHN
33,01-23-2020,156,Mainland China,China,Chongqing,1/23/20 17:00,9.0,,,CN,CHN
34,01-23-2020,156,Mainland China,China,Fujian,1/23/20 17:00,5.0,,,CN,CHN
35,01-23-2020,156,Mainland China,China,Gansu,1/23/20 17:00,2.0,,,CN,CHN
36,01-23-2020,156,Mainland China,China,Guangdong,1/23/20 17:00,32.0,,2.0,CN,CHN
37,01-23-2020,156,Mainland China,China,Guangxi,1/23/20 17:00,5.0,,,CN,CHN
38,01-23-2020,156,Mainland China,China,Guizhou,1/23/20 17:00,3.0,,,CN,CHN
39,01-23-2020,156,Mainland China,China,Hainan,1/23/20 17:00,5.0,,,CN,CHN
40,01-23-2020,156,Mainland China,China,Hebei,1/23/20 17:00,1.0,1.0,,CN,CHN
41,01-23-2020,156,Mainland China,China,Heilongjiang,1/23/20 17:00,2.0,,,CN,CHN
42,01-23-2020,156,Mainland China,China,Henan,1/23/20 17:00,5.0,,,CN,CHN
43,01-23-2020,156,Mainland China,China,Hubei,1/23/20 17:00,444.0,17.0,28.0,CN,CHN
44,01-23-2020,156,Mainland China,China,Hunan,1/23/20 17:00,9.0,,,CN,CHN
45,01-23-2020,156,Mainland China,China,Inner Mongolia,1/23/20 17:00,,,,CN,CHN
46,01-23-2020,156,Mainland China,China,Jiangsu,1/23/20 17:00,5.0,,,CN,CHN
47,01-23-2020,156,Mainland China,China,Jiangxi,1/23/20 17:00,7.0,,,CN,CHN
48,01-23-2020,156,Mainland China,China,Jilin,1/23/20 17:00,1.0,,,CN,CHN
49,01-23-2020,156,Mainland China,China,Liaoning,1/23/20 17:00,3.0,,,CN,CHN
50,01-23-2020,156,Mainland China,China,Ningxia,1/23/20 17:00,1.0,,,CN,CHN
51,01-23-2020,156,Mainland China,China,Qinghai,1/23/20 17:00,,,,CN,CHN
52,01-23-2020,156,Mainland China,China,Shaanxi,1/23/20 17:00,3.0,,,CN,CHN
53,01-23-2020,156,Mainland China,China,Shandong,1/23/20 17:00,6.0,,,CN,CHN
54,01-23-2020,156,Mainland China,China,Shanghai,1/23/20 17:00,16.0,,,CN,CHN
55,01-23-2020,156,Mainland China,China,Shanxi,1/23/20 17:00,1.0,,,CN,CHN
56,01-23-2020,156,Mainland China,China,Sichuan,1/23/20 17:00,8.0,,,CN,CHN
57,01-23-2020,156,Mainland China,China,Tianjin,1/23/20 17:00,4.0,,,CN,CHN
58,01-23-2020,156,Mainland China,China,Tibet,1/23/20 17:00,,,,CN,CHN
59,01-23-2020,156,Mainland China,China,Xinjiang,1/23/20 17:00,2.0,,,CN,CHN
60,01-23-2020,156,Mainland China,China,Yunnan,1/23/20 17:00,2.0,,,CN,CHN
61,01-23-2020,156,Mainland China,China,Zhejiang,1/23/20 17:00,27.0,,,CN,CHN
62,01-24-2020,156,Mainland China,China,Hubei,1/24/20 17:00,549.0,24.0,31.0,CN,CHN
63,01-24-2020,156,Mainland China,China,Guangdong,1/24/20 17:00,53.0,,2.0,CN,CHN
64,01-24-2020,156,Mainland China,China,Zhejiang,1/24/20 17:00,43.0,,1.0,CN,CHN
65,01-24-2020,156,Mainland China,China,Beijing,1/24/20 17:00,36.0,,1.0,CN,CHN
66,01-24-2020,156,Mainland China,China,Chongqing,1/24/20 17:00,27.0,,,CN,CHN
67,01-24-2020,156,Mainland China,China,Hunan,1/24/20 17:00,24.0,,,CN,CHN
68,01-24-2020,156,Mainland China,China,Guangxi,1/24/20 17:00,23.0,,,CN,CHN
69,01-24-2020,156,Mainland China,China,Shanghai,1/24/20 17:00,20.0,,1.0,CN,CHN
70,01-24-2020,156,Mainland China,China,Jiangxi,1/24/20 17:00,18.0,,,CN,CHN
71,01-24-2020,156,Mainland China,China,Sichuan,1/24/20 17:00,15.0,,,CN,CHN
72,01-24-2020,156,Mainland China,China,Shandong,1/24/20 17:00,15.0,,,CN,CHN
73,01-24-2020,156,Mainland China,China,Anhui,1/24/20 17:00,15.0,,,CN,CHN
74,01-24-2020,156,Mainland China,China,Fujian,1/24/20 17:00,10.0,,,CN,CHN
75,01-24-2020,156,Mainland China,China,Henan,1/24/20 17:00,9.0,,,CN,CHN
76,01-24-2020,156,Mainland China,China,Jiangsu,1/24/20 17:00,9.0,,,CN,CHN
77,01-24-2020,156,Mainland China,China,Hainan,1/24/20 17:00,8.0,,,CN,CHN
78,01-24-2020,156,Mainland China,China,Tianjin,1/24/20 17:00,8.0,,,CN,CHN
79,01-24-2020,156,Mainland China,China,Yunnan,1/24/20 17:00,5.0,,,CN,CHN
80,01-24-2020,156,Mainland China,China,Shaanxi,1/24/20 17:00,5.0,,,CN,CHN
81,01-24-2020,156,Mainland China,China,Heilongjiang,1/24/20 17:00,4.0,1.0,,CN,CHN
82,01-24-2020,156,Mainland China,China,Liaoning,1/24/20 17:00,4.0,,,CN,CHN
83,01-24-2020,156,Mainland China,China,Guizhou,1/24/20 17:00,3.0,,,CN,CHN
84,01-24-2020,156,Mainland China,China,Jilin,1/24/20 17:00,3.0,,,CN,CHN
85,01-24-2020,156,Mainland China,China,Ningxia,1/24/20 17:00,2.0,,,CN,CHN
86,01-24-2020,156,Mainland China,China,Hebei,1/24/20 17:00,2.0,1.0,,CN,CHN
87,01-24-2020,156,Mainland China,China,Gansu,1/24/20 17:00,2.0,,,CN,CHN
88,01-24-2020,156,Mainland China,China,Xinjiang,1/24/20 17:00,2.0,,,CN,CHN
89,01-24-2020,156,Mainland China,China,Shanxi,1/24/20 17:00,1.0,,,CN,CHN
90,01-24-2020,156,Mainland China,China,Inner Mongolia,1/24/20 17:00,1.0,,,CN,CHN
91,01-24-2020,156,Mainland China,China,Qinghai,1/24/20 17:00,,,,CN,CHN
92,01-25-2020,156,Mainland China,China,Hubei,1/25/20 17:00,761.0,40.0,32.0,CN,CHN
93,01-25-2020,156,Mainland China,China,Guangdong,1/25/20 17:00,78.0,,2.0,CN,CHN
94,01-25-2020,156,Mainland China,China,Zhejiang,1/25/20 17:00,62.0,,1.0,CN,CHN
95,01-25-2020,156,Mainland China,China,Chongqing,1/25/20 17:00,57.0,,,CN,CHN
96,01-25-2020,156,Mainland China,China,Hunan,1/25/20 17:00,43.0,,,CN,CHN
97,01-25-2020,156,Mainland China,China,Beijing,1/25/20 17:00,41.0,,2.0,CN,CHN
98,01-25-2020,156,Mainland China,China,Anhui,1/25/20 17:00,39.0,,,CN,CHN
99,01-25-2020,156,Mainland China,China,Shanghai,1/25/20 17:00,33.0,,1.0,CN,CHN
100,01-25-2020,156,Mainland China,China,Henan,1/25/20 17:00,32.0,,,CN,CHN
101,01-25-2020,156,Mainland China,China,Sichuan,1/25/20 17:00,28.0,,,CN,CHN
102,01-25-2020,156,Mainland China,China,Shandong,1/25/20 17:00,27.0,,,CN,CHN
103,01-25-2020,156,Mainland China,China,Guangxi,1/25/20 17:00,23.0,,,CN,CHN
104,01-25-2020,156,Mainland China,China,Hainan,1/25/20 17:00,19.0,,,CN,CHN
105,01-25-2020,156,Mainland China,China,Jiangxi,1/25/20 17:00,18.0,,,CN,CHN
106,01-25-2020,156,Mainland China,China,Fujian,1/25/20 17:00,18.0,,,CN,CHN
107,01-25-2020,156,Mainland China,China,Jiangsu,1/25/20 17:00,18.0,,1.0,CN,CHN
108,01-25-2020,156,Mainland China,China,Liaoning,1/25/20 17:00,17.0,,,CN,CHN
109,01-25-2020,156,Mainland China,China,Shaanxi,1/25/20 17:00,15.0,,,CN,CHN
110,01-25-2020,156,Mainland China,China,Yunnan,1/25/20 17:00,11.0,,,CN,CHN
111,01-25-2020,156,Mainland China,China,Tianjin,1/25/20 17:00,10.0,,,CN,CHN
112,01-25-2020,156,Mainland China,China,Heilongjiang,1/25/20 17:00,9.0,1.0,,CN,CHN
113,01-25-2020,156,Mainland China,China,Hebei,1/25/20 17:00,8.0,1.0,,CN,CHN
114,01-25-2020,156,Mainland China,China,Inner Mongolia,1/25/20 17:00,7.0,,,CN,CHN
115,01-25-2020,156,Mainland China,China,Shanxi,1/25/20 17:00,6.0,,,CN,CHN
116,01-25-2020,156,Mainland China,China,Guizhou,1/25/20 17:00,4.0,,,CN,CHN
117,01-25-2020,156,Mainland China,China,Jilin,1/25/20 17:00,4.0,,,CN,CHN
118,01-25-2020,156,Mainland China,China,Gansu,1/25/20 17:00,4.0,,,CN,CHN
119,01-25-2020,156,Mainland China,China,Ningxia,1/25/20 17:00,3.0,,,CN,CHN
120,01-25-2020,156,Mainland China,China,Xinjiang,1/25/20 17:00,3.0,,,CN,CHN
121,01-25-2020,156,Mainland China,China,Qinghai,1/25/20 17:00,1.0,,,CN,CHN
122,01-26-2020,156,Mainland China,China,Hubei,1/26/20 16:00,1058.0,52.0,42.0,CN,CHN
123,01-26-2020,156,Mainland China,China,Guangdong,1/26/20 16:00,111.0,,2.0,CN,CHN
124,01-26-2020,156,Mainland China,China,Zhejiang,1/26/20 16:00,104.0,,1.0,CN,CHN
125,01-26-2020,156,Mainland China,China,Henan,1/26/20 16:00,83.0,1.0,,CN,CHN
126,01-26-2020,156,Mainland China,China,Chongqing,1/26/20 16:00,75.0,,,CN,CHN
127,01-26-2020,156,Mainland China,China,Hunan,1/26/20 16:00,69.0,,,CN,CHN
128,01-26-2020,156,Mainland China,China,Beijing,1/26/20 16:00,68.0,,2.0,CN,CHN
129,01-26-2020,156,Mainland China,China,Anhui,1/26/20 16:00,60.0,,,CN,CHN
130,01-26-2020,156,Mainland China,China,Shandong,1/26/20 16:00,46.0,,,CN,CHN
131,01-26-2020,156,Mainland China,China,Sichuan,1/26/20 16:00,44.0,,,CN,CHN
132,01-26-2020,156,Mainland China,China,Shanghai,1/26/20 16:00,40.0,1.0,1.0,CN,CHN
133,01-26-2020,156,Mainland China,China,Guangxi,1/26/20 16:00,36.0,,,CN,CHN
134,01-26-2020,156,Mainland China,China,Jiangxi,1/26/20 16:00,36.0,,,CN,CHN
135,01-26-2020,156,Mainland China,China,Fujian,1/26/20 16:00,35.0,,,CN,CHN
136,01-26-2020,156,Mainland China,China,Jiangsu,1/26/20 16:00,33.0,,1.0,CN,CHN
137,01-26-2020,156,Mainland China,China,Hainan,1/26/20 16:00,22.0,,,CN,CHN
138,01-26-2020,156,Mainland China,China,Shaanxi,1/26/20 16:00,22.0,,,CN,CHN
139,01-26-2020,156,Mainland China,China,Liaoning,1/26/20 16:00,21.0,,,CN,CHN
140,01-26-2020,156,Mainland China,China,Yunnan,1/26/20 16:00,16.0,,,CN,CHN
141,01-26-2020,156,Mainland China,China,Heilongjiang,1/26/20 16:00,15.0,1.0,,CN,CHN
142,01-26-2020,156,Mainland China,China,Tianjin,1/26/20 16:00,14.0,,,CN,CHN
143,01-26-2020,156,Mainland China,China,Hebei,1/26/20 16:00,13.0,1.0,,CN,CHN
144,01-26-2020,156,Mainland China,China,Shanxi,1/26/20 16:00,9.0,,,CN,CHN
145,01-26-2020,156,Mainland China,China,Inner Mongolia,1/26/20 16:00,7.0,,,CN,CHN
146,01-26-2020,156,Mainland China,China,Gansu,1/26/20 16:00,7.0,,,CN,CHN
147,01-26-2020,156,Mainland China,China,Guizhou,1/26/20 16:00,5.0,,,CN,CHN
148,01-26-2020,156,Mainland China,China,Ningxia,1/26/20 16:00,4.0,,,CN,CHN
149,01-26-2020,156,Mainland China,China,Jilin,1/26/20 16:00,4.0,,,CN,CHN
150,01-26-2020,156,Mainland China,China,Xinjiang,1/26/20 16:00,4.0,,,CN,CHN
151,01-26-2020,156,Mainland China,China,Qinghai,1/26/20 16:00,1.0,,,CN,CHN
152,01-27-2020,156,Mainland China,China,Hubei,1/27/20 23:59,1423.0,76.0,45.0,CN,CHN
153,01-27-2020,156,Mainland China,China,Guangdong,1/27/20 23:59,151.0,,4.0,CN,CHN
154,01-27-2020,156,Mainland China,China,Zhejiang,1/27/20 23:59,128.0,,1.0,CN,CHN
155,01-27-2020,156,Mainland China,China,Henan,1/27/20 23:59,128.0,1.0,,CN,CHN
156,01-27-2020,156,Mainland China,China,Chongqing,1/27/20 23:59,110.0,,,CN,CHN
157,01-27-2020,156,Mainland China,China,Hunan,1/27/20 23:59,100.0,,,CN,CHN
158,01-27-2020,156,Mainland China,China,Beijing,1/27/20 23:59,80.0,1.0,2.0,CN,CHN
159,01-27-2020,156,Mainland China,China,Shandong,1/27/20 23:59,75.0,,,CN,CHN
160,01-27-2020,156,Mainland China,China,Jiangxi,1/27/20 23:59,72.0,,2.0,CN,CHN
161,01-27-2020,156,Mainland China,China,Anhui,1/27/20 23:59,70.0,,,CN,CHN
162,01-27-2020,156,Mainland China,China,Sichuan,1/27/20 23:59,69.0,,,CN,CHN
163,01-27-2020,156,Mainland China,China,Fujian,1/27/20 23:59,59.0,,,CN,CHN
164,01-27-2020,156,Mainland China,China,Shanghai,1/27/20 23:59,53.0,1.0,3.0,CN,CHN
165,01-27-2020,156,Mainland China,China,Jiangsu,1/27/20 23:59,47.0,,1.0,CN,CHN
166,01-27-2020,156,Mainland China,China,Guangxi,1/27/20 23:59,46.0,,,CN,CHN
167,01-27-2020,156,Mainland China,China,Shaanxi,1/27/20 23:59,35.0,,,CN,CHN
168,01-27-2020,156,Mainland China,China,Hainan,1/27/20 23:59,33.0,1.0,,CN,CHN
169,01-27-2020,156,Mainland China,China,Liaoning,1/27/20 23:59,27.0,,,CN,CHN
170,01-27-2020,156,Mainland China,China,Yunnan,1/27/20 23:59,26.0,,,CN,CHN
171,01-27-2020,156,Mainland China,China,Tianjin,1/27/20 23:59,23.0,,,CN,CHN
172,01-27-2020,156,Mainland China,China,Heilongjiang,1/27/20 23:59,21.0,1.0,,CN,CHN
173,01-27-2020,156,Mainland China,China,Hebei,1/27/20 23:59,18.0,1.0,,CN,CHN
174,01-27-2020,156,Mainland China,China,Gansu,1/27/20 23:59,14.0,,,CN,CHN
175,01-27-2020,156,Mainland China,China,Shanxi,1/27/20 23:59,13.0,,,CN,CHN
176,01-27-2020,156,Mainland China,China,Inner Mongolia,1/27/20 23:59,11.0,,,CN,CHN
177,01-27-2020,156,Mainland China,China,Guizhou,1/27/20 23:59,7.0,,,CN,CHN
178,01-27-2020,156,Mainland China,China,Ningxia,1/27/20 23:59,7.0,,,CN,CHN
179,01-27-2020,156,Mainland China,China,Jilin,1/27/20 23:59,6.0,,,CN,CHN
180,01-27-2020,156,Mainland China,China,Qinghai,1/27/20 23:59,6.0,,,CN,CHN
181,01-27-2020,156,Mainland China,China,Xinjiang,1/27/20 23:59,5.0,,,CN,CHN
182,01-28-2020,156,Mainland China,China,Hubei,1/28/20 23:00,3554.0,125.0,80.0,CN,CHN
183,01-28-2020,156,Mainland China,China,Guangdong,1/28/20 23:00,207.0,,4.0,CN,CHN
184,01-28-2020,156,Mainland China,China,Zhejiang,1/28/20 23:00,173.0,,3.0,CN,CHN
185,01-28-2020,156,Mainland China,China,Henan,1/28/20 23:00,168.0,1.0,,CN,CHN
186,01-28-2020,156,Mainland China,China,Hunan,1/28/20 23:00,143.0,,,CN,CHN
187,01-28-2020,156,Mainland China,China,Chongqing,1/28/20 23:00,132.0,,,CN,CHN
188,01-28-2020,156,Mainland China,China,Jiangxi,1/28/20 23:00,109.0,,3.0,CN,CHN
189,01-28-2020,156,Mainland China,China,Anhui,1/28/20 23:00,106.0,,,CN,CHN
190,01-28-2020,156,Mainland China,China,Shandong,1/28/20 23:00,95.0,,,CN,CHN
191,01-28-2020,156,Mainland China,China,Beijing,1/28/20 23:00,91.0,1.0,4.0,CN,CHN
192,01-28-2020,156,Mainland China,China,Sichuan,1/28/20 23:00,90.0,,,CN,CHN
193,01-28-2020,156,Mainland China,China,Fujian,1/28/20 23:00,80.0,,,CN,CHN
194,01-28-2020,156,Mainland China,China,Jiangsu,1/28/20 23:00,70.0,,1.0,CN,CHN
195,01-28-2020,156,Mainland China,China,Shanghai,1/28/20 23:00,66.0,1.0,4.0,CN,CHN
196,01-28-2020,156,Mainland China,China,Guangxi,1/28/20 23:00,51.0,,2.0,CN,CHN
197,01-28-2020,156,Mainland China,China,Shaanxi,1/28/20 23:00,46.0,,,CN,CHN
198,01-28-2020,156,Mainland China,China,Yunnan,1/28/20 23:00,44.0,,,CN,CHN
199,01-28-2020,156,Mainland China,China,Hainan,1/28/20 23:00,40.0,1.0,,CN,CHN
200,01-28-2020,156,Mainland China,China,Liaoning,1/28/20 23:00,34.0,,,CN,CHN
201,01-28-2020,156,Mainland China,China,Hebei,1/28/20 23:00,33.0,1.0,,CN,CHN
202,01-28-2020,156,Mainland China,China,Heilongjiang,1/28/20 23:00,33.0,1.0,,CN,CHN
203,01-28-2020,156,Mainland China,China,Shanxi,1/28/20 23:00,27.0,,,CN,CHN
204,01-28-2020,156,Mainland China,China,Tianjin,1/28/20 23:00,24.0,,,CN,CHN
205,01-28-2020,156,Mainland China,China,Gansu,1/28/20 23:00,19.0,,,CN,CHN
206,01-28-2020,156,Mainland China,China,Inner Mongolia,1/28/20 23:00,15.0,,,CN,CHN
207,01-28-2020,156,Mainland China,China,Ningxia,1/28/20 23:00,11.0,,,CN,CHN
208,01-28-2020,156,Mainland China,China,Xinjiang,1/28/20 23:00,10.0,,,CN,CHN
209,01-28-2020,156,Mainland China,China,Guizhou,1/28/20 23:00,9.0,,,CN,CHN
210,01-28-2020,156,Mainland China,China,Jilin,1/28/20 23:00,8.0,,,CN,CHN
211,01-28-2020,156,Mainland China,China,Qinghai,1/28/20 23:00,6.0,,,CN,CHN
212,01-29-2020,156,Mainland China,China,Hubei,1/29/20 19:30,3554.0,125.0,88.0,CN,CHN
213,01-29-2020,156,Mainland China,China,Zhejiang,1/29/20 19:30,296.0,,3.0,CN,CHN
214,01-29-2020,156,Mainland China,China,Guangdong,1/29/20 19:30,277.0,,5.0,CN,CHN
215,01-29-2020,156,Mainland China,China,Hunan,1/29/20 19:30,221.0,,,CN,CHN
216,01-29-2020,156,Mainland China,China,Henan,1/29/20 19:30,206.0,2.0,1.0,CN,CHN
217,01-29-2020,156,Mainland China,China,Anhui,1/29/20 19:30,152.0,,2.0,CN,CHN
218,01-29-2020,156,Mainland China,China,Chongqing,1/29/20 19:30,147.0,,1.0,CN,CHN
219,01-29-2020,156,Mainland China,China,Shandong,1/29/20 19:30,130.0,,1.0,CN,CHN
220,01-29-2020,156,Mainland China,China,Beijing,1/29/20 19:30,111.0,1.0,4.0,CN,CHN
221,01-29-2020,156,Mainland China,China,Jiangxi,1/29/20 19:30,109.0,,3.0,CN,CHN
222,01-29-2020,156,Mainland China,China,Sichuan,1/29/20 19:30,108.0,1.0,1.0,CN,CHN
223,01-29-2020,156,Mainland China,China,Jiangsu,1/29/20 19:30,99.0,,1.0,CN,CHN
224,01-29-2020,156,Mainland China,China,Shanghai,1/29/20 19:30,96.0,1.0,5.0,CN,CHN
225,01-29-2020,156,Mainland China,China,Fujian,1/29/20 19:30,84.0,,,CN,CHN
226,01-29-2020,156,Mainland China,China,Guangxi,1/29/20 19:30,58.0,,2.0,CN,CHN
227,01-29-2020,156,Mainland China,China,Shaanxi,1/29/20 19:30,56.0,,,CN,CHN
228,01-29-2020,156,Mainland China,China,Yunnan,1/29/20 19:30,55.0,,,CN,CHN
229,01-29-2020,156,Mainland China,China,Hebei,1/29/20 19:30,48.0,1.0,,CN,CHN
230,01-29-2020,156,Mainland China,China,Hainan,1/29/20 19:30,43.0,1.0,,CN,CHN
231,01-29-2020,156,Mainland China,China,Liaoning,1/29/20 19:30,39.0,,1.0,CN,CHN
232,01-29-2020,156,Mainland China,China,Heilongjiang,1/29/20 19:30,38.0,1.0,,CN,CHN
233,01-29-2020,156,Mainland China,China,Tianjin,1/29/20 19:30,27.0,,,CN,CHN
234,01-29-2020,156,Mainland China,China,Shanxi,1/29/20 19:30,27.0,,1.0,CN,CHN
235,01-29-2020,156,Mainland China,China,Gansu,1/29/20 19:30,24.0,,,CN,CHN
236,01-29-2020,156,Mainland China,China,Inner Mongolia,1/29/20 19:30,16.0,,,CN,CHN
237,01-29-2020,156,Mainland China,China,Xinjiang,1/29/20 19:30,13.0,,,CN,CHN
238,01-29-2020,156,Mainland China,China,Ningxia,1/29/20 19:30,12.0,,,CN,CHN
239,01-29-2020,156,Mainland China,China,Guizhou,1/29/20 19:30,9.0,,1.0,CN,CHN
240,01-29-2020,156,Mainland China,China,Jilin,1/29/20 19:30,9.0,,,CN,CHN
241,01-29-2020,156,Mainland China,China,Qinghai,1/29/20 19:30,6.0,,,CN,CHN
242,01-30-2020,156,Mainland China,China,Hubei,1/30/20 16:00,4903.0,162.0,90.0,CN,CHN
243,01-30-2020,156,Mainland China,China,Zhejiang,1/30/20 16:00,428.0,,4.0,CN,CHN
244,01-30-2020,156,Mainland China,China,Guangdong,1/30/20 16:00,354.0,,10.0,CN,CHN
245,01-30-2020,156,Mainland China,China,Henan,1/30/20 16:00,278.0,2.0,2.0,CN,CHN
246,01-30-2020,156,Mainland China,China,Hunan,1/30/20 16:00,277.0,,2.0,CN,CHN
247,01-30-2020,156,Mainland China,China,Anhui,1/30/20 16:00,200.0,,2.0,CN,CHN
248,01-30-2020,156,Mainland China,China,Chongqing,1/30/20 16:00,182.0,,1.0,CN,CHN
249,01-30-2020,156,Mainland China,China,Jiangxi,1/30/20 16:00,162.0,,5.0,CN,CHN
250,01-30-2020,156,Mainland China,China,Shandong,1/30/20 16:00,158.0,,1.0,CN,CHN
251,01-30-2020,156,Mainland China,China,Sichuan,1/30/20 16:00,142.0,1.0,1.0,CN,CHN
252,01-30-2020,156,Mainland China,China,Jiangsu,1/30/20 16:00,129.0,,1.0,CN,CHN
253,01-30-2020,156,Mainland China,China,Beijing,1/30/20 16:00,114.0,1.0,4.0,CN,CHN
254,01-30-2020,156,Mainland China,China,Shanghai,1/30/20 16:00,112.0,1.0,5.0,CN,CHN
255,01-30-2020,156,Mainland China,China,Fujian,1/30/20 16:00,101.0,,,CN,CHN
256,01-30-2020,156,Mainland China,China,Guangxi,1/30/20 16:00,78.0,,2.0,CN,CHN
257,01-30-2020,156,Mainland China,China,Yunnan,1/30/20 16:00,70.0,,,CN,CHN
258,01-30-2020,156,Mainland China,China,Hebei,1/30/20 16:00,65.0,1.0,,CN,CHN
259,01-30-2020,156,Mainland China,China,Shaanxi,1/30/20 16:00,63.0,,,CN,CHN
260,01-30-2020,156,Mainland China,China,Hainan,1/30/20 16:00,46.0,1.0,1.0,CN,CHN
261,01-30-2020,156,Mainland China,China,Heilongjiang,1/30/20 16:00,44.0,2.0,,CN,CHN
262,01-30-2020,156,Mainland China,China,Liaoning,1/30/20 16:00,41.0,,1.0,CN,CHN
263,01-30-2020,156,Mainland China,China,Shanxi,1/30/20 16:00,35.0,,1.0,CN,CHN
264,01-30-2020,156,Mainland China,China,Tianjin,1/30/20 16:00,31.0,,,CN,CHN
265,01-30-2020,156,Mainland China,China,Gansu,1/30/20 16:00,26.0,,,CN,CHN
266,01-30-2020,156,Mainland China,China,Inner Mongolia,1/30/20 16:00,19.0,,,CN,CHN
267,01-30-2020,156,Mainland China,China,Ningxia,1/30/20 16:00,17.0,,,CN,CHN
268,01-30-2020,156,Mainland China,China,Jilin,1/30/20 16:00,14.0,,1.0,CN,CHN
269,01-30-2020,156,Mainland China,China,Xinjiang,1/30/20 16:00,14.0,,,CN,CHN
270,01-30-2020,156,Mainland China,China,Guizhou,1/30/20 16:00,12.0,,1.0,CN,CHN
271,01-30-2020,156,Mainland China,China,Qinghai,1/30/20 16:00,8.0,,,CN,CHN
272,01-30-2020,156,Mainland China,China,Tibet,1/30/20 16:00,1.0,,,CN,CHN
273,01-31-2020,156,Mainland China,China,Hubei,1/31/2020 23:59,5806.0,204.0,141.0,CN,CHN
274,01-31-2020,156,Mainland China,China,Zhejiang,1/31/2020 23:59,538.0,,14.0,CN,CHN
275,01-31-2020,156,Mainland China,China,Guangdong,1/31/2020 23:59,436.0,,11.0,CN,CHN
276,01-31-2020,156,Mainland China,China,Henan,1/31/2020 23:59,352.0,2.0,3.0,CN,CHN
277,01-31-2020,156,Mainland China,China,Hunan,1/31/2020 23:59,332.0,,2.0,CN,CHN
278,01-31-2020,156,Mainland China,China,Jiangxi,1/31/2020 23:59,240.0,,7.0,CN,CHN
279,01-31-2020,156,Mainland China,China,Anhui,1/31/2020 23:59,237.0,,3.0,CN,CHN
280,01-31-2020,156,Mainland China,China,Chongqing,1/31/2020 23:59,211.0,,1.0,CN,CHN
281,01-31-2020,156,Mainland China,China,Shandong,1/31/2020 23:59,184.0,,2.0,CN,CHN
282,01-31-2020,156,Mainland China,China,Sichuan,1/31/2020 23:59,177.0,1.0,1.0,CN,CHN
283,01-31-2020,156,Mainland China,China,Jiangsu,1/31/2020 23:59,168.0,,5.0,CN,CHN
284,01-31-2020,156,Mainland China,China,Beijing,1/31/2020 23:59,139.0,1.0,5.0,CN,CHN
285,01-31-2020,156,Mainland China,China,Shanghai,1/31/2020 23:59,135.0,1.0,9.0,CN,CHN
286,01-31-2020,156,Mainland China,China,Fujian,1/31/2020 23:59,120.0,,,CN,CHN
287,01-31-2020,156,Mainland China,China,Guangxi,1/31/2020 23:59,87.0,,2.0,CN,CHN
288,01-31-2020,156,Mainland China,China,Shaanxi,1/31/2020 23:59,87.0,,,CN,CHN
289,01-31-2020,156,Mainland China,China,Yunnan,1/31/2020 23:59,83.0,,1.0,CN,CHN
290,01-31-2020,156,Mainland China,China,Hebei,1/31/2020 23:59,82.0,1.0,,CN,CHN
291,01-31-2020,156,Mainland China,China,Heilongjiang,1/31/2020 23:59,59.0,2.0,,CN,CHN
292,01-31-2020,156,Mainland China,China,Hainan,1/31/2020 23:59,52.0,1.0,1.0,CN,CHN
293,01-31-2020,156,Mainland China,China,Liaoning,1/31/2020 23:59,48.0,,1.0,CN,CHN
294,01-31-2020,156,Mainland China,China,Shanxi,1/31/2020 23:59,39.0,,1.0,CN,CHN
295,01-31-2020,156,Mainland China,China,Tianjin,1/31/2020 23:59,32.0,,,CN,CHN
296,01-31-2020,156,Mainland China,China,Guizhou,1/31/2020 23:59,29.0,,2.0,CN,CHN
297,01-31-2020,156,Mainland China,China,Gansu,1/31/2020 23:59,29.0,,,CN,CHN
298,01-31-2020,156,Mainland China,China,Ningxia,1/31/2020 23:59,21.0,,,CN,CHN
299,01-31-2020,156,Mainland China,China,Inner Mongolia,1/31/2020 23:59,20.0,,1.0,CN,CHN
300,01-31-2020,156,Mainland China,China,Xinjiang,1/31/2020 23:59,17.0,,,CN,CHN
301,01-31-2020,156,Mainland China,China,Jilin,1/31/2020 23:59,14.0,,1.0,CN,CHN
302,01-31-2020,156,Mainland China,China,Qinghai,1/31/2020 23:59,8.0,,,CN,CHN
303,01-31-2020,156,Mainland China,China,Tibet,1/31/2020 23:59,1.0,,,CN,CHN
304,02-01-2020,156,Mainland China,China,Hubei,2/1/2020 11:53,7153.0,249.0,168.0,CN,CHN
305,02-01-2020,156,Mainland China,China,Zhejiang,2/1/2020 10:53,599.0,0.0,21.0,CN,CHN
306,02-01-2020,156,Mainland China,China,Guangdong,2/1/2020 14:23,535.0,0.0,14.0,CN,CHN
307,02-01-2020,156,Mainland China,China,Henan,2/1/2020 1:52,422.0,2.0,3.0,CN,CHN
308,02-01-2020,156,Mainland China,China,Hunan,2/1/2020 11:03,389.0,0.0,8.0,CN,CHN
309,02-01-2020,156,Mainland China,China,Anhui,2/1/2020 13:33,297.0,0.0,5.0,CN,CHN
310,02-01-2020,156,Mainland China,China,Jiangxi,2/1/2020 1:52,286.0,0.0,9.0,CN,CHN
311,02-01-2020,156,Mainland China,China,Chongqing,2/1/2020 8:43,247.0,1.0,3.0,CN,CHN
312,02-01-2020,156,Mainland China,China,Sichuan,2/1/2020 1:52,207.0,1.0,3.0,CN,CHN
313,02-01-2020,156,Mainland China,China,Shandong,2/1/2020 7:51,206.0,0.0,3.0,CN,CHN
314,02-01-2020,156,Mainland China,China,Jiangsu,2/1/2020 14:03,202.0,0.0,6.0,CN,CHN
315,02-01-2020,156,Mainland China,China,Shanghai,2/1/2020 6:05,169.0,1.0,10.0,CN,CHN
316,02-01-2020,156,Mainland China,China,Beijing,2/1/2020 9:17,168.0,1.0,9.0,CN,CHN
317,02-01-2020,156,Mainland China,China,Fujian,2/1/2020 5:37,144.0,0.0,0.0,CN,CHN
318,02-01-2020,156,Mainland China,China,Shaanxi,2/1/2020 5:37,101.0,0.0,0.0,CN,CHN
319,02-01-2020,156,Mainland China,China,Guangxi,2/1/2020 1:52,100.0,0.0,2.0,CN,CHN
320,02-01-2020,156,Mainland China,China,Hebei,2/1/2020 1:52,96.0,1.0,0.0,CN,CHN
321,02-01-2020,156,Mainland China,China,Yunnan,2/1/2020 15:53,93.0,0.0,2.0,CN,CHN
322,02-01-2020,156,Mainland China,China,Heilongjiang,2/1/2020 10:33,80.0,2.0,2.0,CN,CHN
323,02-01-2020,156,Mainland China,China,Liaoning,2/1/2020 15:23,64.0,0.0,1.0,CN,CHN
324,02-01-2020,156,Mainland China,China,Hainan,2/1/2020 8:43,62.0,1.0,1.0,CN,CHN
325,02-01-2020,156,Mainland China,China,Shanxi,2/1/2020 1:52,47.0,0.0,1.0,CN,CHN
326,02-01-2020,156,Mainland China,China,Tianjin,2/1/2020 15:43,41.0,0.0,0.0,CN,CHN
327,02-01-2020,156,Mainland China,China,Gansu,2/1/2020 15:43,40.0,0.0,0.0,CN,CHN
328,02-01-2020,156,Mainland China,China,Guizhou,1/31/2020 15:20,29.0,0.0,2.0,CN,CHN
329,02-01-2020,156,Mainland China,China,Ningxia,2/1/2020 2:13,26.0,0.0,0.0,CN,CHN
330,02-01-2020,156,Mainland China,China,Inner Mongolia,2/1/2020 5:37,23.0,0.0,1.0,CN,CHN
331,02-01-2020,156,Mainland China,China,Xinjiang,2/1/2020 5:37,18.0,0.0,0.0,CN,CHN
332,02-01-2020,156,Mainland China,China,Jilin,2/1/2020 1:52,17.0,0.0,1.0,CN,CHN
333,02-01-2020,156,Mainland China,China,Qinghai,2/1/2020 5:37,9.0,0.0,0.0,CN,CHN
334,02-01-2020,156,Mainland China,China,Tibet,2/1/2020 1:52,1.0,0.0,0.0,CN,CHN
335,02-02-2020,156,Mainland China,China,Hubei,2020-02-02T23:43:02,11177.0,350.0,295.0,CN,CHN
336,02-02-2020,156,Mainland China,China,Zhejiang,2020-02-02T18:03:05,661.0,0.0,32.0,CN,CHN
337,02-02-2020,156,Mainland China,China,Guangdong,2020-02-02T18:03:05,632.0,0.0,15.0,CN,CHN
338,02-02-2020,156,Mainland China,China,Henan,2020-02-02T18:03:05,493.0,2.0,10.0,CN,CHN
339,02-02-2020,156,Mainland China,China,Hunan,2020-02-02T18:03:05,463.0,0.0,16.0,CN,CHN
340,02-02-2020,156,Mainland China,China,Anhui,2020-02-02T18:03:05,340.0,0.0,7.0,CN,CHN
341,02-02-2020,156,Mainland China,China,Jiangxi,2020-02-02T18:03:05,333.0,0.0,12.0,CN,CHN
342,02-02-2020,156,Mainland China,China,Chongqing,2020-02-02T23:33:02,300.0,2.0,7.0,CN,CHN
343,02-02-2020,156,Mainland China,China,Jiangsu,2020-02-02T18:03:05,236.0,0.0,7.0,CN,CHN
344,02-02-2020,156,Mainland China,China,Sichuan,2020-02-02T18:03:05,231.0,1.0,11.0,CN,CHN
345,02-02-2020,156,Mainland China,China,Shandong,2020-02-02T18:03:05,230.0,0.0,6.0,CN,CHN
346,02-02-2020,156,Mainland China,China,Beijing,2020-02-02T08:43:02,191.0,1.0,9.0,CN,CHN
347,02-02-2020,156,Mainland China,China,Shanghai,2020-02-02T05:53:02,182.0,1.0,10.0,CN,CHN
348,02-02-2020,156,Mainland China,China,Fujian,2020-02-02T03:43:01,159.0,0.0,0.0,CN,CHN
349,02-02-2020,156,Mainland China,China,Shaanxi,2020-02-02T03:23:14,116.0,0.0,0.0,CN,CHN
350,02-02-2020,156,Mainland China,China,Guangxi,2020-02-02T00:23:13,111.0,0.0,2.0,CN,CHN
351,02-02-2020,156,Mainland China,China,Yunnan,2020-02-02T18:03:05,105.0,0.0,3.0,CN,CHN
352,02-02-2020,156,Mainland China,China,Hebei,2020-02-02T02:53:02,104.0,1.0,3.0,CN,CHN
353,02-02-2020,156,Mainland China,China,Heilongjiang,2020-02-02T03:23:14,95.0,2.0,2.0,CN,CHN
354,02-02-2020,156,Mainland China,China,Liaoning,2020-02-02T18:03:05,70.0,0.0,1.0,CN,CHN
355,02-02-2020,156,Mainland China,China,Shanxi,2020-02-02T23:23:13,66.0,0.0,3.0,CN,CHN
356,02-02-2020,156,Mainland China,China,Hainan,2020-02-02T18:03:05,64.0,1.0,4.0,CN,CHN
357,02-02-2020,156,Mainland China,China,Gansu,2020-02-02T23:43:02,51.0,0.0,3.0,CN,CHN
358,02-02-2020,156,Mainland China,China,Tianjin,2020-02-02T09:43:01,48.0,0.0,1.0,CN,CHN
359,02-02-2020,156,Mainland China,China,Guizhou,2020-02-02T01:03:32,38.0,0.0,2.0,CN,CHN
360,02-02-2020,156,Mainland China,China,Ningxia,2020-02-02T01:43:02,28.0,0.0,0.0,CN,CHN
361,02-02-2020,156,Mainland China,China,Inner Mongolia,2020-02-02T03:43:01,27.0,0.0,1.0,CN,CHN
362,02-02-2020,156,Mainland China,China,Jilin,2020-02-02T02:33:02,23.0,0.0,1.0,CN,CHN
363,02-02-2020,156,Mainland China,China,Xinjiang,2020-02-02T00:43:02,21.0,0.0,0.0,CN,CHN
364,02-02-2020,156,Mainland China,China,Qinghai,2020-02-02T05:33:03,11.0,0.0,0.0,CN,CHN
365,02-02-2020,156,Mainland China,China,Tibet,2020-02-01T01:52:40,1.0,0.0,0.0,CN,CHN
366,02-03-2020,156,Mainland China,China,Hubei,2020-02-03T23:23:03,13522.0,414.0,386.0,CN,CHN
367,02-03-2020,156,Mainland China,China,Guangdong,2020-02-03T12:53:02,725.0,0.0,21.0,CN,CHN
368,02-03-2020,156,Mainland China,China,Zhejiang,2020-02-03T13:33:02,724.0,0.0,43.0,CN,CHN
369,02-03-2020,156,Mainland China,China,Henan,2020-02-03T17:11:34,566.0,2.0,16.0,CN,CHN
370,02-03-2020,156,Mainland China,China,Hunan,2020-02-03T11:03:10,521.0,0.0,22.0,CN,CHN
371,02-03-2020,156,Mainland China,China,Anhui,2020-02-03T17:11:34,408.0,0.0,14.0,CN,CHN
372,02-03-2020,156,Mainland China,China,Jiangxi,2020-02-03T01:33:02,391.0,0.0,18.0,CN,CHN
373,02-03-2020,156,Mainland China,China,Chongqing,2020-02-03T23:43:02,337.0,2.0,9.0,CN,CHN
374,02-03-2020,156,Mainland China,China,Jiangsu,2020-02-03T11:03:10,271.0,0.0,8.0,CN,CHN
375,02-03-2020,156,Mainland China,China,Shandong,2020-02-03T17:11:34,259.0,0.0,7.0,CN,CHN
376,02-03-2020,156,Mainland China,China,Sichuan,2020-02-03T11:23:23,254.0,1.0,14.0,CN,CHN
377,02-03-2020,156,Mainland China,China,Beijing,2020-02-03T09:23:05,212.0,1.0,12.0,CN,CHN
378,02-03-2020,156,Mainland China,China,Shanghai,2020-02-03T07:03:12,203.0,1.0,10.0,CN,CHN
379,02-03-2020,156,Mainland China,China,Fujian,2020-02-03T11:33:13,179.0,0.0,1.0,CN,CHN
380,02-03-2020,156,Mainland China,China,Shaanxi,2020-02-03T02:33:02,128.0,0.0,0.0,CN,CHN
381,02-03-2020,156,Mainland China,China,Guangxi,2020-02-03T12:33:02,127.0,0.0,7.0,CN,CHN
382,02-03-2020,156,Mainland China,China,Heilongjiang,2020-02-03T07:13:19,121.0,2.0,2.0,CN,CHN
383,02-03-2020,156,Mainland China,China,Yunnan,2020-02-03T23:23:03,117.0,0.0,5.0,CN,CHN
384,02-03-2020,156,Mainland China,China,Hebei,2020-02-03T00:23:14,113.0,1.0,3.0,CN,CHN
385,02-03-2020,156,Mainland China,China,Liaoning,2020-02-03T17:11:34,74.0,0.0,1.0,CN,CHN
386,02-03-2020,156,Mainland China,China,Shanxi,2020-02-03T23:13:11,74.0,0.0,2.0,CN,CHN
387,02-03-2020,156,Mainland China,China,Hainan,2020-02-03T17:11:34,72.0,1.0,4.0,CN,CHN
388,02-03-2020,156,Mainland China,China,Tianjin,2020-02-03T13:53:03,60.0,0.0,1.0,CN,CHN
389,02-03-2020,156,Mainland China,China,Gansu,2020-02-03T23:03:08,55.0,0.0,3.0,CN,CHN
390,02-03-2020,156,Mainland China,China,Guizhou,2020-02-03T01:03:22,46.0,0.0,2.0,CN,CHN
391,02-03-2020,156,Mainland China,China,Inner Mongolia,2020-02-03T03:03:09,34.0,0.0,1.0,CN,CHN
392,02-03-2020,156,Mainland China,China,Jilin,2020-02-03T00:53:03,31.0,0.0,1.0,CN,CHN
393,02-03-2020,156,Mainland China,China,Ningxia,2020-02-03T08:33:03,31.0,0.0,1.0,CN,CHN
394,02-03-2020,156,Mainland China,China,Xinjiang,2020-02-03T01:13:21,24.0,0.0,0.0,CN,CHN
395,02-03-2020,156,Mainland China,China,Qinghai,2020-02-03T02:43:01,13.0,0.0,0.0,CN,CHN
396,02-03-2020,156,Mainland China,China,Tibet,2020-02-01T01:52:40,1.0,0.0,0.0,CN,CHN
397,02-04-2020,156,Mainland China,China,Hubei,2020-02-04T23:43:01,16678.0,479.0,522.0,CN,CHN
398,02-04-2020,156,Mainland China,China,Zhejiang,2020-02-04T13:03:07,829.0,0.0,62.0,CN,CHN
399,02-04-2020,156,Mainland China,China,Guangdong,2020-02-04T13:03:07,813.0,0.0,30.0,CN,CHN
400,02-04-2020,156,Mainland China,China,Henan,2020-02-04T11:53:02,675.0,2.0,27.0,CN,CHN
401,02-04-2020,156,Mainland China,China,Hunan,2020-02-04T14:03:03,593.0,0.0,31.0,CN,CHN
402,02-04-2020,156,Mainland China,China,Anhui,2020-02-04T05:33:01,480.0,0.0,20.0,CN,CHN
403,02-04-2020,156,Mainland China,China,Jiangxi,2020-02-04T14:43:02,476.0,0.0,20.0,CN,CHN
404,02-04-2020,156,Mainland China,China,Chongqing,2020-02-04T23:43:01,366.0,2.0,9.0,CN,CHN
405,02-04-2020,156,Mainland China,China,Jiangsu,2020-02-04T11:53:02,308.0,0.0,12.0,CN,CHN
406,02-04-2020,156,Mainland China,China,Sichuan,2020-02-04T01:43:02,282.0,1.0,14.0,CN,CHN
407,02-04-2020,156,Mainland China,China,Shandong,2020-02-04T12:03:04,275.0,0.0,11.0,CN,CHN
408,02-04-2020,156,Mainland China,China,Beijing,2020-02-04T08:33:01,228.0,1.0,23.0,CN,CHN
409,02-04-2020,156,Mainland China,China,Shanghai,2020-02-04T06:33:02,219.0,1.0,12.0,CN,CHN
410,02-04-2020,156,Mainland China,China,Fujian,2020-02-04T12:13:11,194.0,0.0,3.0,CN,CHN
411,02-04-2020,156,Mainland China,China,Heilongjiang,2020-02-04T07:43:01,155.0,2.0,4.0,CN,CHN
412,02-04-2020,156,Mainland China,China,Shaanxi,2020-02-04T12:33:02,142.0,0.0,2.0,CN,CHN
413,02-04-2020,156,Mainland China,China,Guangxi,2020-02-04T05:53:01,139.0,0.0,10.0,CN,CHN
414,02-04-2020,156,Mainland China,China,Hebei,2020-02-04T08:53:01,126.0,1.0,4.0,CN,CHN
415,02-04-2020,156,Mainland China,China,Yunnan,2020-02-04T23:23:02,122.0,0.0,5.0,CN,CHN
416,02-04-2020,156,Mainland China,China,Liaoning,2020-02-04T14:13:08,81.0,0.0,2.0,CN,CHN
417,02-04-2020,156,Mainland China,China,Shanxi,2020-02-04T23:23:02,81.0,0.0,4.0,CN,CHN
418,02-04-2020,156,Mainland China,China,Hainan,2020-02-04T11:33:03,80.0,1.0,5.0,CN,CHN
419,02-04-2020,156,Mainland China,China,Tianjin,2020-02-04T13:33:02,67.0,0.0,2.0,CN,CHN
420,02-04-2020,156,Mainland China,China,Guizhou,2020-02-04T10:43:02,58.0,0.0,2.0,CN,CHN
421,02-04-2020,156,Mainland China,China,Gansu,2020-02-04T15:43:02,57.0,0.0,4.0,CN,CHN
422,02-04-2020,156,Mainland China,China,Jilin,2020-02-04T00:23:05,42.0,0.0,1.0,CN,CHN
423,02-04-2020,156,Mainland China,China,Inner Mongolia,2020-02-04T03:03:07,35.0,0.0,1.0,CN,CHN
424,02-04-2020,156,Mainland China,China,Ningxia,2020-02-04T02:13:18,34.0,0.0,1.0,CN,CHN
425,02-04-2020,156,Mainland China,China,Xinjiang,2020-02-04T01:33:01,29.0,0.0,0.0,CN,CHN
426,02-04-2020,156,Mainland China,China,Qinghai,2020-02-04T01:33:01,15.0,0.0,0.0,CN,CHN
427,02-04-2020,156,Mainland China,China,Tibet,2020-02-01T01:52:40,1.0,0.0,0.0,CN,CHN
428,02-05-2020,156,Mainland China,China,Hubei,2020-02-05T23:13:12,19665.0,549.0,633.0,CN,CHN
429,02-05-2020,156,Mainland China,China,Guangdong,2020-02-05T13:23:04,895.0,0.0,49.0,CN,CHN
430,02-05-2020,156,Mainland China,China,Zhejiang,2020-02-05T15:13:02,895.0,0.0,78.0,CN,CHN
431,02-05-2020,156,Mainland China,China,Henan,2020-02-05T15:03:02,764.0,2.0,47.0,CN,CHN
432,02-05-2020,156,Mainland China,China,Hunan,2020-02-05T15:23:02,661.0,0.0,54.0,CN,CHN
433,02-05-2020,156,Mainland China,China,Jiangxi,2020-02-05T01:33:07,548.0,0.0,27.0,CN,CHN
434,02-05-2020,156,Mainland China,China,Anhui,2020-02-05T13:43:02,530.0,0.0,23.0,CN,CHN
435,02-05-2020,156,Mainland China,China,Chongqing,2020-02-05T23:43:02,389.0,2.0,15.0,CN,CHN
436,02-05-2020,156,Mainland China,China,Jiangsu,2020-02-05T12:43:02,341.0,0.0,23.0,CN,CHN
437,02-05-2020,156,Mainland China,China,Shandong,2020-02-05T10:13:13,307.0,0.0,15.0,CN,CHN
438,02-05-2020,156,Mainland China,China,Sichuan,2020-02-05T10:13:13,301.0,1.0,24.0,CN,CHN
439,02-05-2020,156,Mainland China,China,Beijing,2020-02-05T05:43:02,253.0,1.0,24.0,CN,CHN
440,02-05-2020,156,Mainland China,China,Shanghai,2020-02-05T06:23:04,243.0,1.0,15.0,CN,CHN
441,02-05-2020,156,Mainland China,China,Fujian,2020-02-05T12:33:01,205.0,0.0,11.0,CN,CHN
442,02-05-2020,156,Mainland China,China,Heilongjiang,2020-02-05T12:13:04,190.0,2.0,7.0,CN,CHN
443,02-05-2020,156,Mainland China,China,Shaanxi,2020-02-05T08:43:01,165.0,0.0,6.0,CN,CHN
444,02-05-2020,156,Mainland China,China,Guangxi,2020-02-05T12:03:08,150.0,0.0,13.0,CN,CHN
445,02-05-2020,156,Mainland China,China,Hebei,2020-02-05T11:23:18,135.0,1.0,6.0,CN,CHN
446,02-05-2020,156,Mainland China,China,Yunnan,2020-02-05T23:33:02,128.0,0.0,5.0,CN,CHN
447,02-05-2020,156,Mainland China,China,Hainan,2020-02-05T16:43:04,99.0,1.0,5.0,CN,CHN
448,02-05-2020,156,Mainland China,China,Liaoning,2020-02-05T15:23:02,89.0,0.0,4.0,CN,CHN
449,02-05-2020,156,Mainland China,China,Shanxi,2020-02-05T15:23:02,81.0,0.0,5.0,CN,CHN
450,02-05-2020,156,Mainland China,China,Tianjin,2020-02-05T03:43:02,69.0,1.0,2.0,CN,CHN
451,02-05-2020,156,Mainland China,China,Guizhou,2020-02-05T12:33:02,64.0,1.0,9.0,CN,CHN
452,02-05-2020,156,Mainland China,China,Gansu,2020-02-05T16:23:06,62.0,0.0,6.0,CN,CHN
453,02-05-2020,156,Mainland China,China,Jilin,2020-02-05T11:03:16,54.0,0.0,2.0,CN,CHN
454,02-05-2020,156,Mainland China,China,Inner Mongolia,2020-02-05T08:53:02,42.0,0.0,3.0,CN,CHN
455,02-05-2020,156,Mainland China,China,Ningxia,2020-02-04T02:13:18,34.0,0.0,1.0,CN,CHN
456,02-05-2020,156,Mainland China,China,Xinjiang,2020-02-05T02:03:13,32.0,0.0,0.0,CN,CHN
457,02-05-2020,156,Mainland China,China,Qinghai,2020-02-05T03:13:05,17.0,0.0,3.0,CN,CHN
458,02-05-2020,156,Mainland China,China,Tibet,2020-02-01T01:52:40,1.0,0.0,0.0,CN,CHN
459,02-06-2020,156,Mainland China,China,Hubei,2020-02-06T23:23:02,22112.0,618.0,817.0,CN,CHN
460,02-06-2020,156,Mainland China,China,Guangdong,2020-02-06T12:43:02,970.0,0.0,69.0,CN,CHN
461,02-06-2020,156,Mainland China,China,Zhejiang,2020-02-06T10:53:04,954.0,0.0,94.0,CN,CHN
462,02-06-2020,156,Mainland China,China,Henan,2020-02-06T11:23:14,851.0,2.0,56.0,CN,CHN
463,02-06-2020,156,Mainland China,China,Hunan,2020-02-06T13:13:06,711.0,0.0,81.0,CN,CHN
464,02-06-2020,156,Mainland China,China,Jiangxi,2020-02-06T02:33:01,600.0,0.0,37.0,CN,CHN
465,02-06-2020,156,Mainland China,China,Anhui,2020-02-06T13:33:02,591.0,0.0,34.0,CN,CHN
466,02-06-2020,156,Mainland China,China,Chongqing,2020-02-06T23:33:02,411.0,2.0,24.0,CN,CHN
467,02-06-2020,156,Mainland China,China,Jiangsu,2020-02-06T08:03:10,373.0,0.0,34.0,CN,CHN
468,02-06-2020,156,Mainland China,China,Shandong,2020-02-06T07:53:02,347.0,0.0,27.0,CN,CHN
469,02-06-2020,156,Mainland China,China,Sichuan,2020-02-06T08:03:10,321.0,1.0,31.0,CN,CHN
470,02-06-2020,156,Mainland China,China,Beijing,2020-02-06T03:23:11,274.0,1.0,31.0,CN,CHN
471,02-06-2020,156,Mainland China,China,Shanghai,2020-02-06T06:53:07,257.0,1.0,25.0,CN,CHN
472,02-06-2020,156,Mainland China,China,Heilongjiang,2020-02-06T08:13:06,227.0,3.0,8.0,CN,CHN
473,02-06-2020,156,Mainland China,China,Fujian,2020-02-06T11:03:19,215.0,0.0,14.0,CN,CHN
474,02-06-2020,156,Mainland China,China,Shaanxi,2020-02-06T13:53:02,173.0,0.0,9.0,CN,CHN
475,02-06-2020,156,Mainland China,China,Guangxi,2020-02-06T04:13:13,168.0,0.0,14.0,CN,CHN
476,02-06-2020,156,Mainland China,China,Hebei,2020-02-06T13:53:02,157.0,1.0,13.0,CN,CHN
477,02-06-2020,156,Mainland China,China,Yunnan,2020-02-06T09:43:02,133.0,0.0,7.0,CN,CHN
478,02-06-2020,156,Mainland China,China,Hainan,2020-02-06T11:13:24,106.0,1.0,8.0,CN,CHN
479,02-06-2020,156,Mainland China,China,Shanxi,2020-02-06T23:03:02,96.0,0.0,12.0,CN,CHN
480,02-06-2020,156,Mainland China,China,Liaoning,2020-02-06T14:33:02,94.0,0.0,5.0,CN,CHN
481,02-06-2020,156,Mainland China,China,Tianjin,2020-02-06T23:43:01,79.0,1.0,2.0,CN,CHN
482,02-06-2020,156,Mainland China,China,Guizhou,2020-02-06T09:53:02,71.0,1.0,6.0,CN,CHN
483,02-06-2020,156,Mainland China,China,Gansu,2020-02-05T16:23:06,62.0,0.0,6.0,CN,CHN
484,02-06-2020,156,Mainland China,China,Jilin,2020-02-06T14:23:04,59.0,0.0,4.0,CN,CHN
485,02-06-2020,156,Mainland China,China,Inner Mongolia,2020-02-06T02:23:08,46.0,0.0,4.0,CN,CHN
486,02-06-2020,156,Mainland China,China,Ningxia,2020-02-06T02:13:15,40.0,0.0,1.0,CN,CHN
487,02-06-2020,156,Mainland China,China,Xinjiang,2020-02-06T01:13:08,36.0,0.0,0.0,CN,CHN
488,02-06-2020,156,Mainland China,China,Qinghai,2020-02-06T02:13:15,18.0,0.0,3.0,CN,CHN
489,02-06-2020,156,Mainland China,China,Tibet,2020-02-01T01:52:40,1.0,0.0,0.0,CN,CHN
490,02-07-2020,156,Mainland China,China,Hubei,2020-02-07T23:43:02,24953.0,699.0,1115.0,CN,CHN
491,02-07-2020,156,Mainland China,China,Guangdong,2020-02-07T10:13:06,1034.0,1.0,88.0,CN,CHN
492,02-07-2020,156,Mainland China,China,Zhejiang,2020-02-07T11:33:11,1006.0,0.0,123.0,CN,CHN
493,02-07-2020,156,Mainland China,China,Henan,2020-02-07T14:03:12,914.0,3.0,86.0,CN,CHN
494,02-07-2020,156,Mainland China,China,Hunan,2020-02-07T11:33:11,772.0,0.0,112.0,CN,CHN
495,02-07-2020,156,Mainland China,China,Anhui,2020-02-07T05:13:07,665.0,0.0,47.0,CN,CHN
496,02-07-2020,156,Mainland China,China,Jiangxi,2020-02-07T01:23:02,661.0,0.0,45.0,CN,CHN
497,02-07-2020,156,Mainland China,China,Chongqing,2020-02-07T23:33:02,426.0,2.0,31.0,CN,CHN
498,02-07-2020,156,Mainland China,China,Jiangsu,2020-02-07T14:03:12,408.0,0.0,43.0,CN,CHN
499,02-07-2020,156,Mainland China,China,Shandong,2020-02-07T11:33:11,386.0,0.0,37.0,CN,CHN
500,02-07-2020,156,Mainland China,China,Sichuan,2020-02-07T08:23:09,344.0,1.0,42.0,CN,CHN
501,02-07-2020,156,Mainland China,China,Beijing,2020-02-07T03:23:02,297.0,1.0,33.0,CN,CHN
502,02-07-2020,156,Mainland China,China,Heilongjiang,2020-02-07T07:43:02,277.0,3.0,12.0,CN,CHN
503,02-07-2020,156,Mainland China,China,Shanghai,2020-02-07T06:14:15,277.0,1.0,30.0,CN,CHN
504,02-07-2020,156,Mainland China,China,Fujian,2020-02-07T13:23:03,224.0,0.0,20.0,CN,CHN
505,02-07-2020,156,Mainland China,China,Shaanxi,2020-02-07T08:23:09,184.0,0.0,17.0,CN,CHN
506,02-07-2020,156,Mainland China,China,Guangxi,2020-02-07T00:33:02,172.0,0.0,17.0,CN,CHN
507,02-07-2020,156,Mainland China,China,Hebei,2020-02-07T12:03:04,172.0,1.0,22.0,CN,CHN
508,02-07-2020,156,Mainland China,China,Yunnan,2020-02-07T23:23:04,138.0,0.0,12.0,CN,CHN
509,02-07-2020,156,Mainland China,China,Hainan,2020-02-07T12:33:02,117.0,2.0,10.0,CN,CHN
510,02-07-2020,156,Mainland China,China,Shanxi,2020-02-07T23:43:02,104.0,0.0,15.0,CN,CHN
511,02-07-2020,156,Mainland China,China,Liaoning,2020-02-07T15:33:03,99.0,0.0,7.0,CN,CHN
512,02-07-2020,156,Mainland China,China,Guizhou,2020-02-07T11:13:07,81.0,1.0,6.0,CN,CHN
513,02-07-2020,156,Mainland China,China,Tianjin,2020-02-07T05:43:03,81.0,1.0,2.0,CN,CHN
514,02-07-2020,156,Mainland China,China,Gansu,2020-02-07T02:33:06,67.0,0.0,9.0,CN,CHN
515,02-07-2020,156,Mainland China,China,Jilin,2020-02-07T00:43:02,65.0,1.0,4.0,CN,CHN
516,02-07-2020,156,Mainland China,China,Inner Mongolia,2020-02-07T11:13:07,50.0,0.0,5.0,CN,CHN
517,02-07-2020,156,Mainland China,China,Ningxia,2020-02-07T11:13:07,43.0,0.0,5.0,CN,CHN
518,02-07-2020,156,Mainland China,China,Xinjiang,2020-02-07T01:43:02,39.0,0.0,0.0,CN,CHN
519,02-07-2020,156,Mainland China,China,Qinghai,2020-02-06T02:13:15,18.0,0.0,3.0,CN,CHN
520,02-07-2020,156,Mainland China,China,Tibet,2020-02-01T01:52:40,1.0,0.0,0.0,CN,CHN
521,02-08-2020,156,Mainland China,China,Hubei,2020-02-08T23:33:06,27100.0,780.0,1439.0,CN,CHN
522,02-08-2020,156,Mainland China,China,Guangdong,2020-02-08T11:53:01,1095.0,1.0,112.0,CN,CHN
523,02-08-2020,156,Mainland China,China,Zhejiang,2020-02-08T10:53:02,1048.0,0.0,175.0,CN,CHN
524,02-08-2020,156,Mainland China,China,Henan,2020-02-08T14:13:12,981.0,4.0,116.0,CN,CHN
525,02-08-2020,156,Mainland China,China,Hunan,2020-02-08T12:53:01,803.0,1.0,156.0,CN,CHN
526,02-08-2020,156,Mainland China,China,Anhui,2020-02-08T07:43:02,733.0,0.0,59.0,CN,CHN
527,02-08-2020,156,Mainland China,China,Jiangxi,2020-02-08T01:23:02,698.0,0.0,55.0,CN,CHN
528,02-08-2020,156,Mainland China,China,Jiangsu,2020-02-08T10:23:04,439.0,0.0,51.0,CN,CHN
529,02-08-2020,156,Mainland China,China,Chongqing,2020-02-08T11:03:15,428.0,2.0,39.0,CN,CHN
530,02-08-2020,156,Mainland China,China,Shandong,2020-02-08T11:33:02,416.0,0.0,44.0,CN,CHN
531,02-08-2020,156,Mainland China,China,Sichuan,2020-02-08T15:23:04,364.0,1.0,60.0,CN,CHN
532,02-08-2020,156,Mainland China,China,Beijing,2020-02-08T03:13:09,315.0,2.0,34.0,CN,CHN
533,02-08-2020,156,Mainland China,China,Heilongjiang,2020-02-08T04:03:09,295.0,5.0,13.0,CN,CHN
534,02-08-2020,156,Mainland China,China,Shanghai,2020-02-08T06:33:02,286.0,1.0,41.0,CN,CHN
535,02-08-2020,156,Mainland China,China,Fujian,2020-02-08T08:13:10,239.0,0.0,24.0,CN,CHN
536,02-08-2020,156,Mainland China,China,Hebei,2020-02-08T11:33:02,195.0,1.0,30.0,CN,CHN
537,02-08-2020,156,Mainland China,China,Shaanxi,2020-02-08T10:13:06,195.0,0.0,20.0,CN,CHN
538,02-08-2020,156,Mainland China,China,Guangxi,2020-02-08T00:23:03,183.0,0.0,17.0,CN,CHN
539,02-08-2020,156,Mainland China,China,Yunnan,2020-02-08T08:43:02,138.0,0.0,17.0,CN,CHN
540,02-08-2020,156,Mainland China,China,Hainan,2020-02-08T10:23:04,124.0,2.0,14.0,CN,CHN
541,02-08-2020,156,Mainland China,China,Shanxi,2020-02-08T23:53:02,115.0,0.0,21.0,CN,CHN
542,02-08-2020,156,Mainland China,China,Liaoning,2020-02-08T11:53:01,105.0,0.0,8.0,CN,CHN
543,02-08-2020,156,Mainland China,China,Guizhou,2020-02-08T06:43:03,89.0,1.0,7.0,CN,CHN
544,02-08-2020,156,Mainland China,China,Tianjin,2020-02-08T08:23:04,88.0,1.0,4.0,CN,CHN
545,02-08-2020,156,Mainland China,China,Gansu,2020-02-08T15:13:14,79.0,1.0,12.0,CN,CHN
546,02-08-2020,156,Mainland China,China,Jilin,2020-02-08T00:13:04,69.0,1.0,4.0,CN,CHN
547,02-08-2020,156,Mainland China,China,Inner Mongolia,2020-02-08T03:33:02,52.0,0.0,5.0,CN,CHN
548,02-08-2020,156,Mainland China,China,Ningxia,2020-02-08T09:13:16,45.0,0.0,15.0,CN,CHN
549,02-08-2020,156,Mainland China,China,Xinjiang,2020-02-08T03:23:10,42.0,0.0,0.0,CN,CHN
550,02-08-2020,156,Mainland China,China,Qinghai,2020-02-06T02:13:15,18.0,0.0,3.0,CN,CHN
551,02-08-2020,156,Mainland China,China,Tibet,2020-02-01T01:52:40,1.0,0.0,0.0,CN,CHN
552,02-09-2020,156,Mainland China,China,Hubei,2020-02-09T23:33:02,29631.0,871.0,1795.0,CN,CHN
553,02-09-2020,156,Mainland China,China,Guangdong,2020-02-09T15:03:05,1131.0,1.0,141.0,CN,CHN
554,02-09-2020,156,Mainland China,China,Zhejiang,2020-02-09T12:03:04,1075.0,0.0,201.0,CN,CHN
555,02-09-2020,156,Mainland China,China,Henan,2020-02-09T11:23:08,1033.0,6.0,153.0,CN,CHN
556,02-09-2020,156,Mainland China,China,Hunan,2020-02-09T12:33:01,838.0,1.0,186.0,CN,CHN
557,02-09-2020,156,Mainland China,China,Anhui,2020-02-09T09:33:02,779.0,1.0,72.0,CN,CHN
558,02-09-2020,156,Mainland China,China,Jiangxi,2020-02-09T11:33:12,740.0,0.0,73.0,CN,CHN
559,02-09-2020,156,Mainland China,China,Chongqing,2020-02-09T23:53:02,468.0,2.0,51.0,CN,CHN
560,02-09-2020,156,Mainland China,China,Jiangsu,2020-02-09T10:23:11,468.0,0.0,71.0,CN,CHN
561,02-09-2020,156,Mainland China,China,Shandong,2020-02-09T15:03:05,444.0,1.0,63.0,CN,CHN
562,02-09-2020,156,Mainland China,China,Sichuan,2020-02-09T12:43:01,386.0,1.0,71.0,CN,CHN
563,02-09-2020,156,Mainland China,China,Beijing,2020-02-09T03:43:02,326.0,2.0,37.0,CN,CHN
564,02-09-2020,156,Mainland China,China,Heilongjiang,2020-02-09T08:43:05,307.0,6.0,14.0,CN,CHN
565,02-09-2020,156,Mainland China,China,Shanghai,2020-02-09T06:33:01,293.0,1.0,44.0,CN,CHN
566,02-09-2020,156,Mainland China,China,Fujian,2020-02-09T09:13:11,250.0,0.0,35.0,CN,CHN
567,02-09-2020,156,Mainland China,China,Shaanxi,2020-02-09T03:03:09,208.0,0.0,25.0,CN,CHN
568,02-09-2020,156,Mainland China,China,Hebei,2020-02-09T12:43:01,206.0,2.0,34.0,CN,CHN
569,02-09-2020,156,Mainland China,China,Guangxi,2020-02-09T00:33:07,195.0,1.0,18.0,CN,CHN
570,02-09-2020,156,Mainland China,China,Yunnan,2020-02-09T08:53:02,141.0,0.0,18.0,CN,CHN
571,02-09-2020,156,Mainland China,China,Hainan,2020-02-09T13:33:02,131.0,3.0,19.0,CN,CHN
572,02-09-2020,156,Mainland China,China,Shanxi,2020-02-09T23:43:02,119.0,0.0,25.0,CN,CHN
573,02-09-2020,156,Mainland China,China,Liaoning,2020-02-09T12:23:03,107.0,0.0,12.0,CN,CHN
574,02-09-2020,156,Mainland China,China,Guizhou,2020-02-09T09:53:02,99.0,1.0,7.0,CN,CHN
575,02-09-2020,156,Mainland China,China,Tianjin,2020-02-09T23:43:02,91.0,1.0,4.0,CN,CHN
576,02-09-2020,156,Mainland China,China,Gansu,2020-02-09T23:33:02,83.0,2.0,16.0,CN,CHN
577,02-09-2020,156,Mainland China,China,Jilin,2020-02-09T09:03:04,78.0,1.0,12.0,CN,CHN
578,02-09-2020,156,Mainland China,China,Inner Mongolia,2020-02-09T02:23:07,54.0,0.0,5.0,CN,CHN
579,02-09-2020,156,Mainland China,China,Ningxia,2020-02-09T02:03:11,45.0,0.0,13.0,CN,CHN
580,02-09-2020,156,Mainland China,China,Xinjiang,2020-02-09T01:23:08,45.0,0.0,0.0,CN,CHN
581,02-09-2020,156,Mainland China,China,Qinghai,2020-02-06T02:13:15,18.0,0.0,3.0,CN,CHN
582,02-09-2020,156,Mainland China,China,Tibet,2020-02-01T01:52:40,1.0,0.0,0.0,CN,CHN
583,02-10-2020,156,Mainland China,China,Hubei,2020-02-10T23:33:02,31728.0,974.0,2222.0,CN,CHN
584,02-10-2020,156,Mainland China,China,Guangdong,2020-02-10T13:43:02,1159.0,1.0,167.0,CN,CHN
585,02-10-2020,156,Mainland China,China,Zhejiang,2020-02-10T14:13:12,1092.0,0.0,242.0,CN,CHN
586,02-10-2020,156,Mainland China,China,Henan,2020-02-10T13:53:02,1073.0,6.0,191.0,CN,CHN
587,02-10-2020,156,Mainland China,China,Hunan,2020-02-10T13:53:02,879.0,1.0,208.0,CN,CHN
588,02-10-2020,156,Mainland China,China,Anhui,2020-02-10T07:23:04,830.0,3.0,88.0,CN,CHN
589,02-10-2020,156,Mainland China,China,Jiangxi,2020-02-10T13:53:02,771.0,1.0,105.0,CN,CHN
590,02-10-2020,156,Mainland China,China,Jiangsu,2020-02-10T14:03:05,492.0,0.0,81.0,CN,CHN
591,02-10-2020,156,Mainland China,China,Chongqing,2020-02-10T23:43:02,486.0,2.0,66.0,CN,CHN
592,02-10-2020,156,Mainland China,China,Shandong,2020-02-10T09:33:02,466.0,1.0,66.0,CN,CHN
593,02-10-2020,156,Mainland China,China,Sichuan,2020-02-10T10:03:02,405.0,1.0,80.0,CN,CHN
594,02-10-2020,156,Mainland China,China,Beijing,2020-02-10T03:13:08,337.0,2.0,44.0,CN,CHN
595,02-10-2020,156,Mainland China,China,Heilongjiang,2020-02-10T07:33:05,331.0,7.0,30.0,CN,CHN
596,02-10-2020,156,Mainland China,China,Shanghai,2020-02-10T06:03:13,299.0,1.0,48.0,CN,CHN
597,02-10-2020,156,Mainland China,China,Fujian,2020-02-10T14:03:05,261.0,0.0,39.0,CN,CHN
598,02-10-2020,156,Mainland China,China,Hebei,2020-02-10T10:03:02,218.0,2.0,41.0,CN,CHN
599,02-10-2020,156,Mainland China,China,Shaanxi,2020-02-10T13:23:06,213.0,0.0,30.0,CN,CHN
600,02-10-2020,156,Mainland China,China,Guangxi,2020-02-10T14:03:05,210.0,1.0,24.0,CN,CHN
601,02-10-2020,156,Mainland China,China,Yunnan,2020-02-10T09:43:02,149.0,0.0,19.0,CN,CHN
602,02-10-2020,156,Mainland China,China,Hainan,2020-02-10T09:33:02,138.0,3.0,19.0,CN,CHN
603,02-10-2020,156,Mainland China,China,Shanxi,2020-02-09T23:43:02,119.0,0.0,25.0,CN,CHN
604,02-10-2020,156,Mainland China,China,Guizhou,2020-02-10T12:33:02,109.0,1.0,10.0,CN,CHN
605,02-10-2020,156,Mainland China,China,Liaoning,2020-02-10T14:03:05,108.0,0.0,13.0,CN,CHN
606,02-10-2020,156,Mainland China,China,Tianjin,2020-02-10T14:23:08,95.0,1.0,8.0,CN,CHN
607,02-10-2020,156,Mainland China,China,Gansu,2020-02-10T07:23:04,83.0,2.0,17.0,CN,CHN
608,02-10-2020,156,Mainland China,China,Jilin,2020-02-10T14:03:05,80.0,1.0,13.0,CN,CHN
609,02-10-2020,156,Mainland China,China,Inner Mongolia,2020-02-10T02:43:05,58.0,0.0,5.0,CN,CHN
610,02-10-2020,156,Mainland China,China,Ningxia,2020-02-10T01:43:02,49.0,0.0,13.0,CN,CHN
611,02-10-2020,156,Mainland China,China,Xinjiang,2020-02-10T01:13:06,49.0,0.0,0.0,CN,CHN
612,02-10-2020,156,Mainland China,China,Qinghai,2020-02-06T02:13:15,18.0,0.0,3.0,CN,CHN
613,02-10-2020,156,Mainland China,China,Tibet,2020-02-01T01:52:40,1.0,0.0,0.0,CN,CHN
614,02-11-2020,156,Mainland China,China,Hubei,2020-02-11T23:33:02,33366.0,1068.0,2639.0,CN,CHN
615,02-11-2020,156,Mainland China,China,Guangdong,2020-02-11T14:03:05,1177.0,1.0,212.0,CN,CHN
616,02-11-2020,156,Mainland China,China,Zhejiang,2020-02-11T12:53:02,1117.0,0.0,270.0,CN,CHN
617,02-11-2020,156,Mainland China,China,Henan,2020-02-11T14:03:05,1105.0,7.0,218.0,CN,CHN
618,02-11-2020,156,Mainland China,China,Hunan,2020-02-11T12:53:02,912.0,1.0,247.0,CN,CHN
619,02-11-2020,156,Mainland China,China,Anhui,2020-02-11T09:43:02,860.0,4.0,105.0,CN,CHN
620,02-11-2020,156,Mainland China,China,Jiangxi,2020-02-11T14:03:05,804.0,1.0,128.0,CN,CHN
621,02-11-2020,156,Mainland China,China,Jiangsu,2020-02-11T08:13:06,515.0,0.0,93.0,CN,CHN
622,02-11-2020,156,Mainland China,China,Chongqing,2020-02-11T23:53:02,505.0,3.0,79.0,CN,CHN
623,02-11-2020,156,Mainland China,China,Shandong,2020-02-11T11:23:04,487.0,1.0,80.0,CN,CHN
624,02-11-2020,156,Mainland China,China,Sichuan,2020-02-11T11:23:04,417.0,1.0,85.0,CN,CHN
625,02-11-2020,156,Mainland China,China,Heilongjiang,2020-02-11T11:23:04,360.0,8.0,28.0,CN,CHN
626,02-11-2020,156,Mainland China,China,Beijing,2020-02-11T03:03:07,342.0,3.0,48.0,CN,CHN
627,02-11-2020,156,Mainland China,China,Shanghai,2020-02-11T06:23:02,303.0,1.0,52.0,CN,CHN
628,02-11-2020,156,Mainland China,China,Fujian,2020-02-11T14:03:05,267.0,0.0,45.0,CN,CHN
629,02-11-2020,156,Mainland China,China,Hebei,2020-02-11T11:23:04,239.0,2.0,48.0,CN,CHN
630,02-11-2020,156,Mainland China,China,Shaanxi,2020-02-11T06:03:16,219.0,0.0,32.0,CN,CHN
631,02-11-2020,156,Mainland China,China,Guangxi,2020-02-11T11:23:04,215.0,1.0,33.0,CN,CHN
632,02-11-2020,156,Mainland China,China,Yunnan,2020-02-11T09:23:04,153.0,0.0,20.0,CN,CHN
633,02-11-2020,156,Mainland China,China,Hainan,2020-02-11T14:33:02,144.0,3.0,20.0,CN,CHN
634,02-11-2020,156,Mainland China,China,Guizhou,2020-02-11T14:03:05,127.0,1.0,17.0,CN,CHN
635,02-11-2020,156,Mainland China,China,Shanxi,2020-02-11T23:33:02,124.0,0.0,30.0,CN,CHN
636,02-11-2020,156,Mainland China,China,Liaoning,2020-02-11T12:53:02,111.0,0.0,19.0,CN,CHN
637,02-11-2020,156,Mainland China,China,Tianjin,2020-02-11T23:13:05,106.0,2.0,10.0,CN,CHN
638,02-11-2020,156,Mainland China,China,Gansu,2020-02-11T15:23:04,86.0,2.0,24.0,CN,CHN
639,02-11-2020,156,Mainland China,China,Jilin,2020-02-11T08:03:06,81.0,1.0,18.0,CN,CHN
640,02-11-2020,156,Mainland China,China,Inner Mongolia,2020-02-10T02:43:05,58.0,0.0,5.0,CN,CHN
641,02-11-2020,156,Mainland China,China,Xinjiang,2020-02-11T09:13:11,55.0,0.0,3.0,CN,CHN
642,02-11-2020,156,Mainland China,China,Ningxia,2020-02-11T10:03:08,53.0,0.0,22.0,CN,CHN
643,02-11-2020,156,Mainland China,China,Qinghai,2020-02-11T11:23:04,18.0,0.0,5.0,CN,CHN
644,02-11-2020,156,Mainland China,China,Tibet,2020-02-01T01:52:40,1.0,0.0,0.0,CN,CHN
645,02-12-2020,156,Mainland China,China,Hubei,2020-02-12T14:13:08,33366.0,1068.0,2686.0,CN,CHN
646,02-12-2020,156,Mainland China,China,Guangdong,2020-02-12T12:23:09,1219.0,1.0,275.0,CN,CHN
647,02-12-2020,156,Mainland China,China,Henan,2020-02-12T14:13:08,1135.0,8.0,246.0,CN,CHN
648,02-12-2020,156,Mainland China,China,Zhejiang,2020-02-12T10:13:20,1131.0,0.0,321.0,CN,CHN
649,02-12-2020,156,Mainland China,China,Hunan,2020-02-12T12:43:03,946.0,2.0,304.0,CN,CHN
650,02-12-2020,156,Mainland China,China,Anhui,2020-02-12T10:13:20,889.0,4.0,127.0,CN,CHN
651,02-12-2020,156,Mainland China,China,Jiangxi,2020-02-12T01:23:06,844.0,1.0,152.0,CN,CHN
652,02-12-2020,156,Mainland China,China,Jiangsu,2020-02-12T14:13:08,543.0,0.0,125.0,CN,CHN
653,02-12-2020,156,Mainland China,China,Chongqing,2020-02-12T23:13:08,518.0,3.0,102.0,CN,CHN
654,02-12-2020,156,Mainland China,China,Shandong,2020-02-12T11:13:05,497.0,2.0,92.0,CN,CHN
655,02-12-2020,156,Mainland China,China,Sichuan,2020-02-12T12:43:03,436.0,1.0,92.0,CN,CHN
656,02-12-2020,156,Mainland China,China,Heilongjiang,2020-02-12T14:13:08,378.0,8.0,31.0,CN,CHN
657,02-12-2020,156,Mainland China,China,Beijing,2020-02-12T02:43:03,352.0,3.0,56.0,CN,CHN
658,02-12-2020,156,Mainland China,China,Shanghai,2020-02-12T06:23:08,311.0,1.0,57.0,CN,CHN
659,02-12-2020,156,Mainland China,China,Fujian,2020-02-12T11:53:02,272.0,0.0,53.0,CN,CHN
660,02-12-2020,156,Mainland China,China,Hebei,2020-02-12T11:13:05,251.0,2.0,54.0,CN,CHN
661,02-12-2020,156,Mainland China,China,Shaanxi,2020-02-12T11:13:05,225.0,0.0,43.0,CN,CHN
662,02-12-2020,156,Mainland China,China,Guangxi,2020-02-12T15:03:05,222.0,1.0,32.0,CN,CHN
663,02-12-2020,156,Mainland China,China,Hainan,2020-02-12T17:03:03,157.0,4.0,27.0,CN,CHN
664,02-12-2020,156,Mainland China,China,Yunnan,2020-02-12T14:13:08,154.0,0.0,26.0,CN,CHN
665,02-12-2020,156,Mainland China,China,Guizhou,2020-02-12T09:43:02,133.0,1.0,18.0,CN,CHN
666,02-12-2020,156,Mainland China,China,Shanxi,2020-02-12T23:03:02,126.0,0.0,33.0,CN,CHN
667,02-12-2020,156,Mainland China,China,Liaoning,2020-02-12T13:33:02,116.0,1.0,20.0,CN,CHN
668,02-12-2020,156,Mainland China,China,Tianjin,2020-02-12T15:03:05,112.0,2.0,11.0,CN,CHN
669,02-12-2020,156,Mainland China,China,Gansu,2020-02-12T23:23:01,87.0,2.0,31.0,CN,CHN
670,02-12-2020,156,Mainland China,China,Jilin,2020-02-12T14:13:08,83.0,1.0,22.0,CN,CHN
671,02-12-2020,156,Mainland China,China,Inner Mongolia,2020-02-12T11:13:05,60.0,0.0,6.0,CN,CHN
672,02-12-2020,156,Mainland China,China,Xinjiang,2020-02-12T01:43:02,59.0,0.0,3.0,CN,CHN
673,02-12-2020,156,Mainland China,China,Ningxia,2020-02-12T11:13:05,58.0,0.0,24.0,CN,CHN
674,02-12-2020,156,Mainland China,China,Qinghai,2020-02-12T08:03:06,18.0,0.0,9.0,CN,CHN
675,02-12-2020,156,Mainland China,China,Tibet,2020-02-12T06:43:02,1.0,0.0,1.0,CN,CHN
676,02-13-2020,156,Mainland China,China,Hubei,2020-02-13T14:13:06,48206.0,1310.0,3459.0,CN,CHN
677,02-13-2020,156,Mainland China,China,Guangdong,2020-02-13T13:33:01,1241.0,2.0,314.0,CN,CHN
678,02-13-2020,156,Mainland China,China,Henan,2020-02-13T14:53:02,1169.0,10.0,296.0,CN,CHN
679,02-13-2020,156,Mainland China,China,Zhejiang,2020-02-13T14:13:06,1145.0,0.0,360.0,CN,CHN
680,02-13-2020,156,Mainland China,China,Hunan,2020-02-13T11:53:02,968.0,2.0,339.0,CN,CHN
681,02-13-2020,156,Mainland China,China,Anhui,2020-02-13T13:33:01,910.0,5.0,157.0,CN,CHN
682,02-13-2020,156,Mainland China,China,Jiangxi,2020-02-13T01:13:08,872.0,1.0,170.0,CN,CHN
683,02-13-2020,156,Mainland China,China,Jiangsu,2020-02-13T10:33:23,570.0,0.0,139.0,CN,CHN
684,02-13-2020,156,Mainland China,China,Chongqing,2020-02-13T23:23:05,529.0,4.0,128.0,CN,CHN
685,02-13-2020,156,Mainland China,China,Shandong,2020-02-13T13:33:01,509.0,2.0,105.0,CN,CHN
686,02-13-2020,156,Mainland China,China,Sichuan,2020-02-13T13:33:01,451.0,1.0,104.0,CN,CHN
687,02-13-2020,156,Mainland China,China,Heilongjiang,2020-02-13T12:13:06,395.0,9.0,33.0,CN,CHN
688,02-13-2020,156,Mainland China,China,Beijing,2020-02-13T14:13:06,366.0,3.0,69.0,CN,CHN
689,02-13-2020,156,Mainland China,China,Shanghai,2020-02-13T06:13:15,315.0,1.0,62.0,CN,CHN
690,02-13-2020,156,Mainland China,China,Fujian,2020-02-13T10:33:23,279.0,0.0,57.0,CN,CHN
691,02-13-2020,156,Mainland China,China,Hebei,2020-02-13T10:33:23,265.0,3.0,68.0,CN,CHN
692,02-13-2020,156,Mainland China,China,Shaanxi,2020-02-13T10:33:23,229.0,0.0,46.0,CN,CHN
693,02-13-2020,156,Mainland China,China,Guangxi,2020-02-13T00:23:10,222.0,2.0,33.0,CN,CHN
694,02-13-2020,156,Mainland China,China,Hainan,2020-02-13T10:43:03,157.0,4.0,30.0,CN,CHN
695,02-13-2020,156,Mainland China,China,Yunnan,2020-02-13T08:43:08,156.0,0.0,27.0,CN,CHN
696,02-13-2020,156,Mainland China,China,Guizhou,2020-02-13T10:33:23,135.0,1.0,27.0,CN,CHN
697,02-13-2020,156,Mainland China,China,Shanxi,2020-02-13T23:23:05,126.0,0.0,36.0,CN,CHN
698,02-13-2020,156,Mainland China,China,Tianjin,2020-02-13T23:43:02,119.0,3.0,21.0,CN,CHN
699,02-13-2020,156,Mainland China,China,Liaoning,2020-02-13T14:33:02,117.0,1.0,22.0,CN,CHN
700,02-13-2020,156,Mainland China,China,Gansu,2020-02-13T15:53:03,90.0,2.0,39.0,CN,CHN
701,02-13-2020,156,Mainland China,China,Jilin,2020-02-13T13:33:01,84.0,1.0,24.0,CN,CHN
702,02-13-2020,156,Mainland China,China,Ningxia,2020-02-13T01:23:08,64.0,0.0,24.0,CN,CHN
703,02-13-2020,156,Mainland China,China,Xinjiang,2020-02-13T10:33:23,63.0,1.0,6.0,CN,CHN
704,02-13-2020,156,Mainland China,China,Inner Mongolia,2020-02-13T01:23:08,61.0,0.0,6.0,CN,CHN
705,02-13-2020,156,Mainland China,China,Qinghai,2020-02-13T08:43:08,18.0,0.0,11.0,CN,CHN
706,02-13-2020,156,Mainland China,China,Tibet,2020-02-12T06:43:02,1.0,0.0,1.0,CN,CHN
707,02-14-2020,156,Mainland China,China,Hubei,2020-02-14T23:33:02,54406.0,1457.0,4774.0,CN,CHN
708,02-14-2020,156,Mainland China,China,Guangdong,2020-02-14T12:53:02,1261.0,2.0,362.0,CN,CHN
709,02-14-2020,156,Mainland China,China,Henan,2020-02-14T12:53:02,1184.0,11.0,357.0,CN,CHN
710,02-14-2020,156,Mainland China,China,Zhejiang,2020-02-14T14:13:15,1155.0,0.0,403.0,CN,CHN
711,02-14-2020,156,Mainland China,China,Hunan,2020-02-14T09:23:04,988.0,2.0,364.0,CN,CHN
712,02-14-2020,156,Mainland China,China,Anhui,2020-02-14T12:53:02,934.0,6.0,193.0,CN,CHN
713,02-14-2020,156,Mainland China,China,Jiangxi,2020-02-14T01:13:06,900.0,1.0,187.0,CN,CHN
714,02-14-2020,156,Mainland China,China,Jiangsu,2020-02-14T10:03:03,593.0,0.0,157.0,CN,CHN
715,02-14-2020,156,Mainland China,China,Chongqing,2020-02-14T23:33:02,537.0,5.0,152.0,CN,CHN
716,02-14-2020,156,Mainland China,China,Shandong,2020-02-14T11:13:22,523.0,2.0,136.0,CN,CHN
717,02-14-2020,156,Mainland China,China,Sichuan,2020-02-14T11:13:22,463.0,1.0,114.0,CN,CHN
718,02-14-2020,156,Mainland China,China,Heilongjiang,2020-02-14T13:23:07,419.0,11.0,47.0,CN,CHN
719,02-14-2020,156,Mainland China,China,Beijing,2020-02-14T06:33:02,372.0,3.0,80.0,CN,CHN
720,02-14-2020,156,Mainland China,China,Shanghai,2020-02-14T04:13:11,318.0,1.0,90.0,CN,CHN
721,02-14-2020,156,Mainland China,China,Hebei,2020-02-14T11:13:22,283.0,3.0,87.0,CN,CHN
722,02-14-2020,156,Mainland China,China,Fujian,2020-02-14T11:13:22,281.0,0.0,63.0,CN,CHN
723,02-14-2020,156,Mainland China,China,Shaanxi,2020-02-14T12:53:02,230.0,0.0,54.0,CN,CHN
724,02-14-2020,156,Mainland China,China,Guangxi,2020-02-14T15:23:02,226.0,2.0,36.0,CN,CHN
725,02-14-2020,156,Mainland China,China,Yunnan,2020-02-14T12:53:02,162.0,0.0,36.0,CN,CHN
726,02-14-2020,156,Mainland China,China,Hainan,2020-02-14T15:23:02,159.0,4.0,43.0,CN,CHN
727,02-14-2020,156,Mainland China,China,Guizhou,2020-02-14T01:53:02,140.0,1.0,28.0,CN,CHN
728,02-14-2020,156,Mainland China,China,Shanxi,2020-02-14T23:23:04,127.0,0.0,38.0,CN,CHN
729,02-14-2020,156,Mainland China,China,Tianjin,2020-02-14T11:13:22,120.0,3.0,31.0,CN,CHN
730,02-14-2020,156,Mainland China,China,Liaoning,2020-02-14T15:23:02,119.0,1.0,29.0,CN,CHN
731,02-14-2020,156,Mainland China,China,Gansu,2020-02-13T15:53:03,90.0,2.0,39.0,CN,CHN
732,02-14-2020,156,Mainland China,China,Jilin,2020-02-14T00:43:02,86.0,1.0,25.0,CN,CHN
733,02-14-2020,156,Mainland China,China,Ningxia,2020-02-14T01:43:02,67.0,0.0,24.0,CN,CHN
734,02-14-2020,156,Mainland China,China,Inner Mongolia,2020-02-14T02:03:08,65.0,0.0,6.0,CN,CHN
735,02-14-2020,156,Mainland China,China,Xinjiang,2020-02-14T01:13:06,65.0,1.0,6.0,CN,CHN
736,02-14-2020,156,Mainland China,China,Qinghai,2020-02-13T08:43:08,18.0,0.0,11.0,CN,CHN
737,02-14-2020,156,Mainland China,China,Tibet,2020-02-12T06:43:02,1.0,0.0,1.0,CN,CHN
738,02-15-2020,156,Mainland China,China,Hubei,2020-02-15T23:13:05,56249.0,1596.0,5623.0,CN,CHN
739,02-15-2020,156,Mainland China,China,Guangdong,2020-02-15T14:03:04,1294.0,2.0,410.0,CN,CHN
740,02-15-2020,156,Mainland China,China,Henan,2020-02-15T12:13:08,1212.0,13.0,391.0,CN,CHN
741,02-15-2020,156,Mainland China,China,Zhejiang,2020-02-15T11:23:17,1162.0,0.0,428.0,CN,CHN
742,02-15-2020,156,Mainland China,China,Hunan,2020-02-15T13:03:04,1001.0,2.0,425.0,CN,CHN
743,02-15-2020,156,Mainland China,China,Anhui,2020-02-15T12:13:08,950.0,6.0,221.0,CN,CHN
744,02-15-2020,156,Mainland China,China,Jiangxi,2020-02-15T01:33:02,913.0,1.0,210.0,CN,CHN
745,02-15-2020,156,Mainland China,China,Jiangsu,2020-02-15T12:13:08,604.0,0.0,186.0,CN,CHN
746,02-15-2020,156,Mainland China,China,Chongqing,2020-02-15T23:23:07,544.0,5.0,184.0,CN,CHN
747,02-15-2020,156,Mainland China,China,Shandong,2020-02-15T11:23:17,532.0,2.0,156.0,CN,CHN
748,02-15-2020,156,Mainland China,China,Sichuan,2020-02-15T08:43:03,470.0,1.0,119.0,CN,CHN
749,02-15-2020,156,Mainland China,China,Heilongjiang,2020-02-15T11:43:01,425.0,11.0,68.0,CN,CHN
750,02-15-2020,156,Mainland China,China,Beijing,2020-02-15T09:53:01,375.0,4.0,98.0,CN,CHN
751,02-15-2020,156,Mainland China,China,Shanghai,2020-02-15T03:13:06,326.0,1.0,124.0,CN,CHN
752,02-15-2020,156,Mainland China,China,Hebei,2020-02-15T13:03:04,291.0,3.0,101.0,CN,CHN
753,02-15-2020,156,Mainland China,China,Fujian,2020-02-15T13:03:04,285.0,0.0,71.0,CN,CHN
754,02-15-2020,156,Mainland China,China,Guangxi,2020-02-15T06:33:01,235.0,2.0,44.0,CN,CHN
755,02-15-2020,156,Mainland China,China,Shaanxi,2020-02-15T12:13:08,232.0,0.0,60.0,CN,CHN
756,02-15-2020,156,Mainland China,China,Yunnan,2020-02-15T06:33:01,168.0,0.0,42.0,CN,CHN
757,02-15-2020,156,Mainland China,China,Hainan,2020-02-15T11:23:17,162.0,4.0,39.0,CN,CHN
758,02-15-2020,156,Mainland China,China,Guizhou,2020-02-15T14:53:04,143.0,1.0,41.0,CN,CHN
759,02-15-2020,156,Mainland China,China,Shanxi,2020-02-15T23:13:05,128.0,0.0,46.0,CN,CHN
760,02-15-2020,156,Mainland China,China,Tianjin,2020-02-15T13:43:01,122.0,3.0,37.0,CN,CHN
761,02-15-2020,156,Mainland China,China,Liaoning,2020-02-15T09:53:01,119.0,1.0,31.0,CN,CHN
762,02-15-2020,156,Mainland China,China,Gansu,2020-02-15T12:13:08,90.0,2.0,49.0,CN,CHN
763,02-15-2020,156,Mainland China,China,Jilin,2020-02-15T12:13:08,88.0,1.0,26.0,CN,CHN
764,02-15-2020,156,Mainland China,China,Ningxia,2020-02-15T08:43:03,70.0,0.0,33.0,CN,CHN
765,02-15-2020,156,Mainland China,China,Xinjiang,2020-02-15T09:53:01,70.0,1.0,10.0,CN,CHN
766,02-15-2020,156,Mainland China,China,Inner Mongolia,2020-02-15T14:03:04,68.0,0.0,7.0,CN,CHN
767,02-15-2020,156,Mainland China,China,Qinghai,2020-02-15T08:43:03,18.0,0.0,13.0,CN,CHN
768,02-15-2020,156,Mainland China,China,Tibet,2020-02-12T06:43:02,1.0,0.0,1.0,CN,CHN
769,02-16-2020,156,Mainland China,China,Hubei,2020-02-16T23:53:01,58182.0,1696.0,6639.0,CN,CHN
770,02-16-2020,156,Mainland China,China,Guangdong,2020-02-16T12:03:06,1316.0,2.0,465.0,CN,CHN
771,02-16-2020,156,Mainland China,China,Henan,2020-02-16T13:53:03,1231.0,13.0,440.0,CN,CHN
772,02-16-2020,156,Mainland China,China,Zhejiang,2020-02-16T09:33:02,1167.0,0.0,456.0,CN,CHN
773,02-16-2020,156,Mainland China,China,Hunan,2020-02-16T13:13:04,1004.0,3.0,464.0,CN,CHN
774,02-16-2020,156,Mainland China,China,Anhui,2020-02-16T08:33:02,962.0,6.0,255.0,CN,CHN
775,02-16-2020,156,Mainland China,China,Jiangxi,2020-02-16T10:03:06,925.0,1.0,240.0,CN,CHN
776,02-16-2020,156,Mainland China,China,Jiangsu,2020-02-16T09:33:02,617.0,0.0,218.0,CN,CHN
777,02-16-2020,156,Mainland China,China,Chongqing,2020-02-16T23:53:01,551.0,5.0,207.0,CN,CHN
778,02-16-2020,156,Mainland China,China,Shandong,2020-02-16T12:03:06,537.0,2.0,173.0,CN,CHN
779,02-16-2020,156,Mainland China,China,Sichuan,2020-02-16T10:03:06,481.0,3.0,131.0,CN,CHN
780,02-16-2020,156,Mainland China,China,Heilongjiang,2020-02-16T13:53:03,445.0,11.0,79.0,CN,CHN
781,02-16-2020,156,Mainland China,China,Beijing,2020-02-16T10:03:06,380.0,4.0,108.0,CN,CHN
782,02-16-2020,156,Mainland China,China,Shanghai,2020-02-16T02:53:02,328.0,1.0,140.0,CN,CHN
783,02-16-2020,156,Mainland China,China,Hebei,2020-02-16T12:03:06,300.0,3.0,105.0,CN,CHN
784,02-16-2020,156,Mainland China,China,Fujian,2020-02-16T12:03:06,287.0,0.0,82.0,CN,CHN
785,02-16-2020,156,Mainland China,China,Guangxi,2020-02-16T12:03:06,237.0,2.0,49.0,CN,CHN
786,02-16-2020,156,Mainland China,China,Shaanxi,2020-02-16T13:53:03,236.0,0.0,71.0,CN,CHN
787,02-16-2020,156,Mainland China,China,Yunnan,2020-02-16T09:53:01,171.0,0.0,42.0,CN,CHN
788,02-16-2020,156,Mainland China,China,Hainan,2020-02-16T12:03:06,162.0,4.0,52.0,CN,CHN
789,02-16-2020,156,Mainland China,China,Guizhou,2020-02-16T09:13:09,144.0,1.0,46.0,CN,CHN
790,02-16-2020,156,Mainland China,China,Shanxi,2020-02-16T23:53:01,129.0,0.0,50.0,CN,CHN
791,02-16-2020,156,Mainland China,China,Tianjin,2020-02-16T12:23:02,124.0,3.0,45.0,CN,CHN
792,02-16-2020,156,Mainland China,China,Liaoning,2020-02-16T12:03:06,121.0,1.0,40.0,CN,CHN
793,02-16-2020,156,Mainland China,China,Gansu,2020-02-16T13:53:03,90.0,2.0,54.0,CN,CHN
794,02-16-2020,156,Mainland China,China,Jilin,2020-02-16T10:03:06,89.0,1.0,30.0,CN,CHN
795,02-16-2020,156,Mainland China,China,Xinjiang,2020-02-16T08:33:02,71.0,1.0,12.0,CN,CHN
796,02-16-2020,156,Mainland China,China,Inner Mongolia,2020-02-16T08:33:02,70.0,0.0,8.0,CN,CHN
797,02-16-2020,156,Mainland China,China,Ningxia,2020-02-15T08:43:03,70.0,0.0,33.0,CN,CHN
798,02-16-2020,156,Mainland China,China,Qinghai,2020-02-15T08:43:03,18.0,0.0,13.0,CN,CHN
799,02-16-2020,156,Mainland China,China,Tibet,2020-02-12T06:43:02,1.0,0.0,1.0,CN,CHN
800,02-17-2020,156,Mainland China,China,Hubei,2020-02-17T23:13:06,59989.0,1789.0,7862.0,CN,CHN
801,02-17-2020,156,Mainland China,China,Guangdong,2020-02-17T12:43:02,1322.0,4.0,524.0,CN,CHN
802,02-17-2020,156,Mainland China,China,Henan,2020-02-17T14:53:02,1246.0,16.0,509.0,CN,CHN
803,02-17-2020,156,Mainland China,China,Zhejiang,2020-02-17T11:23:06,1171.0,0.0,507.0,CN,CHN
804,02-17-2020,156,Mainland China,China,Hunan,2020-02-17T11:43:01,1006.0,3.0,498.0,CN,CHN
805,02-17-2020,156,Mainland China,China,Anhui,2020-02-17T09:13:07,973.0,6.0,280.0,CN,CHN
806,02-17-2020,156,Mainland China,China,Jiangxi,2020-02-17T01:33:02,930.0,1.0,275.0,CN,CHN
807,02-17-2020,156,Mainland China,China,Jiangsu,2020-02-17T10:23:04,626.0,0.0,258.0,CN,CHN
808,02-17-2020,156,Mainland China,China,Chongqing,2020-02-17T23:13:06,553.0,5.0,225.0,CN,CHN
809,02-17-2020,156,Mainland China,China,Shandong,2020-02-17T11:03:06,541.0,2.0,191.0,CN,CHN
810,02-17-2020,156,Mainland China,China,Sichuan,2020-02-17T13:13:09,495.0,3.0,156.0,CN,CHN
811,02-17-2020,156,Mainland China,China,Heilongjiang,2020-02-17T08:03:06,457.0,11.0,85.0,CN,CHN
812,02-17-2020,156,Mainland China,China,Beijing,2020-02-17T01:23:02,381.0,4.0,114.0,CN,CHN
813,02-17-2020,156,Mainland China,China,Shanghai,2020-02-17T23:53:02,333.0,1.0,161.0,CN,CHN
814,02-17-2020,156,Mainland China,China,Hebei,2020-02-17T13:03:06,301.0,3.0,122.0,CN,CHN
815,02-17-2020,156,Mainland China,China,Fujian,2020-02-17T10:23:04,290.0,0.0,90.0,CN,CHN
816,02-17-2020,156,Mainland China,China,Shaanxi,2020-02-17T11:43:01,240.0,0.0,79.0,CN,CHN
817,02-17-2020,156,Mainland China,China,Guangxi,2020-02-17T10:23:04,238.0,2.0,53.0,CN,CHN
818,02-17-2020,156,Mainland China,China,Yunnan,2020-02-17T10:23:04,171.0,0.0,47.0,CN,CHN
819,02-17-2020,156,Mainland China,China,Hainan,2020-02-17T11:03:06,163.0,4.0,59.0,CN,CHN
820,02-17-2020,156,Mainland China,China,Guizhou,2020-02-17T11:13:16,146.0,1.0,57.0,CN,CHN
821,02-17-2020,156,Mainland China,China,Shanxi,2020-02-17T22:53:01,130.0,0.0,53.0,CN,CHN
822,02-17-2020,156,Mainland China,China,Tianjin,2020-02-17T12:43:02,125.0,3.0,46.0,CN,CHN
823,02-17-2020,156,Mainland China,China,Liaoning,2020-02-17T11:13:16,121.0,1.0,43.0,CN,CHN
824,02-17-2020,156,Mainland China,China,Gansu,2020-02-17T14:53:02,91.0,2.0,58.0,CN,CHN
825,02-17-2020,156,Mainland China,China,Jilin,2020-02-17T11:03:06,89.0,1.0,34.0,CN,CHN
826,02-17-2020,156,Mainland China,China,Xinjiang,2020-02-17T01:53:01,75.0,1.0,12.0,CN,CHN
827,02-17-2020,156,Mainland China,China,Inner Mongolia,2020-02-17T02:03:06,72.0,0.0,8.0,CN,CHN
828,02-17-2020,156,Mainland China,China,Ningxia,2020-02-17T11:03:06,70.0,0.0,35.0,CN,CHN
829,02-17-2020,156,Mainland China,China,Qinghai,2020-02-15T08:43:03,18.0,0.0,13.0,CN,CHN
830,02-17-2020,156,Mainland China,China,Tibet,2020-02-12T06:43:02,1.0,0.0,1.0,CN,CHN
831,02-18-2020,156,Mainland China,China,Hubei,2020-02-18T23:13:11,61682.0,1921.0,9128.0,CN,CHN
832,02-18-2020,156,Mainland China,China,Guangdong,2020-02-18T13:43:02,1328.0,4.0,565.0,CN,CHN
833,02-18-2020,156,Mainland China,China,Henan,2020-02-18T14:23:02,1257.0,19.0,522.0,CN,CHN
834,02-18-2020,156,Mainland China,China,Zhejiang,2020-02-18T12:23:02,1172.0,0.0,535.0,CN,CHN
835,02-18-2020,156,Mainland China,China,Hunan,2020-02-18T13:43:02,1007.0,4.0,527.0,CN,CHN
836,02-18-2020,156,Mainland China,China,Anhui,2020-02-18T13:43:02,982.0,6.0,361.0,CN,CHN
837,02-18-2020,156,Mainland China,China,Jiangxi,2020-02-18T01:33:01,933.0,1.0,310.0,CN,CHN
838,02-18-2020,156,Mainland China,China,Jiangsu,2020-02-18T12:33:02,629.0,0.0,280.0,CN,CHN
839,02-18-2020,156,Mainland China,China,Chongqing,2020-02-18T23:23:03,555.0,5.0,254.0,CN,CHN
840,02-18-2020,156,Mainland China,China,Shandong,2020-02-18T12:13:08,543.0,3.0,211.0,CN,CHN
841,02-18-2020,156,Mainland China,China,Sichuan,2020-02-18T12:33:02,508.0,3.0,169.0,CN,CHN
842,02-18-2020,156,Mainland China,China,Heilongjiang,2020-02-18T11:03:12,464.0,11.0,111.0,CN,CHN
843,02-18-2020,156,Mainland China,China,Beijing,2020-02-18T02:13:06,387.0,4.0,122.0,CN,CHN
844,02-18-2020,156,Mainland China,China,Shanghai,2020-02-18T05:03:08,333.0,1.0,177.0,CN,CHN
845,02-18-2020,156,Mainland China,China,Hebei,2020-02-18T23:53:01,306.0,4.0,136.0,CN,CHN
846,02-18-2020,156,Mainland China,China,Fujian,2020-02-18T09:43:08,292.0,0.0,93.0,CN,CHN
847,02-18-2020,156,Mainland China,China,Guangxi,2020-02-18T12:33:02,242.0,2.0,69.0,CN,CHN
848,02-18-2020,156,Mainland China,China,Shaanxi,2020-02-18T14:23:02,240.0,0.0,89.0,CN,CHN
849,02-18-2020,156,Mainland China,China,Yunnan,2020-02-18T09:43:08,172.0,0.0,57.0,CN,CHN
850,02-18-2020,156,Mainland China,China,Hainan,2020-02-18T10:43:02,163.0,4.0,79.0,CN,CHN
851,02-18-2020,156,Mainland China,China,Guizhou,2020-02-18T13:33:02,146.0,2.0,66.0,CN,CHN
852,02-18-2020,156,Mainland China,China,Shanxi,2020-02-18T23:23:03,131.0,0.0,61.0,CN,CHN
853,02-18-2020,156,Mainland China,China,Tianjin,2020-02-18T13:53:02,128.0,3.0,48.0,CN,CHN
854,02-18-2020,156,Mainland China,China,Liaoning,2020-02-18T12:53:02,121.0,1.0,53.0,CN,CHN
855,02-18-2020,156,Mainland China,China,Gansu,2020-02-18T14:53:02,91.0,2.0,62.0,CN,CHN
856,02-18-2020,156,Mainland China,China,Jilin,2020-02-18T07:43:02,89.0,1.0,36.0,CN,CHN
857,02-18-2020,156,Mainland China,China,Xinjiang,2020-02-18T01:03:15,76.0,1.0,12.0,CN,CHN
858,02-18-2020,156,Mainland China,China,Inner Mongolia,2020-02-18T02:03:06,73.0,0.0,8.0,CN,CHN
859,02-18-2020,156,Mainland China,China,Ningxia,2020-02-18T10:23:03,70.0,0.0,42.0,CN,CHN
860,02-18-2020,156,Mainland China,China,Qinghai,2020-02-18T07:43:02,18.0,0.0,15.0,CN,CHN
861,02-18-2020,156,Mainland China,China,Tibet,2020-02-12T06:43:02,1.0,0.0,1.0,CN,CHN
862,02-19-2020,156,Mainland China,China,Hubei,2020-02-19T23:23:02,62031.0,2029.0,10337.0,CN,CHN
863,02-19-2020,156,Mainland China,China,Guangdong,2020-02-19T10:23:02,1331.0,5.0,606.0,CN,CHN
864,02-19-2020,156,Mainland China,China,Henan,2020-02-19T12:13:08,1262.0,19.0,573.0,CN,CHN
865,02-19-2020,156,Mainland China,China,Zhejiang,2020-02-19T11:33:02,1174.0,0.0,604.0,CN,CHN
866,02-19-2020,156,Mainland China,China,Hunan,2020-02-19T11:33:02,1008.0,4.0,561.0,CN,CHN
867,02-19-2020,156,Mainland China,China,Anhui,2020-02-19T14:13:03,986.0,6.0,413.0,CN,CHN
868,02-19-2020,156,Mainland China,China,Jiangxi,2020-02-19T01:23:07,934.0,1.0,362.0,CN,CHN
869,02-19-2020,156,Mainland China,China,Jiangsu,2020-02-19T12:13:08,631.0,0.0,318.0,CN,CHN
870,02-19-2020,156,Mainland China,China,Chongqing,2020-02-19T23:23:02,560.0,5.0,274.0,CN,CHN
871,02-19-2020,156,Mainland China,China,Shandong,2020-02-19T12:03:07,544.0,3.0,231.0,CN,CHN
872,02-19-2020,156,Mainland China,China,Sichuan,2020-02-19T13:53:02,514.0,3.0,188.0,CN,CHN
873,02-19-2020,156,Mainland China,China,Heilongjiang,2020-02-19T11:03:08,470.0,12.0,120.0,CN,CHN
874,02-19-2020,156,Mainland China,China,Beijing,2020-02-19T04:53:02,393.0,4.0,145.0,CN,CHN
875,02-19-2020,156,Mainland China,China,Shanghai,2020-02-19T04:43:02,333.0,2.0,186.0,CN,CHN
876,02-19-2020,156,Mainland China,China,Hebei,2020-02-19T13:23:02,306.0,4.0,152.0,CN,CHN
877,02-19-2020,156,Mainland China,China,Fujian,2020-02-19T11:53:02,293.0,0.0,112.0,CN,CHN
878,02-19-2020,156,Mainland China,China,Guangxi,2020-02-19T09:13:12,244.0,2.0,86.0,CN,CHN
879,02-19-2020,156,Mainland China,China,Shaanxi,2020-02-19T10:23:02,242.0,0.0,102.0,CN,CHN
880,02-19-2020,156,Mainland China,China,Yunnan,2020-02-19T23:33:02,172.0,1.0,60.0,CN,CHN
881,02-19-2020,156,Mainland China,China,Hainan,2020-02-19T23:43:02,168.0,4.0,84.0,CN,CHN
882,02-19-2020,156,Mainland China,China,Guizhou,2020-02-19T10:53:02,146.0,2.0,70.0,CN,CHN
883,02-19-2020,156,Mainland China,China,Shanxi,2020-02-19T23:53:02,131.0,0.0,68.0,CN,CHN
884,02-19-2020,156,Mainland China,China,Tianjin,2020-02-19T13:03:03,130.0,3.0,54.0,CN,CHN
885,02-19-2020,156,Mainland China,China,Liaoning,2020-02-19T01:23:07,121.0,1.0,55.0,CN,CHN
886,02-19-2020,156,Mainland China,China,Gansu,2020-02-19T13:53:02,91.0,2.0,65.0,CN,CHN
887,02-19-2020,156,Mainland China,China,Jilin,2020-02-19T06:03:08,90.0,1.0,37.0,CN,CHN
888,02-19-2020,156,Mainland China,China,Xinjiang,2020-02-19T07:03:07,76.0,1.0,20.0,CN,CHN
889,02-19-2020,156,Mainland China,China,Inner Mongolia,2020-02-19T11:03:08,75.0,0.0,10.0,CN,CHN
890,02-19-2020,156,Mainland China,China,Ningxia,2020-02-19T01:53:02,71.0,0.0,42.0,CN,CHN
891,02-19-2020,156,Mainland China,China,Qinghai,2020-02-19T04:53:02,18.0,0.0,16.0,CN,CHN
892,02-19-2020,156,Mainland China,China,Tibet,2020-02-12T06:43:02,1.0,0.0,1.0,CN,CHN
893,02-20-2020,156,Mainland China,China,Hubei,2020-02-20T23:43:02,62442.0,2144.0,11788.0,CN,CHN
894,02-20-2020,156,Mainland China,China,Guangdong,2020-02-20T11:13:27,1332.0,5.0,642.0,CN,CHN
895,02-20-2020,156,Mainland China,China,Henan,2020-02-20T13:53:06,1265.0,19.0,637.0,CN,CHN
896,02-20-2020,156,Mainland China,China,Zhejiang,2020-02-20T11:13:27,1175.0,1.0,633.0,CN,CHN
897,02-20-2020,156,Mainland China,China,Hunan,2020-02-20T11:13:27,1010.0,4.0,634.0,CN,CHN
898,02-20-2020,156,Mainland China,China,Anhui,2020-02-20T09:53:02,987.0,6.0,474.0,CN,CHN
899,02-20-2020,156,Mainland China,China,Jiangxi,2020-02-20T05:23:02,934.0,1.0,433.0,CN,CHN
900,02-20-2020,156,Mainland China,China,Jiangsu,2020-02-20T12:53:02,631.0,0.0,356.0,CN,CHN
901,02-20-2020,156,Mainland China,China,Chongqing,2020-02-20T23:13:05,567.0,6.0,299.0,CN,CHN
902,02-20-2020,156,Mainland China,China,Shandong,2020-02-20T11:13:27,546.0,4.0,254.0,CN,CHN
903,02-20-2020,156,Mainland China,China,Sichuan,2020-02-20T09:53:02,520.0,3.0,217.0,CN,CHN
904,02-20-2020,156,Mainland China,China,Heilongjiang,2020-02-20T09:43:01,476.0,12.0,136.0,CN,CHN
905,02-20-2020,156,Mainland China,China,Beijing,2020-02-20T01:43:01,395.0,4.0,153.0,CN,CHN
906,02-20-2020,156,Mainland China,China,Shanghai,2020-02-20T06:03:03,334.0,2.0,199.0,CN,CHN
907,02-20-2020,156,Mainland China,China,Hebei,2020-02-20T11:13:27,307.0,5.0,169.0,CN,CHN
908,02-20-2020,156,Mainland China,China,Fujian,2020-02-20T12:23:02,293.0,1.0,126.0,CN,CHN
909,02-20-2020,156,Mainland China,China,Guangxi,2020-02-20T09:43:01,245.0,2.0,90.0,CN,CHN
910,02-20-2020,156,Mainland China,China,Shaanxi,2020-02-20T09:53:02,245.0,1.0,118.0,CN,CHN
911,02-20-2020,156,Mainland China,China,Yunnan,2020-02-20T23:13:05,174.0,2.0,79.0,CN,CHN
912,02-20-2020,156,Mainland China,China,Hainan,2020-02-20T09:53:02,168.0,4.0,86.0,CN,CHN
913,02-20-2020,156,Mainland China,China,Guizhou,2020-02-20T09:43:01,146.0,2.0,72.0,CN,CHN
914,02-20-2020,156,Mainland China,China,Shanxi,2020-02-20T23:13:05,132.0,0.0,76.0,CN,CHN
915,02-20-2020,156,Mainland China,China,Tianjin,2020-02-20T12:53:02,131.0,3.0,59.0,CN,CHN
916,02-20-2020,156,Mainland China,China,Liaoning,2020-02-20T06:23:02,121.0,1.0,59.0,CN,CHN
917,02-20-2020,156,Mainland China,China,Gansu,2020-02-20T14:13:17,91.0,2.0,71.0,CN,CHN
918,02-20-2020,156,Mainland China,China,Jilin,2020-02-20T09:43:01,91.0,1.0,43.0,CN,CHN
919,02-20-2020,156,Mainland China,China,Xinjiang,2020-02-20T13:33:02,76.0,1.0,22.0,CN,CHN
920,02-20-2020,156,Mainland China,China,Inner Mongolia,2020-02-20T12:53:02,75.0,0.0,16.0,CN,CHN
921,02-20-2020,156,Mainland China,China,Ningxia,2020-02-20T05:23:02,71.0,0.0,44.0,CN,CHN
922,02-20-2020,156,Mainland China,China,Qinghai,2020-02-19T04:53:02,18.0,0.0,16.0,CN,CHN
923,02-20-2020,156,Mainland China,China,Tibet,2020-02-12T06:43:02,1.0,0.0,1.0,CN,CHN
924,02-21-2020,156,Mainland China,China,Hubei,2020-02-21T13:03:09,62662.0,2144.0,11881.0,CN,CHN
925,02-21-2020,156,Mainland China,China,Guangdong,2020-02-21T10:13:09,1333.0,5.0,690.0,CN,CHN
926,02-21-2020,156,Mainland China,China,Henan,2020-02-21T13:43:02,1267.0,19.0,736.0,CN,CHN
927,02-21-2020,156,Mainland China,China,Zhejiang,2020-02-21T10:23:02,1203.0,1.0,679.0,CN,CHN
928,02-21-2020,156,Mainland China,China,Hunan,2020-02-21T15:13:07,1011.0,4.0,661.0,CN,CHN
929,02-21-2020,156,Mainland China,China,Anhui,2020-02-21T10:13:09,988.0,6.0,539.0,CN,CHN
930,02-21-2020,156,Mainland China,China,Jiangxi,2020-02-21T01:13:05,934.0,1.0,489.0,CN,CHN
931,02-21-2020,156,Mainland China,China,Shandong,2020-02-21T10:23:02,749.0,4.0,281.0,CN,CHN
932,02-21-2020,156,Mainland China,China,Jiangsu,2020-02-21T11:43:01,631.0,0.0,373.0,CN,CHN
933,02-21-2020,156,Mainland China,China,Chongqing,2020-02-21T23:13:14,572.0,6.0,316.0,CN,CHN
934,02-21-2020,156,Mainland China,China,Sichuan,2020-02-21T12:53:01,525.0,3.0,231.0,CN,CHN
935,02-21-2020,156,Mainland China,China,Heilongjiang,2020-02-21T11:43:01,479.0,12.0,175.0,CN,CHN
936,02-21-2020,156,Mainland China,China,Beijing,2020-02-21T01:03:09,396.0,4.0,169.0,CN,CHN
937,02-21-2020,156,Mainland China,China,Shanghai,2020-02-21T05:53:01,334.0,2.0,211.0,CN,CHN
938,02-21-2020,156,Mainland China,China,Hebei,2020-02-21T12:53:01,308.0,5.0,184.0,CN,CHN
939,02-21-2020,156,Mainland China,China,Fujian,2020-02-21T11:43:01,293.0,1.0,149.0,CN,CHN
940,02-21-2020,156,Mainland China,China,Guangxi,2020-02-21T11:43:01,246.0,2.0,97.0,CN,CHN
941,02-21-2020,156,Mainland China,China,Shaanxi,2020-02-21T11:43:01,245.0,1.0,134.0,CN,CHN
942,02-21-2020,156,Mainland China,China,Yunnan,2020-02-21T06:23:04,174.0,2.0,96.0,CN,CHN
943,02-21-2020,156,Mainland China,China,Hainan,2020-02-21T10:13:09,168.0,4.0,95.0,CN,CHN
944,02-21-2020,156,Mainland China,China,Guizhou,2020-02-21T12:53:01,146.0,2.0,77.0,CN,CHN
945,02-21-2020,156,Mainland China,China,Shanxi,2020-02-21T23:33:06,132.0,0.0,78.0,CN,CHN
946,02-21-2020,156,Mainland China,China,Tianjin,2020-02-21T12:53:01,132.0,3.0,62.0,CN,CHN
947,02-21-2020,156,Mainland China,China,Liaoning,2020-02-21T01:33:02,121.0,1.0,61.0,CN,CHN
948,02-21-2020,156,Mainland China,China,Gansu,2020-02-21T15:13:07,91.0,2.0,76.0,CN,CHN
949,02-21-2020,156,Mainland China,China,Jilin,2020-02-21T10:13:09,91.0,1.0,45.0,CN,CHN
950,02-21-2020,156,Mainland China,China,Xinjiang,2020-02-21T13:43:02,76.0,1.0,24.0,CN,CHN
951,02-21-2020,156,Mainland China,China,Inner Mongolia,2020-02-21T08:03:15,75.0,0.0,17.0,CN,CHN
952,02-21-2020,156,Mainland China,China,Ningxia,2020-02-21T06:23:04,71.0,0.0,48.0,CN,CHN
953,02-21-2020,156,Mainland China,China,Qinghai,2020-02-21T04:43:02,18.0,0.0,18.0,CN,CHN
954,02-21-2020,156,Mainland China,China,Tibet,2020-02-12T06:43:02,1.0,0.0,1.0,CN,CHN
955,02-22-2020,156,Mainland China,China,Hubei,2020-02-22T23:33:06,64084.0,2346.0,15299.0,CN,CHN
956,02-22-2020,156,Mainland China,China,Guangdong,2020-02-22T10:03:04,1339.0,5.0,728.0,CN,CHN
957,02-22-2020,156,Mainland China,China,Henan,2020-02-22T14:13:38,1270.0,19.0,830.0,CN,CHN
958,02-22-2020,156,Mainland China,China,Zhejiang,2020-02-22T11:13:13,1205.0,1.0,719.0,CN,CHN
959,02-22-2020,156,Mainland China,China,Hunan,2020-02-22T10:03:04,1013.0,4.0,692.0,CN,CHN
960,02-22-2020,156,Mainland China,China,Anhui,2020-02-22T07:43:03,989.0,6.0,597.0,CN,CHN
961,02-22-2020,156,Mainland China,China,Jiangxi,2020-02-22T06:13:05,934.0,1.0,555.0,CN,CHN
962,02-22-2020,156,Mainland China,China,Shandong,2020-02-22T09:43:02,750.0,4.0,302.0,CN,CHN
963,02-22-2020,156,Mainland China,China,Jiangsu,2020-02-22T07:43:03,631.0,0.0,401.0,CN,CHN
964,02-22-2020,156,Mainland China,China,Chongqing,2020-02-22T23:23:05,573.0,6.0,328.0,CN,CHN
965,02-22-2020,156,Mainland China,China,Sichuan,2020-02-22T13:03:03,526.0,3.0,250.0,CN,CHN
966,02-22-2020,156,Mainland China,China,Heilongjiang,2020-02-22T11:13:13,479.0,12.0,204.0,CN,CHN
967,02-22-2020,156,Mainland China,China,Beijing,2020-02-22T02:23:05,399.0,4.0,178.0,CN,CHN
968,02-22-2020,156,Mainland China,China,Shanghai,2020-02-22T06:33:17,335.0,3.0,227.0,CN,CHN
969,02-22-2020,156,Mainland China,China,Hebei,2020-02-22T12:33:04,309.0,6.0,203.0,CN,CHN
970,02-22-2020,156,Mainland China,China,Fujian,2020-02-22T14:03:04,293.0,1.0,162.0,CN,CHN
971,02-22-2020,156,Mainland China,China,Guangxi,2020-02-22T05:53:02,249.0,2.0,104.0,CN,CHN
972,02-22-2020,156,Mainland China,China,Shaanxi,2020-02-22T09:53:02,245.0,1.0,149.0,CN,CHN
973,02-22-2020,156,Mainland China,China,Yunnan,2020-02-22T04:43:02,174.0,2.0,107.0,CN,CHN
974,02-22-2020,156,Mainland China,China,Hainan,2020-02-22T09:53:02,168.0,4.0,104.0,CN,CHN
975,02-22-2020,156,Mainland China,China,Guizhou,2020-02-22T01:03:10,146.0,2.0,90.0,CN,CHN
976,02-22-2020,156,Mainland China,China,Tianjin,2020-02-22T12:33:04,135.0,3.0,65.0,CN,CHN
977,02-22-2020,156,Mainland China,China,Shanxi,2020-02-22T23:23:05,132.0,0.0,81.0,CN,CHN
978,02-22-2020,156,Mainland China,China,Liaoning,2020-02-22T02:23:05,121.0,1.0,66.0,CN,CHN
979,02-22-2020,156,Mainland China,China,Gansu,2020-02-21T15:13:07,91.0,2.0,76.0,CN,CHN
980,02-22-2020,156,Mainland China,China,Jilin,2020-02-22T12:33:04,91.0,1.0,52.0,CN,CHN
981,02-22-2020,156,Mainland China,China,Xinjiang,2020-02-22T11:13:14,76.0,2.0,25.0,CN,CHN
982,02-22-2020,156,Mainland China,China,Inner Mongolia,2020-02-22T23:53:01,75.0,0.0,26.0,CN,CHN
983,02-22-2020,156,Mainland China,China,Ningxia,2020-02-21T06:23:04,71.0,0.0,48.0,CN,CHN
984,02-22-2020,156,Mainland China,China,Qinghai,2020-02-21T04:43:02,18.0,0.0,18.0,CN,CHN
985,02-22-2020,156,Mainland China,China,Tibet,2020-02-12T06:43:02,1.0,0.0,1.0,CN,CHN
986,02-23-2020,156,Mainland China,China,Hubei,2020-02-23T11:33:03,64084.0,2346.0,15343.0,CN,CHN
987,02-23-2020,156,Mainland China,China,Guangdong,2020-02-23T08:53:02,1342.0,6.0,755.0,CN,CHN
988,02-23-2020,156,Mainland China,China,Henan,2020-02-23T10:23:02,1271.0,19.0,868.0,CN,CHN
989,02-23-2020,156,Mainland China,China,Zhejiang,2020-02-23T13:43:02,1205.0,1.0,760.0,CN,CHN
990,02-23-2020,156,Mainland China,China,Hunan,2020-02-23T10:33:03,1016.0,4.0,714.0,CN,CHN
991,02-23-2020,156,Mainland China,China,Anhui,2020-02-23T10:53:02,989.0,6.0,637.0,CN,CHN
992,02-23-2020,156,Mainland China,China,Jiangxi,2020-02-23T09:23:02,934.0,1.0,613.0,CN,CHN
993,02-23-2020,156,Mainland China,China,Shandong,2020-02-23T11:33:03,754.0,4.0,321.0,CN,CHN
994,02-23-2020,156,Mainland China,China,Jiangsu,2020-02-23T08:53:02,631.0,0.0,418.0,CN,CHN
995,02-23-2020,156,Mainland China,China,Chongqing,2020-02-23T23:13:05,575.0,6.0,335.0,CN,CHN
996,02-23-2020,156,Mainland China,China,Sichuan,2020-02-23T08:53:02,526.0,3.0,261.0,CN,CHN
997,02-23-2020,156,Mainland China,China,Heilongjiang,2020-02-23T13:43:02,480.0,12.0,222.0,CN,CHN
998,02-23-2020,156,Mainland China,China,Beijing,2020-02-23T01:13:13,399.0,4.0,189.0,CN,CHN
999,02-23-2020,156,Mainland China,China,Shanghai,2020-02-23T03:13:07,335.0,3.0,249.0,CN,CHN
1000,02-23-2020,156,Mainland China,China,Hebei,2020-02-23T11:33:03,311.0,6.0,219.0,CN,CHN
1001,02-23-2020,156,Mainland China,China,Fujian,2020-02-23T10:33:03,293.0,1.0,170.0,CN,CHN
1002,02-23-2020,156,Mainland China,China,Guangxi,2020-02-23T10:33:03,249.0,2.0,106.0,CN,CHN
1003,02-23-2020,156,Mainland China,China,Shaanxi,2020-02-23T12:13:14,245.0,1.0,163.0,CN,CHN
1004,02-23-2020,156,Mainland China,China,Yunnan,2020-02-23T05:33:03,174.0,2.0,115.0,CN,CHN
1005,02-23-2020,156,Mainland China,China,Hainan,2020-02-23T23:23:03,168.0,5.0,106.0,CN,CHN
1006,02-23-2020,156,Mainland China,China,Guizhou,2020-02-23T12:43:02,146.0,2.0,102.0,CN,CHN
1007,02-23-2020,156,Mainland China,China,Tianjin,2020-02-23T12:43:02,135.0,3.0,81.0,CN,CHN
1008,02-23-2020,156,Mainland China,China,Shanxi,2020-02-23T23:03:08,132.0,0.0,88.0,CN,CHN
1009,02-23-2020,156,Mainland China,China,Liaoning,2020-02-23T13:33:02,121.0,1.0,73.0,CN,CHN
1010,02-23-2020,156,Mainland China,China,Gansu,2020-02-23T13:23:06,91.0,2.0,78.0,CN,CHN
1011,02-23-2020,156,Mainland China,China,Jilin,2020-02-23T12:43:02,91.0,1.0,54.0,CN,CHN
1012,02-23-2020,156,Mainland China,China,Xinjiang,2020-02-23T14:43:04,76.0,2.0,28.0,CN,CHN
1013,02-23-2020,156,Mainland China,China,Inner Mongolia,2020-02-23T09:43:02,75.0,0.0,27.0,CN,CHN
1014,02-23-2020,156,Mainland China,China,Ningxia,2020-02-23T05:33:03,71.0,0.0,56.0,CN,CHN
1015,02-23-2020,156,Mainland China,China,Qinghai,2020-02-21T04:43:02,18.0,0.0,18.0,CN,CHN
1016,02-23-2020,156,Mainland China,China,Tibet,2020-02-12T06:43:02,1.0,0.0,1.0,CN,CHN
1017,02-24-2020,156,Mainland China,China,Hubei,2020-02-24T11:13:09,64287.0,2495.0,16748.0,CN,CHN
1018,02-24-2020,156,Mainland China,China,Guangdong,2020-02-24T10:23:02,1345.0,6.0,786.0,CN,CHN
1019,02-24-2020,156,Mainland China,China,Henan,2020-02-24T13:23:05,1271.0,19.0,943.0,CN,CHN
1020,02-24-2020,156,Mainland China,China,Zhejiang,2020-02-24T09:43:02,1205.0,1.0,782.0,CN,CHN
1021,02-24-2020,156,Mainland China,China,Hunan,2020-02-24T14:13:11,1016.0,4.0,731.0,CN,CHN
1022,02-24-2020,156,Mainland China,China,Anhui,2020-02-24T09:43:02,989.0,6.0,663.0,CN,CHN
1023,02-24-2020,156,Mainland China,China,Jiangxi,2020-02-24T01:23:09,934.0,1.0,645.0,CN,CHN
1024,02-24-2020,156,Mainland China,China,Shandong,2020-02-24T10:23:02,755.0,5.0,343.0,CN,CHN
1025,02-24-2020,156,Mainland China,China,Jiangsu,2020-02-24T14:53:02,631.0,0.0,452.0,CN,CHN
1026,02-24-2020,156,Mainland China,China,Chongqing,2020-02-24T23:23:01,576.0,6.0,349.0,CN,CHN
1027,02-24-2020,156,Mainland China,China,Sichuan,2020-02-24T14:13:11,527.0,3.0,276.0,CN,CHN
1028,02-24-2020,156,Mainland China,China,Heilongjiang,2020-02-24T14:53:02,480.0,12.0,227.0,CN,CHN
1029,02-24-2020,156,Mainland China,China,Beijing,2020-02-24T00:53:02,399.0,4.0,198.0,CN,CHN
1030,02-24-2020,156,Mainland China,China,Shanghai,2020-02-24T07:03:06,335.0,3.0,261.0,CN,CHN
1031,02-24-2020,156,Mainland China,China,Hebei,2020-02-24T14:13:11,311.0,6.0,234.0,CN,CHN
1032,02-24-2020,156,Mainland China,China,Fujian,2020-02-24T10:23:02,293.0,1.0,183.0,CN,CHN
1033,02-24-2020,156,Mainland China,China,Guangxi,2020-02-24T06:53:02,251.0,2.0,112.0,CN,CHN
1034,02-24-2020,156,Mainland China,China,Shaanxi,2020-02-24T14:53:02,245.0,1.0,173.0,CN,CHN
1035,02-24-2020,156,Mainland China,China,Yunnan,2020-02-24T23:13:02,174.0,2.0,124.0,CN,CHN
1036,02-24-2020,156,Mainland China,China,Hainan,2020-02-24T14:53:02,168.0,5.0,116.0,CN,CHN
1037,02-24-2020,156,Mainland China,China,Guizhou,2020-02-23T12:43:02,146.0,2.0,102.0,CN,CHN
1038,02-24-2020,156,Mainland China,China,Tianjin,2020-02-24T15:03:05,135.0,3.0,87.0,CN,CHN
1039,02-24-2020,156,Mainland China,China,Shanxi,2020-02-24T23:13:02,133.0,0.0,94.0,CN,CHN
1040,02-24-2020,156,Mainland China,China,Liaoning,2020-02-24T06:53:02,121.0,1.0,80.0,CN,CHN
1041,02-24-2020,156,Mainland China,China,Jilin,2020-02-24T09:43:02,93.0,1.0,60.0,CN,CHN
1042,02-24-2020,156,Mainland China,China,Gansu,2020-02-24T15:13:07,91.0,2.0,80.0,CN,CHN
1043,02-24-2020,156,Mainland China,China,Xinjiang,2020-02-24T15:03:05,76.0,2.0,30.0,CN,CHN
1044,02-24-2020,156,Mainland China,China,Inner Mongolia,2020-02-24T15:03:05,75.0,0.0,34.0,CN,CHN
1045,02-24-2020,156,Mainland China,China,Ningxia,2020-02-24T06:53:02,71.0,0.0,58.0,CN,CHN
1046,02-24-2020,156,Mainland China,China,Qinghai,2020-02-21T04:43:02,18.0,0.0,18.0,CN,CHN
1047,02-24-2020,156,Mainland China,China,Tibet,2020-02-12T06:43:02,1.0,0.0,1.0,CN,CHN
1048,02-25-2020,156,Mainland China,China,Hubei,2020-02-25T15:23:04,64786.0,2563.0,18971.0,CN,CHN
1049,02-25-2020,156,Mainland China,China,Guangdong,2020-02-25T08:53:02,1347.0,7.0,822.0,CN,CHN
1050,02-25-2020,156,Mainland China,China,Henan,2020-02-25T12:43:02,1271.0,19.0,1002.0,CN,CHN
1051,02-25-2020,156,Mainland China,China,Zhejiang,2020-02-25T09:13:05,1205.0,1.0,808.0,CN,CHN
1052,02-25-2020,156,Mainland China,China,Hunan,2020-02-25T15:03:05,1016.0,4.0,768.0,CN,CHN
1053,02-25-2020,156,Mainland China,China,Anhui,2020-02-25T06:33:02,989.0,6.0,712.0,CN,CHN
1054,02-25-2020,156,Mainland China,China,Jiangxi,2020-02-25T15:03:05,934.0,1.0,683.0,CN,CHN
1055,02-25-2020,156,Mainland China,China,Shandong,2020-02-25T12:53:02,756.0,6.0,355.0,CN,CHN
1056,02-25-2020,156,Mainland China,China,Jiangsu,2020-02-25T00:53:02,631.0,0.0,458.0,CN,CHN
1057,02-25-2020,156,Mainland China,China,Chongqing,2020-02-25T23:23:03,576.0,6.0,372.0,CN,CHN
1058,02-25-2020,156,Mainland China,China,Sichuan,2020-02-25T15:03:05,529.0,3.0,289.0,CN,CHN
1059,02-25-2020,156,Mainland China,China,Heilongjiang,2020-02-25T15:23:04,480.0,12.0,243.0,CN,CHN
1060,02-25-2020,156,Mainland China,China,Beijing,2020-02-25T01:33:02,400.0,4.0,215.0,CN,CHN
1061,02-25-2020,156,Mainland China,China,Shanghai,2020-02-25T06:33:02,336.0,3.0,268.0,CN,CHN
1062,02-25-2020,156,Mainland China,China,Hebei,2020-02-25T12:43:02,311.0,6.0,248.0,CN,CHN
1063,02-25-2020,156,Mainland China,China,Fujian,2020-02-25T10:03:07,294.0,1.0,199.0,CN,CHN
1064,02-25-2020,156,Mainland China,China,Guangxi,2020-02-25T10:03:07,252.0,2.0,134.0,CN,CHN
1065,02-25-2020,156,Mainland China,China,Shaanxi,2020-02-25T15:23:04,245.0,1.0,186.0,CN,CHN
1066,02-25-2020,156,Mainland China,China,Yunnan,2020-02-25T04:53:02,174.0,2.0,129.0,CN,CHN
1067,02-25-2020,156,Mainland China,China,Hainan,2020-02-25T12:53:02,168.0,5.0,124.0,CN,CHN
1068,02-25-2020,156,Mainland China,China,Guizhou,2020-02-25T08:03:07,146.0,2.0,104.0,CN,CHN
1069,02-25-2020,156,Mainland China,China,Tianjin,2020-02-25T15:23:04,135.0,3.0,91.0,CN,CHN
1070,02-25-2020,156,Mainland China,China,Shanxi,2020-02-25T23:13:03,133.0,0.0,98.0,CN,CHN
1071,02-25-2020,156,Mainland China,China,Liaoning,2020-02-25T00:23:03,121.0,1.0,83.0,CN,CHN
1072,02-25-2020,156,Mainland China,China,Jilin,2020-02-25T15:23:04,93.0,1.0,63.0,CN,CHN
1073,02-25-2020,156,Mainland China,China,Gansu,2020-02-24T15:13:07,91.0,2.0,80.0,CN,CHN
1074,02-25-2020,156,Mainland China,China,Xinjiang,2020-02-24T15:03:05,76.0,2.0,30.0,CN,CHN
1075,02-25-2020,156,Mainland China,China,Inner Mongolia,2020-02-25T23:53:02,75.0,0.0,35.0,CN,CHN
1076,02-25-2020,156,Mainland China,China,Ningxia,2020-02-25T03:53:02,71.0,0.0,61.0,CN,CHN
1077,02-25-2020,156,Mainland China,China,Qinghai,2020-02-21T04:43:02,18.0,0.0,18.0,CN,CHN
1078,02-25-2020,156,Mainland China,China,Tibet,2020-02-12T06:43:02,1.0,0.0,1.0,CN,CHN
1079,02-26-2020,156,Mainland China,China,Hubei,2020-02-26T14:13:10,65187.0,2615.0,20969.0,CN,CHN
1080,02-26-2020,156,Mainland China,China,Guangdong,2020-02-26T10:33:02,1347.0,7.0,851.0,CN,CHN
1081,02-26-2020,156,Mainland China,China,Henan,2020-02-26T10:33:02,1271.0,19.0,1033.0,CN,CHN
1082,02-26-2020,156,Mainland China,China,Zhejiang,2020-02-26T10:33:02,1205.0,1.0,867.0,CN,CHN
1083,02-26-2020,156,Mainland China,China,Hunan,2020-02-26T10:13:11,1016.0,4.0,783.0,CN,CHN
1084,02-26-2020,156,Mainland China,China,Anhui,2020-02-26T10:13:11,989.0,6.0,744.0,CN,CHN
1085,02-26-2020,156,Mainland China,China,Jiangxi,2020-02-26T01:13:04,934.0,1.0,719.0,CN,CHN
1086,02-26-2020,156,Mainland China,China,Shandong,2020-02-26T12:43:02,756.0,6.0,377.0,CN,CHN
1087,02-26-2020,156,Mainland China,China,Jiangsu,2020-02-26T10:13:11,631.0,0.0,478.0,CN,CHN
1088,02-26-2020,156,Mainland China,China,Chongqing,2020-02-26T23:43:02,576.0,6.0,384.0,CN,CHN
1089,02-26-2020,156,Mainland China,China,Sichuan,2020-02-26T10:13:11,531.0,3.0,307.0,CN,CHN
1090,02-26-2020,156,Mainland China,China,Heilongjiang,2020-02-26T10:33:02,480.0,12.0,249.0,CN,CHN
1091,02-26-2020,156,Mainland China,China,Beijing,2020-02-26T00:53:02,400.0,4.0,235.0,CN,CHN
1092,02-26-2020,156,Mainland China,China,Shanghai,2020-02-26T23:53:01,337.0,3.0,272.0,CN,CHN
1093,02-26-2020,156,Mainland China,China,Hebei,2020-02-26T10:33:02,312.0,6.0,261.0,CN,CHN
1094,02-26-2020,156,Mainland China,China,Fujian,2020-02-26T10:33:02,294.0,1.0,218.0,CN,CHN
1095,02-26-2020,156,Mainland China,China,Guangxi,2020-02-26T14:13:10,252.0,2.0,147.0,CN,CHN
1096,02-26-2020,156,Mainland China,China,Shaanxi,2020-02-26T14:13:10,245.0,1.0,192.0,CN,CHN
1097,02-26-2020,156,Mainland China,China,Yunnan,2020-02-26T05:13:16,174.0,2.0,144.0,CN,CHN
1098,02-26-2020,156,Mainland China,China,Hainan,2020-02-26T12:43:02,168.0,5.0,129.0,CN,CHN
1099,02-26-2020,156,Mainland China,China,Guizhou,2020-02-25T08:03:07,146.0,2.0,104.0,CN,CHN
1100,02-26-2020,156,Mainland China,China,Tianjin,2020-02-26T12:43:02,135.0,3.0,96.0,CN,CHN
1101,02-26-2020,156,Mainland China,China,Shanxi,2020-02-26T14:13:10,133.0,0.0,104.0,CN,CHN
1102,02-26-2020,156,Mainland China,China,Liaoning,2020-02-26T00:13:05,121.0,1.0,88.0,CN,CHN
1103,02-26-2020,156,Mainland China,China,Jilin,2020-02-26T14:13:10,93.0,1.0,65.0,CN,CHN
1104,02-26-2020,156,Mainland China,China,Gansu,2020-02-26T14:13:10,91.0,2.0,81.0,CN,CHN
1105,02-26-2020,156,Mainland China,China,Xinjiang,2020-02-26T14:23:03,76.0,2.0,34.0,CN,CHN
1106,02-26-2020,156,Mainland China,China,Inner Mongolia,2020-02-26T15:03:05,75.0,0.0,38.0,CN,CHN
1107,02-26-2020,156,Mainland China,China,Ningxia,2020-02-26T03:53:01,71.0,0.0,65.0,CN,CHN
1108,02-26-2020,156,Mainland China,China,Qinghai,2020-02-21T04:43:02,18.0,0.0,18.0,CN,CHN
1109,02-26-2020,156,Mainland China,China,Tibet,2020-02-12T06:43:02,1.0,0.0,1.0,CN,CHN
1110,02-27-2020,156,Mainland China,China,Hubei,2020-02-27T12:13:14,65596.0,2641.0,23383.0,CN,CHN
1111,02-27-2020,156,Mainland China,China,Guangdong,2020-02-27T09:53:02,1347.0,7.0,890.0,CN,CHN
1112,02-27-2020,156,Mainland China,China,Henan,2020-02-27T15:03:11,1272.0,20.0,1068.0,CN,CHN
1113,02-27-2020,156,Mainland China,China,Zhejiang,2020-02-27T12:43:02,1205.0,1.0,932.0,CN,CHN
1114,02-27-2020,156,Mainland China,China,Hunan,2020-02-27T12:43:02,1017.0,4.0,804.0,CN,CHN
1115,02-27-2020,156,Mainland China,China,Anhui,2020-02-27T14:13:06,989.0,6.0,792.0,CN,CHN
1116,02-27-2020,156,Mainland China,China,Jiangxi,2020-02-27T01:43:02,934.0,1.0,754.0,CN,CHN
1117,02-27-2020,156,Mainland China,China,Shandong,2020-02-27T14:13:06,756.0,6.0,387.0,CN,CHN
1118,02-27-2020,156,Mainland China,China,Jiangsu,2020-02-27T14:13:06,631.0,0.0,498.0,CN,CHN
1119,02-27-2020,156,Mainland China,China,Chongqing,2020-02-27T23:23:02,576.0,6.0,401.0,CN,CHN
1120,02-27-2020,156,Mainland China,China,Sichuan,2020-02-27T12:43:02,534.0,3.0,321.0,CN,CHN
1121,02-27-2020,156,Mainland China,China,Heilongjiang,2020-02-27T12:43:02,480.0,13.0,270.0,CN,CHN
1122,02-27-2020,156,Mainland China,China,Beijing,2020-02-27T02:23:13,410.0,5.0,248.0,CN,CHN
1123,02-27-2020,156,Mainland China,China,Shanghai,2020-02-27T04:03:12,337.0,3.0,276.0,CN,CHN
1124,02-27-2020,156,Mainland China,China,Hebei,2020-02-27T12:43:02,317.0,6.0,274.0,CN,CHN
1125,02-27-2020,156,Mainland China,China,Fujian,2020-02-27T10:03:07,296.0,1.0,228.0,CN,CHN
1126,02-27-2020,156,Mainland China,China,Guangxi,2020-02-27T10:03:07,252.0,2.0,161.0,CN,CHN
1127,02-27-2020,156,Mainland China,China,Shaanxi,2020-02-27T12:43:02,245.0,1.0,195.0,CN,CHN
1128,02-27-2020,156,Mainland China,China,Yunnan,2020-02-27T10:03:07,174.0,2.0,150.0,CN,CHN
1129,02-27-2020,156,Mainland China,China,Hainan,2020-02-27T10:03:07,168.0,5.0,131.0,CN,CHN
1130,02-27-2020,156,Mainland China,China,Guizhou,2020-02-27T00:43:02,146.0,2.0,112.0,CN,CHN
1131,02-27-2020,156,Mainland China,China,Tianjin,2020-02-27T23:13:04,136.0,3.0,102.0,CN,CHN
1132,02-27-2020,156,Mainland China,China,Shanxi,2020-02-27T23:13:04,133.0,0.0,107.0,CN,CHN
1133,02-27-2020,156,Mainland China,China,Liaoning,2020-02-27T14:13:06,121.0,1.0,93.0,CN,CHN
1134,02-27-2020,156,Mainland China,China,Jilin,2020-02-27T12:43:02,93.0,1.0,67.0,CN,CHN
1135,02-27-2020,156,Mainland China,China,Gansu,2020-02-26T14:13:10,91.0,2.0,81.0,CN,CHN
1136,02-27-2020,156,Mainland China,China,Xinjiang,2020-02-27T12:43:02,76.0,2.0,43.0,CN,CHN
1137,02-27-2020,156,Mainland China,China,Inner Mongolia,2020-02-27T23:33:02,75.0,0.0,43.0,CN,CHN
1138,02-27-2020,156,Mainland China,China,Ningxia,2020-02-27T10:03:07,72.0,0.0,68.0,CN,CHN
1139,02-27-2020,156,Mainland China,China,Qinghai,2020-02-21T04:43:02,18.0,0.0,18.0,CN,CHN
1140,02-27-2020,156,Mainland China,China,Tibet,2020-02-12T06:43:02,1.0,0.0,1.0,CN,CHN
1141,02-28-2020,156,Mainland China,China,Hubei,2020-02-28T00:43:01,65914.0,2682.0,26403.0,CN,CHN
1142,02-28-2020,156,Mainland China,China,Guangdong,2020-02-28T08:53:03,1348.0,7.0,935.0,CN,CHN
1143,02-28-2020,156,Mainland China,China,Henan,2020-02-28T09:23:02,1272.0,20.0,1112.0,CN,CHN
1144,02-28-2020,156,Mainland China,China,Zhejiang,2020-02-28T10:03:12,1205.0,1.0,975.0,CN,CHN
1145,02-28-2020,156,Mainland China,China,Hunan,2020-02-28T09:13:10,1017.0,4.0,830.0,CN,CHN
1146,02-28-2020,156,Mainland China,China,Anhui,2020-02-28T04:43:02,990.0,6.0,821.0,CN,CHN
1147,02-28-2020,156,Mainland China,China,Jiangxi,2020-02-28T01:13:11,935.0,1.0,790.0,CN,CHN
1148,02-28-2020,156,Mainland China,China,Shandong,2020-02-28T09:23:02,756.0,6.0,405.0,CN,CHN
1149,02-28-2020,156,Mainland China,China,Jiangsu,2020-02-28T08:53:03,631.0,0.0,515.0,CN,CHN
