,Date,ISO_CountryID,Country/Region,ISO_CountryName,Province/State,Last Update,Confirmed,Deaths,Recovered,Latitude,Longitude,ISO_2,ISO_3
0,03-01-2020,156.0,Mainland China,China,Hubei,2020-03-01T10:13:19,66907,2761,31536,30.9756,112.2707,CN,CHN
1,03-01-2020,156.0,Mainland China,China,Guangdong,2020-03-01T14:13:18,1349,7,1016,23.3417,113.4244,CN,CHN
2,03-01-2020,156.0,Mainland China,China,Henan,2020-03-01T14:13:18,1272,22,1198,33.882,113.614,CN,CHN
3,03-01-2020,156.0,Mainland China,China,Zhejiang,2020-03-01T10:13:33,1205,1,1046,29.1832,120.0934,CN,CHN
4,03-01-2020,156.0,Mainland China,China,Hunan,2020-03-01T10:03:03,1018,4,866,27.6104,111.7088,CN,CHN
5,03-01-2020,156.0,Mainland China,China,Anhui,2020-03-01T10:03:03,990,6,873,31.8257,117.2264,CN,CHN
6,03-01-2020,156.0,Mainland China,China,Jiangxi,2020-03-01T01:13:10,935,1,831,27.614,115.7221,CN,CHN
7,03-01-2020,156.0,Mainland China,China,Shandong,2020-03-01T11:33:03,758,6,443,36.3427,118.1498,CN,CHN
8,03-01-2020,156.0,Mainland China,China,Jiangsu,2020-03-01T10:03:03,631,0,536,32.9711,119.455,CN,CHN
9,03-01-2020,156.0,Mainland China,China,Chongqing,2020-03-01T23:13:08,576,6,450,30.0572,107.874,CN,CHN
10,03-01-2020,156.0,Mainland China,China,Sichuan,2020-03-01T11:43:02,538,3,365,30.6171,102.7103,CN,CHN
11,03-01-2020,156.0,Mainland China,China,Heilongjiang,2020-03-01T11:33:03,480,13,342,47.862,127.7615,CN,CHN
12,03-01-2020,156.0,Mainland China,China,Beijing,2020-03-01T02:53:03,413,8,276,40.1824,116.4142,CN,CHN
13,03-01-2020,156.0,Mainland China,China,Shanghai,2020-03-01T07:13:07,337,3,290,31.202,121.4491,CN,CHN
14,03-01-2020,156.0,Mainland China,China,Hebei,2020-03-01T14:13:18,318,6,294,38.0428,114.5149,CN,CHN
15,03-01-2020,156.0,Mainland China,China,Fujian,2020-03-01T09:43:03,296,1,247,26.0789,117.9874,CN,CHN
16,03-01-2020,156.0,Mainland China,China,Guangxi,2020-03-01T09:43:03,252,2,181,23.8298,108.7881,CN,CHN
17,03-01-2020,156.0,Mainland China,China,Shaanxi,2020-03-01T09:43:03,245,1,208,35.1917,108.8701,CN,CHN
18,03-01-2020,156.0,Mainland China,China,Yunnan,2020-03-01T07:13:07,174,2,163,24.974,101.487,CN,CHN
19,03-01-2020,156.0,Mainland China,China,Hainan,2020-03-01T10:13:38,168,5,149,19.1959,109.7453,CN,CHN
20,03-01-2020,156.0,Mainland China,China,Guizhou,2020-02-27T00:43:02,146,2,112,26.8154,106.8748,CN,CHN
21,03-01-2020,156.0,Mainland China,China,Tianjin,2020-03-01T12:43:02,136,3,111,39.3054,117.323,CN,CHN
22,03-01-2020,156.0,Mainland China,China,Shanxi,2020-03-01T23:13:08,133,0,116,37.5777,112.2922,CN,CHN
23,03-01-2020,156.0,Mainland China,China,Liaoning,2020-03-01T12:23:06,122,1,103,41.2956,122.6085,CN,CHN
24,03-01-2020,156.0,Mainland China,China,Jilin,2020-03-01T09:43:03,93,1,78,43.6661,126.1923,CN,CHN
25,03-01-2020,156.0,Mainland China,China,Gansu,2020-03-01T14:33:17,91,2,84,36.0611,103.8343,CN,CHN
26,03-01-2020,156.0,Mainland China,China,Xinjiang,2020-03-01T10:03:03,76,3,64,41.1129,85.2401,CN,CHN
27,03-01-2020,156.0,Mainland China,China,Inner Mongolia,2020-03-01T10:03:03,75,0,52,44.0935,113.9448,CN,CHN
28,03-01-2020,156.0,Mainland China,China,Ningxia,2020-02-29T05:53:02,73,0,69,37.2692,106.1655,CN,CHN
29,03-01-2020,156.0,Mainland China,China,Qinghai,2020-02-21T04:43:02,18,0,18,35.7452,95.9956,CN,CHN
30,03-01-2020,156.0,Mainland China,China,Tibet,2020-02-12T06:43:02,1,0,1,31.6927,88.0924,CN,CHN
31,03-02-2020,156.0,Mainland China,China,Hubei,2020-03-02T15:03:23,67103,2803,33934,30.9756,112.2707,CN,CHN
32,03-02-2020,156.0,Mainland China,China,Guangdong,2020-03-02T15:03:23,1350,7,1059,23.3417,113.4244,CN,CHN
33,03-02-2020,156.0,Mainland China,China,Henan,2020-03-02T11:43:03,1272,22,1205,33.882,113.614,CN,CHN
34,03-02-2020,156.0,Mainland China,China,Zhejiang,2020-03-02T11:43:03,1206,1,1069,29.1832,120.0934,CN,CHN
35,03-02-2020,156.0,Mainland China,China,Hunan,2020-03-02T11:43:03,1018,4,887,27.6104,111.7088,CN,CHN
36,03-02-2020,156.0,Mainland China,China,Anhui,2020-03-02T15:03:23,990,6,917,31.8257,117.2264,CN,CHN
37,03-02-2020,156.0,Mainland China,China,Jiangxi,2020-03-02T01:33:02,935,1,850,27.614,115.7221,CN,CHN
38,03-02-2020,156.0,Mainland China,China,Shandong,2020-03-02T08:03:12,758,6,460,36.3427,118.1498,CN,CHN
39,03-02-2020,156.0,Mainland China,China,Jiangsu,2020-03-02T12:53:02,631,0,543,32.9711,119.455,CN,CHN
40,03-02-2020,156.0,Mainland China,China,Chongqing,2020-03-02T23:23:02,576,6,469,30.0572,107.874,CN,CHN
41,03-02-2020,156.0,Mainland China,China,Sichuan,2020-03-02T15:03:23,538,3,386,30.6171,102.7103,CN,CHN
42,03-02-2020,156.0,Mainland China,China,Heilongjiang,2020-03-02T12:53:02,480,13,356,47.862,127.7615,CN,CHN
43,03-02-2020,156.0,Mainland China,China,Beijing,2020-03-02T02:13:16,414,8,282,40.1824,116.4142,CN,CHN
44,03-02-2020,156.0,Mainland China,China,Shanghai,2020-03-02T04:03:13,337,3,292,31.202,121.4491,CN,CHN
45,03-02-2020,156.0,Mainland China,China,Hebei,2020-03-02T09:43:05,318,6,296,38.0428,114.5149,CN,CHN
46,03-02-2020,156.0,Mainland China,China,Fujian,2020-03-02T12:53:02,296,1,255,26.0789,117.9874,CN,CHN
47,03-02-2020,156.0,Mainland China,China,Guangxi,2020-03-02T12:53:02,252,2,192,23.8298,108.7881,CN,CHN
48,03-02-2020,156.0,Mainland China,China,Shaanxi,2020-03-02T08:03:12,245,1,216,35.1917,108.8701,CN,CHN
49,03-02-2020,156.0,Mainland China,China,Yunnan,2020-03-02T06:23:04,174,2,168,24.974,101.487,CN,CHN
50,03-02-2020,156.0,Mainland China,China,Hainan,2020-03-02T02:03:18,168,5,151,19.1959,109.7453,CN,CHN
51,03-02-2020,156.0,Mainland China,China,Guizhou,2020-03-02T01:13:06,146,2,114,26.8154,106.8748,CN,CHN
52,03-02-2020,156.0,Mainland China,China,Tianjin,2020-03-01T12:43:02,136,3,111,39.3054,117.323,CN,CHN
53,03-02-2020,156.0,Mainland China,China,Shanxi,2020-03-02T23:23:02,133,0,119,37.5777,112.2922,CN,CHN
54,03-02-2020,156.0,Mainland China,China,Liaoning,2020-03-01T12:23:06,122,1,103,41.2956,122.6085,CN,CHN
55,03-02-2020,156.0,Mainland China,China,Jilin,2020-03-02T15:03:23,93,1,83,43.6661,126.1923,CN,CHN
56,03-02-2020,156.0,Mainland China,China,Gansu,2020-03-02T15:03:23,91,2,85,36.0611,103.8343,CN,CHN
57,03-02-2020,156.0,Mainland China,China,Xinjiang,2020-03-02T15:43:31,76,3,66,41.1129,85.2401,CN,CHN
58,03-02-2020,156.0,Mainland China,China,Inner Mongolia,2020-03-02T10:23:04,75,0,54,44.0935,113.9448,CN,CHN
59,03-02-2020,156.0,Mainland China,China,Ningxia,2020-03-02T01:33:02,74,0,69,37.2692,106.1655,CN,CHN
60,03-02-2020,156.0,Mainland China,China,Qinghai,2020-02-21T04:43:02,18,0,18,35.7452,95.9956,CN,CHN
61,03-02-2020,156.0,Mainland China,China,Tibet,2020-02-12T06:43:02,1,0,1,31.6927,88.0924,CN,CHN
62,03-03-2020,156.0,Mainland China,China,Hubei,2020-03-03T11:43:02,67217,2835,36208,30.9756,112.2707,CN,CHN
63,03-03-2020,156.0,Mainland China,China,Guangdong,2020-03-03T10:23:10,1350,7,1101,23.3417,113.4244,CN,CHN
64,03-03-2020,156.0,Mainland China,China,Henan,2020-03-03T09:43:02,1272,22,1231,33.882,113.614,CN,CHN
65,03-03-2020,156.0,Mainland China,China,Zhejiang,2020-03-03T12:33:02,1213,1,1093,29.1832,120.0934,CN,CHN
66,03-03-2020,156.0,Mainland China,China,Hunan,2020-03-03T13:03:04,1018,4,906,27.6104,111.7088,CN,CHN
67,03-03-2020,156.0,Mainland China,China,Anhui,2020-03-03T14:33:03,990,6,936,31.8257,117.2264,CN,CHN
68,03-03-2020,156.0,Mainland China,China,Jiangxi,2020-03-03T02:03:11,935,1,870,27.614,115.7221,CN,CHN
69,03-03-2020,156.0,Mainland China,China,Shandong,2020-03-03T07:53:03,758,6,511,36.3427,118.1498,CN,CHN
70,03-03-2020,156.0,Mainland China,China,Jiangsu,2020-03-03T11:03:09,631,0,562,32.9711,119.455,CN,CHN
71,03-03-2020,156.0,Mainland China,China,Chongqing,2020-03-03T23:13:05,576,6,490,30.0572,107.874,CN,CHN
72,03-03-2020,156.0,Mainland China,China,Sichuan,2020-03-03T09:33:02,538,3,394,30.6171,102.7103,CN,CHN
73,03-03-2020,156.0,Mainland China,China,Heilongjiang,2020-03-03T13:03:04,480,13,366,47.862,127.7615,CN,CHN
74,03-03-2020,156.0,Mainland China,China,Beijing,2020-03-03T02:03:11,414,8,288,40.1824,116.4142,CN,CHN
75,03-03-2020,156.0,Mainland China,China,Shanghai,2020-03-03T03:43:02,338,3,294,31.202,121.4491,CN,CHN
76,03-03-2020,156.0,Mainland China,China,Hebei,2020-03-03T09:33:02,318,6,300,38.0428,114.5149,CN,CHN
77,03-03-2020,156.0,Mainland China,China,Fujian,2020-03-03T13:43:03,296,1,260,26.0789,117.9874,CN,CHN
78,03-03-2020,156.0,Mainland China,China,Guangxi,2020-03-03T00:23:14,252,2,202,23.8298,108.7881,CN,CHN
79,03-03-2020,156.0,Mainland China,China,Shaanxi,2020-03-02T08:03:12,245,1,216,35.1917,108.8701,CN,CHN
80,03-03-2020,156.0,Mainland China,China,Yunnan,2020-03-03T03:43:02,174,2,169,24.974,101.487,CN,CHN
81,03-03-2020,156.0,Mainland China,China,Hainan,2020-03-03T23:43:02,168,5,155,19.1959,109.7453,CN,CHN
82,03-03-2020,156.0,Mainland China,China,Guizhou,2020-03-02T01:13:06,146,2,114,26.8154,106.8748,CN,CHN
83,03-03-2020,156.0,Mainland China,China,Tianjin,2020-03-03T11:43:02,136,3,124,39.3054,117.323,CN,CHN
84,03-03-2020,156.0,Mainland China,China,Shanxi,2020-03-03T23:13:05,133,0,124,37.5777,112.2922,CN,CHN
85,03-03-2020,156.0,Mainland China,China,Liaoning,2020-03-03T14:33:03,125,1,106,41.2956,122.6085,CN,CHN
86,03-03-2020,156.0,Mainland China,China,Jilin,2020-03-02T15:03:23,93,1,83,43.6661,126.1923,CN,CHN
87,03-03-2020,156.0,Mainland China,China,Gansu,2020-03-03T13:43:03,91,2,86,36.0611,103.8343,CN,CHN
88,03-03-2020,156.0,Mainland China,China,Xinjiang,2020-03-03T07:33:03,76,3,68,41.1129,85.2401,CN,CHN
89,03-03-2020,156.0,Mainland China,China,Inner Mongolia,2020-03-03T09:23:02,75,1,59,44.0935,113.9448,CN,CHN
90,03-03-2020,156.0,Mainland China,China,Ningxia,2020-03-02T01:33:02,74,0,69,37.2692,106.1655,CN,CHN
91,03-03-2020,156.0,Mainland China,China,Qinghai,2020-02-21T04:43:02,18,0,18,35.7452,95.9956,CN,CHN
92,03-03-2020,156.0,Mainland China,China,Tibet,2020-02-12T06:43:02,1,0,1,31.6927,88.0924,CN,CHN
93,03-04-2020,156.0,Mainland China,China,Hubei,2020-03-04T12:53:03,67332,2871,38557,30.9756,112.2707,CN,CHN
94,03-04-2020,156.0,Mainland China,China,Guangdong,2020-03-04T10:03:19,1350,7,1133,23.3417,113.4244,CN,CHN
95,03-04-2020,156.0,Mainland China,China,Henan,2020-03-04T00:33:05,1272,22,1234,33.882,113.614,CN,CHN
96,03-04-2020,156.0,Mainland China,China,Zhejiang,2020-03-04T10:03:19,1213,1,1114,29.1832,120.0934,CN,CHN
97,03-04-2020,156.0,Mainland China,China,Hunan,2020-03-04T15:43:02,1018,4,916,27.6104,111.7088,CN,CHN
98,03-04-2020,156.0,Mainland China,China,Anhui,2020-03-04T10:03:19,990,6,956,31.8257,117.2264,CN,CHN
99,03-04-2020,156.0,Mainland China,China,Jiangxi,2020-03-04T01:33:07,935,1,884,27.614,115.7221,CN,CHN
100,03-04-2020,156.0,Mainland China,China,Shandong,2020-03-04T12:53:03,758,6,516,36.3427,118.1498,CN,CHN
101,03-04-2020,156.0,Mainland China,China,Jiangsu,2020-03-04T12:53:03,631,0,577,32.9711,119.455,CN,CHN
102,03-04-2020,156.0,Mainland China,China,Chongqing,2020-03-04T23:23:01,576,6,502,30.0572,107.874,CN,CHN
103,03-04-2020,156.0,Mainland China,China,Sichuan,2020-03-04T12:53:03,538,3,406,30.6171,102.7103,CN,CHN
104,03-04-2020,156.0,Mainland China,China,Heilongjiang,2020-03-04T12:53:03,480,13,373,47.862,127.7615,CN,CHN
105,03-04-2020,156.0,Mainland China,China,Beijing,2020-03-04T23:23:01,418,8,297,40.1824,116.4142,CN,CHN
106,03-04-2020,156.0,Mainland China,China,Shanghai,2020-03-04T04:13:08,338,3,298,31.202,121.4491,CN,CHN
107,03-04-2020,156.0,Mainland China,China,Hebei,2020-03-04T10:03:19,318,6,301,38.0428,114.5149,CN,CHN
108,03-04-2020,156.0,Mainland China,China,Fujian,2020-03-04T12:53:03,296,1,270,26.0789,117.9874,CN,CHN
109,03-04-2020,156.0,Mainland China,China,Guangxi,2020-03-04T00:13:08,252,2,210,23.8298,108.7881,CN,CHN
110,03-04-2020,156.0,Mainland China,China,Shaanxi,2020-03-04T15:43:03,245,1,223,35.1917,108.8701,CN,CHN
111,03-04-2020,156.0,Mainland China,China,Yunnan,2020-03-03T03:43:02,174,2,169,24.974,101.487,CN,CHN
112,03-04-2020,156.0,Mainland China,China,Hainan,2020-03-04T10:03:19,168,5,158,19.1959,109.7453,CN,CHN
113,03-04-2020,156.0,Mainland China,China,Guizhou,2020-03-02T01:13:06,146,2,114,26.8154,106.8748,CN,CHN
114,03-04-2020,156.0,Mainland China,China,Tianjin,2020-03-03T11:43:02,136,3,124,39.3054,117.323,CN,CHN
115,03-04-2020,156.0,Mainland China,China,Shanxi,2020-03-03T23:13:05,133,0,124,37.5777,112.2922,CN,CHN
116,03-04-2020,156.0,Mainland China,China,Liaoning,2020-03-03T14:33:03,125,1,106,41.2956,122.6085,CN,CHN
117,03-04-2020,156.0,Mainland China,China,Jilin,2020-03-04T10:03:19,93,1,86,43.6661,126.1923,CN,CHN
118,03-04-2020,156.0,Mainland China,China,Gansu,2020-03-04T15:43:03,91,2,87,36.0611,103.8343,CN,CHN
119,03-04-2020,156.0,Mainland China,China,Xinjiang,2020-03-04T15:43:03,76,3,69,41.1129,85.2401,CN,CHN
120,03-04-2020,156.0,Mainland China,China,Inner Mongolia,2020-03-04T15:43:03,75,1,63,44.0935,113.9448,CN,CHN
121,03-04-2020,156.0,Mainland China,China,Ningxia,2020-03-04T01:33:07,75,0,69,37.2692,106.1655,CN,CHN
122,03-04-2020,156.0,Mainland China,China,Qinghai,2020-02-21T04:43:02,18,0,18,35.7452,95.9956,CN,CHN
123,03-04-2020,156.0,Mainland China,China,Tibet,2020-02-12T06:43:02,1,0,1,31.6927,88.0924,CN,CHN
124,03-05-2020,156.0,Mainland China,China,Hubei,2020-03-05T14:53:03,67466,2902,40592,30.9756,112.2707,CN,CHN
125,03-05-2020,156.0,Mainland China,China,Guangdong,2020-03-05T09:23:03,1351,7,1181,23.3417,113.4244,CN,CHN
126,03-05-2020,156.0,Mainland China,China,Henan,2020-03-05T01:48:26,1272,22,1239,33.882,113.614,CN,CHN
127,03-05-2020,156.0,Mainland China,China,Zhejiang,2020-03-05T09:43:03,1215,1,1124,29.1832,120.0934,CN,CHN
128,03-05-2020,156.0,Mainland China,China,Hunan,2020-03-05T08:43:03,1018,4,938,27.6104,111.7088,CN,CHN
129,03-05-2020,156.0,Mainland China,China,Anhui,2020-03-05T04:33:02,990,6,970,31.8257,117.2264,CN,CHN
130,03-05-2020,156.0,Mainland China,China,Jiangxi,2020-03-05T01:16:58,935,1,901,27.614,115.7221,CN,CHN
131,03-05-2020,156.0,Mainland China,China,Shandong,2020-03-05T14:53:03,758,6,578,36.3427,118.1498,CN,CHN
132,03-05-2020,156.0,Mainland China,China,Jiangsu,2020-03-05T14:53:03,631,0,583,32.9711,119.455,CN,CHN
133,03-05-2020,156.0,Mainland China,China,Chongqing,2020-03-05T23:23:02,576,6,512,30.0572,107.874,CN,CHN
134,03-05-2020,156.0,Mainland China,China,Sichuan,2020-03-05T14:53:03,539,3,425,30.6171,102.7103,CN,CHN
135,03-05-2020,156.0,Mainland China,China,Heilongjiang,2020-03-05T00:23:06,481,13,379,47.862,127.7615,CN,CHN
136,03-05-2020,156.0,Mainland China,China,Beijing,2020-03-04T23:23:01,418,8,297,40.1824,116.4142,CN,CHN
137,03-05-2020,156.0,Mainland China,China,Shanghai,2020-03-05T06:23:06,339,3,303,31.202,121.4491,CN,CHN
138,03-05-2020,156.0,Mainland China,China,Hebei,2020-03-05T14:53:03,318,6,304,38.0428,114.5149,CN,CHN
139,03-05-2020,156.0,Mainland China,China,Fujian,2020-03-05T09:33:03,296,1,277,26.0789,117.9874,CN,CHN
140,03-05-2020,156.0,Mainland China,China,Guangxi,2020-03-05T10:03:08,252,2,214,23.8298,108.7881,CN,CHN
141,03-05-2020,156.0,Mainland China,China,Shaanxi,2020-03-05T06:03:08,245,1,224,35.1917,108.8701,CN,CHN
142,03-05-2020,156.0,Mainland China,China,Yunnan,2020-03-03T03:43:02,174,2,169,24.974,101.487,CN,CHN
143,03-05-2020,156.0,Mainland China,China,Hainan,2020-03-05T06:13:10,168,6,158,19.1959,109.7453,CN,CHN
144,03-05-2020,156.0,Mainland China,China,Guizhou,2020-03-02T01:13:06,146,2,114,26.8154,106.8748,CN,CHN
145,03-05-2020,156.0,Mainland China,China,Tianjin,2020-03-05T03:33:27,136,3,128,39.3054,117.323,CN,CHN
146,03-05-2020,156.0,Mainland China,China,Shanxi,2020-03-05T14:53:03,133,0,126,37.5777,112.2922,CN,CHN
147,03-05-2020,156.0,Mainland China,China,Liaoning,2020-03-03T14:33:03,125,1,106,41.2956,122.6085,CN,CHN
148,03-05-2020,156.0,Mainland China,China,Gansu,2020-03-05T15:13:13,102,2,87,36.0611,103.8343,CN,CHN
149,03-05-2020,156.0,Mainland China,China,Jilin,2020-03-05T14:53:03,93,1,88,43.6661,126.1923,CN,CHN
150,03-05-2020,156.0,Mainland China,China,Xinjiang,2020-03-05T06:03:08,76,3,70,41.1129,85.2401,CN,CHN
151,03-05-2020,156.0,Mainland China,China,Inner Mongolia,2020-03-05T23:53:01,75,1,65,44.0935,113.9448,CN,CHN
152,03-05-2020,156.0,Mainland China,China,Ningxia,2020-03-04T01:33:07,75,0,69,37.2692,106.1655,CN,CHN
153,03-05-2020,156.0,Mainland China,China,Qinghai,2020-02-21T04:43:02,18,0,18,35.7452,95.9956,CN,CHN
154,03-05-2020,156.0,Mainland China,China,Tibet,2020-02-12T06:43:02,1,0,1,31.6927,88.0924,CN,CHN
155,03-06-2020,156.0,Mainland China,China,Hubei,2020-03-06T14:23:04,67592,2931,42033,30.9756,112.2707,CN,CHN
156,03-06-2020,156.0,Mainland China,China,Guangdong,2020-03-06T12:53:03,1352,7,1216,23.3417,113.4244,CN,CHN
157,03-06-2020,156.0,Mainland China,China,Henan,2020-03-06T12:43:03,1272,22,1244,33.882,113.614,CN,CHN
158,03-06-2020,156.0,Mainland China,China,Zhejiang,2020-03-06T10:23:03,1215,1,1147,29.1832,120.0934,CN,CHN
159,03-06-2020,156.0,Mainland China,China,Hunan,2020-03-06T11:03:10,1018,4,955,27.6104,111.7088,CN,CHN
160,03-06-2020,156.0,Mainland China,China,Anhui,2020-03-06T03:23:06,990,6,979,31.8257,117.2264,CN,CHN
161,03-06-2020,156.0,Mainland China,China,Jiangxi,2020-03-06T14:23:04,935,1,909,27.614,115.7221,CN,CHN
162,03-06-2020,156.0,Mainland China,China,Shandong,2020-03-06T11:03:10,758,6,618,36.3427,118.1498,CN,CHN
163,03-06-2020,156.0,Mainland China,China,Jiangsu,2020-03-06T10:23:03,631,0,594,32.9711,119.455,CN,CHN
164,03-06-2020,156.0,Mainland China,China,Chongqing,2020-03-06T11:03:10,576,6,513,30.0572,107.874,CN,CHN
165,03-06-2020,156.0,Mainland China,China,Sichuan,2020-03-06T12:53:03,539,3,442,30.6171,102.7103,CN,CHN
166,03-06-2020,156.0,Mainland China,China,Heilongjiang,2020-03-06T14:23:04,481,13,396,47.862,127.7615,CN,CHN
167,03-06-2020,156.0,Mainland China,China,Beijing,2020-03-06T12:53:03,422,8,299,40.1824,116.4142,CN,CHN
168,03-06-2020,156.0,Mainland China,China,Shanghai,2020-03-06T06:03:13,342,3,306,31.202,121.4491,CN,CHN
169,03-06-2020,156.0,Mainland China,China,Hebei,2020-03-06T03:23:06,318,6,305,38.0428,114.5149,CN,CHN
170,03-06-2020,156.0,Mainland China,China,Fujian,2020-03-06T12:53:03,296,1,284,26.0789,117.9874,CN,CHN
171,03-06-2020,156.0,Mainland China,China,Guangxi,2020-03-06T00:33:02,252,2,217,23.8298,108.7881,CN,CHN
172,03-06-2020,156.0,Mainland China,China,Shaanxi,2020-03-06T10:23:03,245,1,226,35.1917,108.8701,CN,CHN
173,03-06-2020,156.0,Mainland China,China,Yunnan,2020-03-06T03:23:06,174,2,170,24.974,101.487,CN,CHN
174,03-06-2020,156.0,Mainland China,China,Hainan,2020-03-05T06:13:10,168,6,158,19.1959,109.7453,CN,CHN
175,03-06-2020,156.0,Mainland China,China,Guizhou,2020-03-02T01:13:06,146,2,114,26.8154,106.8748,CN,CHN
176,03-06-2020,156.0,Mainland China,China,Tianjin,2020-03-05T03:33:27,136,3,128,39.3054,117.323,CN,CHN
177,03-06-2020,156.0,Mainland China,China,Shanxi,2020-03-05T14:53:03,133,0,126,37.5777,112.2922,CN,CHN
178,03-06-2020,156.0,Mainland China,China,Liaoning,2020-03-03T14:33:03,125,1,106,41.2956,122.6085,CN,CHN
179,03-06-2020,156.0,Mainland China,China,Gansu,2020-03-06T14:43:15,119,2,87,36.0611,103.8343,CN,CHN
180,03-06-2020,156.0,Mainland China,China,Jilin,2020-03-06T10:23:03,93,1,90,43.6661,126.1923,CN,CHN
181,03-06-2020,156.0,Mainland China,China,Xinjiang,2020-03-06T05:53:03,76,3,71,41.1129,85.2401,CN,CHN
182,03-06-2020,156.0,Mainland China,China,Inner Mongolia,2020-03-05T23:53:01,75,1,65,44.0935,113.9448,CN,CHN
183,03-06-2020,156.0,Mainland China,China,Ningxia,2020-03-06T12:53:03,75,0,71,37.2692,106.1655,CN,CHN
184,03-06-2020,156.0,Mainland China,China,Qinghai,2020-02-21T04:43:02,18,0,18,35.7452,95.9956,CN,CHN
185,03-06-2020,156.0,Mainland China,China,Tibet,2020-02-12T06:43:02,1,0,1,31.6927,88.0924,CN,CHN
186,03-07-2020,156.0,Mainland China,China,Hubei,2020-03-07T11:13:04,67666,2959,43500,30.9756,112.2707,CN,CHN
187,03-07-2020,156.0,Mainland China,China,Guangdong,2020-03-07T10:43:02,1352,7,1237,23.3417,113.4244,CN,CHN
188,03-07-2020,156.0,Mainland China,China,Henan,2020-03-07T11:23:10,1272,22,1244,33.882,113.614,CN,CHN
189,03-07-2020,156.0,Mainland China,China,Zhejiang,2020-03-07T09:03:05,1215,1,1154,29.1832,120.0934,CN,CHN
190,03-07-2020,156.0,Mainland China,China,Hunan,2020-03-07T09:03:05,1018,4,960,27.6104,111.7088,CN,CHN
191,03-07-2020,156.0,Mainland China,China,Anhui,2020-03-06T03:23:06,990,6,979,31.8257,117.2264,CN,CHN
192,03-07-2020,156.0,Mainland China,China,Jiangxi,2020-03-07T01:13:18,935,1,916,27.614,115.7221,CN,CHN
193,03-07-2020,156.0,Mainland China,China,Shandong,2020-03-07T13:03:05,758,6,627,36.3427,118.1498,CN,CHN
194,03-07-2020,156.0,Mainland China,China,Jiangsu,2020-03-07T14:53:02,631,0,606,32.9711,119.455,CN,CHN
195,03-07-2020,156.0,Mainland China,China,Chongqing,2020-03-07T23:23:02,576,6,526,30.0572,107.874,CN,CHN
196,03-07-2020,156.0,Mainland China,China,Sichuan,2020-03-07T13:03:05,539,3,454,30.6171,102.7103,CN,CHN
197,03-07-2020,156.0,Mainland China,China,Heilongjiang,2020-03-07T09:03:05,481,13,403,47.862,127.7615,CN,CHN
198,03-07-2020,156.0,Mainland China,China,Beijing,2020-03-07T01:03:05,426,8,303,40.1824,116.4142,CN,CHN
199,03-07-2020,156.0,Mainland China,China,Shanghai,2020-03-07T03:53:03,342,3,313,31.202,121.4491,CN,CHN
200,03-07-2020,156.0,Mainland China,China,Hebei,2020-03-07T13:03:05,318,6,307,38.0428,114.5149,CN,CHN
201,03-07-2020,156.0,Mainland China,China,Fujian,2020-03-07T13:03:05,296,1,295,26.0789,117.9874,CN,CHN
202,03-07-2020,156.0,Mainland China,China,Guangxi,2020-03-07T14:53:02,252,2,218,23.8298,108.7881,CN,CHN
203,03-07-2020,156.0,Mainland China,China,Shaanxi,2020-03-06T10:23:03,245,1,226,35.1917,108.8701,CN,CHN
204,03-07-2020,156.0,Mainland China,China,Yunnan,2020-03-06T03:23:06,174,2,170,24.974,101.487,CN,CHN
205,03-07-2020,156.0,Mainland China,China,Hainan,2020-03-05T06:13:10,168,6,158,19.1959,109.7453,CN,CHN
206,03-07-2020,156.0,Mainland China,China,Guizhou,2020-03-07T00:43:01,146,2,115,26.8154,106.8748,CN,CHN
207,03-07-2020,156.0,Mainland China,China,Tianjin,2020-03-05T03:33:27,136,3,128,39.3054,117.323,CN,CHN
208,03-07-2020,156.0,Mainland China,China,Shanxi,2020-03-05T14:53:03,133,0,126,37.5777,112.2922,CN,CHN
209,03-07-2020,156.0,Mainland China,China,Liaoning,2020-03-07T14:53:02,125,1,107,41.2956,122.6085,CN,CHN
210,03-07-2020,156.0,Mainland China,China,Gansu,2020-03-07T15:03:06,120,2,87,36.0611,103.8343,CN,CHN
211,03-07-2020,156.0,Mainland China,China,Jilin,2020-03-06T10:23:03,93,1,90,43.6661,126.1923,CN,CHN
212,03-07-2020,156.0,Mainland China,China,Xinjiang,2020-03-07T09:03:05,76,3,72,41.1129,85.2401,CN,CHN
213,03-07-2020,156.0,Mainland China,China,Inner Mongolia,2020-03-07T03:43:01,75,1,67,44.0935,113.9448,CN,CHN
214,03-07-2020,156.0,Mainland China,China,Ningxia,2020-03-06T12:53:03,75,0,71,37.2692,106.1655,CN,CHN
215,03-07-2020,156.0,Mainland China,China,Qinghai,2020-02-21T04:43:02,18,0,18,35.7452,95.9956,CN,CHN
216,03-07-2020,156.0,Mainland China,China,Tibet,2020-02-12T06:43:02,1,0,1,31.6927,88.0924,CN,CHN
217,03-08-2020,156.0,Mainland China,China,Hubei,2020-03-08T14:43:03,67707,2986,45235,30.9756,112.2707,CN,CHN
218,03-08-2020,156.0,Mainland China,China,Guangdong,2020-03-08T14:43:03,1352,7,1256,23.3417,113.4244,CN,CHN
219,03-08-2020,156.0,Mainland China,China,Henan,2020-03-08T05:03:02,1272,22,1247,33.882,113.614,CN,CHN
220,03-08-2020,156.0,Mainland China,China,Zhejiang,2020-03-08T09:03:04,1215,1,1161,29.1832,120.0934,CN,CHN
221,03-08-2020,156.0,Mainland China,China,Hunan,2020-03-08T12:53:03,1018,4,968,27.6104,111.7088,CN,CHN
222,03-08-2020,156.0,Mainland China,China,Anhui,2020-03-08T05:13:06,990,6,984,31.8257,117.2264,CN,CHN
223,03-08-2020,156.0,Mainland China,China,Jiangxi,2020-03-08T06:53:04,935,1,919,27.614,115.7221,CN,CHN
224,03-08-2020,156.0,Mainland China,China,Shandong,2020-03-08T10:03:11,758,6,642,36.3427,118.1498,CN,CHN
225,03-08-2020,156.0,Mainland China,China,Jiangsu,2020-03-08T09:23:05,631,0,612,32.9711,119.455,CN,CHN
226,03-08-2020,156.0,Mainland China,China,Chongqing,2020-03-08T23:23:03,576,6,527,30.0572,107.874,CN,CHN
227,03-08-2020,156.0,Mainland China,China,Sichuan,2020-03-08T12:53:03,539,3,464,30.6171,102.7103,CN,CHN
228,03-08-2020,156.0,Mainland China,China,Heilongjiang,2020-03-08T14:43:03,481,13,412,47.862,127.7615,CN,CHN
229,03-08-2020,156.0,Mainland China,China,Beijing,2020-03-08T01:23:07,428,8,308,40.1824,116.4142,CN,CHN
230,03-08-2020,156.0,Mainland China,China,Shanghai,2020-03-08T04:33:02,342,3,314,31.202,121.4491,CN,CHN
231,03-08-2020,156.0,Mainland China,China,Hebei,2020-03-07T13:03:05,318,6,307,38.0428,114.5149,CN,CHN
232,03-08-2020,156.0,Mainland China,China,Fujian,2020-03-07T13:03:05,296,1,295,26.0789,117.9874,CN,CHN
233,03-08-2020,156.0,Mainland China,China,Guangxi,2020-03-08T00:23:02,252,2,223,23.8298,108.7881,CN,CHN
234,03-08-2020,156.0,Mainland China,China,Shaanxi,2020-03-08T14:43:03,245,1,227,35.1917,108.8701,CN,CHN
235,03-08-2020,156.0,Mainland China,China,Yunnan,2020-03-06T03:23:06,174,2,170,24.974,101.487,CN,CHN
236,03-08-2020,156.0,Mainland China,China,Hainan,2020-03-08T04:33:02,168,6,159,19.1959,109.7453,CN,CHN
237,03-08-2020,156.0,Mainland China,China,Guizhou,2020-03-08T01:13:11,146,2,117,26.8154,106.8748,CN,CHN
238,03-08-2020,156.0,Mainland China,China,Tianjin,2020-03-05T03:33:27,136,3,128,39.3054,117.323,CN,CHN
239,03-08-2020,156.0,Mainland China,China,Shanxi,2020-03-05T14:53:03,133,0,126,37.5777,112.2922,CN,CHN
240,03-08-2020,156.0,Mainland China,China,Liaoning,2020-03-08T05:13:06,125,1,109,41.2956,122.6085,CN,CHN
241,03-08-2020,156.0,Mainland China,China,Gansu,2020-03-08T14:33:06,124,2,87,36.0611,103.8343,CN,CHN
242,03-08-2020,156.0,Mainland China,China,Jilin,2020-03-06T10:23:03,93,1,90,43.6661,126.1923,CN,CHN
243,03-08-2020,156.0,Mainland China,China,Xinjiang,2020-03-08T05:33:02,76,3,73,41.1129,85.2401,CN,CHN
244,03-08-2020,156.0,Mainland China,China,Inner Mongolia,2020-03-08T05:13:06,75,1,70,44.0935,113.9448,CN,CHN
245,03-08-2020,156.0,Mainland China,China,Ningxia,2020-03-06T12:53:03,75,0,71,37.2692,106.1655,CN,CHN
246,03-08-2020,156.0,Mainland China,China,Qinghai,2020-02-21T04:43:02,18,0,18,35.7452,95.9956,CN,CHN
247,03-08-2020,156.0,Mainland China,China,Tibet,2020-02-12T06:43:02,1,0,1,31.6927,88.0924,CN,CHN
248,03-09-2020,156.0,Mainland China,China,Hubei,2020-03-09T14:33:03,67743,3008,46488,30.9756,112.2707,CN,CHN
249,03-09-2020,156.0,Mainland China,China,Guangdong,2020-03-09T01:43:01,1352,8,1260,23.3417,113.4244,CN,CHN
250,03-09-2020,156.0,Mainland China,China,Henan,2020-03-08T05:03:02,1272,22,1247,33.882,113.614,CN,CHN
251,03-09-2020,156.0,Mainland China,China,Zhejiang,2020-03-09T09:43:03,1215,1,1176,29.1832,120.0934,CN,CHN
252,03-09-2020,156.0,Mainland China,China,Hunan,2020-03-09T01:33:06,1018,4,979,27.6104,111.7088,CN,CHN
253,03-09-2020,156.0,Mainland China,China,Anhui,2020-03-08T05:13:06,990,6,984,31.8257,117.2264,CN,CHN
254,03-09-2020,156.0,Mainland China,China,Jiangxi,2020-03-09T01:53:01,935,1,923,27.614,115.7221,CN,CHN
255,03-09-2020,156.0,Mainland China,China,Shandong,2020-03-09T10:13:06,758,6,700,36.3427,118.1498,CN,CHN
256,03-09-2020,156.0,Mainland China,China,Jiangsu,2020-03-09T08:53:03,631,0,621,32.9711,119.455,CN,CHN
257,03-09-2020,156.0,Mainland China,China,Chongqing,2020-03-09T23:13:03,576,6,542,30.0572,107.874,CN,CHN
258,03-09-2020,156.0,Mainland China,China,Sichuan,2020-03-09T08:53:03,539,3,466,30.6171,102.7103,CN,CHN
259,03-09-2020,156.0,Mainland China,China,Heilongjiang,2020-03-09T14:33:03,481,13,430,47.862,127.7615,CN,CHN
260,03-09-2020,156.0,Mainland China,China,Beijing,2020-03-09T01:53:01,428,8,315,40.1824,116.4142,CN,CHN
261,03-09-2020,156.0,Mainland China,China,Shanghai,2020-03-09T04:03:11,342,3,315,31.202,121.4491,CN,CHN
262,03-09-2020,156.0,Mainland China,China,Hebei,2020-03-07T13:03:05,318,6,307,38.0428,114.5149,CN,CHN
263,03-09-2020,156.0,Mainland China,China,Fujian,2020-03-07T13:03:05,296,1,295,26.0789,117.9874,CN,CHN
264,03-09-2020,156.0,Mainland China,China,Guangxi,2020-03-09T00:23:09,252,2,230,23.8298,108.7881,CN,CHN
265,03-09-2020,156.0,Mainland China,China,Shaanxi,2020-03-08T14:43:03,245,1,227,35.1917,108.8701,CN,CHN
266,03-09-2020,156.0,Mainland China,China,Yunnan,2020-03-06T03:23:06,174,2,170,24.974,101.487,CN,CHN
267,03-09-2020,156.0,Mainland China,China,Hainan,2020-03-08T04:33:02,168,6,159,19.1959,109.7453,CN,CHN
268,03-09-2020,156.0,Mainland China,China,Guizhou,2020-03-09T01:13:05,146,2,123,26.8154,106.8748,CN,CHN
269,03-09-2020,156.0,Mainland China,China,Tianjin,2020-03-09T10:13:06,136,3,130,39.3054,117.323,CN,CHN
270,03-09-2020,156.0,Mainland China,China,Shanxi,2020-03-09T11:43:02,133,0,127,37.5777,112.2922,CN,CHN
271,03-09-2020,156.0,Mainland China,China,Liaoning,2020-03-08T05:13:06,125,1,109,41.2956,122.6085,CN,CHN
272,03-09-2020,156.0,Mainland China,China,Gansu,2020-03-09T14:33:03,124,2,88,36.0611,103.8343,CN,CHN
273,03-09-2020,156.0,Mainland China,China,Jilin,2020-03-09T14:33:03,93,1,91,43.6661,126.1923,CN,CHN
274,03-09-2020,156.0,Mainland China,China,Xinjiang,2020-03-08T05:33:02,76,3,73,41.1129,85.2401,CN,CHN
275,03-09-2020,156.0,Mainland China,China,Inner Mongolia,2020-03-08T05:13:06,75,1,70,44.0935,113.9448,CN,CHN
276,03-09-2020,156.0,Mainland China,China,Ningxia,2020-03-06T12:53:03,75,0,71,37.2692,106.1655,CN,CHN
277,03-09-2020,156.0,Mainland China,China,Qinghai,2020-02-21T04:43:02,18,0,18,35.7452,95.9956,CN,CHN
278,03-09-2020,156.0,Mainland China,China,Tibet,2020-02-12T06:43:02,1,0,1,31.6927,88.0924,CN,CHN
279,03-10-2020,156.0,Mainland China,China,Hubei,2020-03-10T15:13:05,67760,3024,47743,30.9756,112.2707,CN,CHN
280,03-10-2020,156.0,Mainland China,China,Guangdong,2020-03-10T09:13:07,1353,8,1274,23.3417,113.4244,CN,CHN
281,03-10-2020,156.0,Mainland China,China,Henan,2020-03-08T05:03:02,1272,22,1247,33.882,113.614,CN,CHN
282,03-10-2020,156.0,Mainland China,China,Zhejiang,2020-03-10T10:33:02,1215,1,1191,29.1832,120.0934,CN,CHN
283,03-10-2020,156.0,Mainland China,China,Hunan,2020-03-10T08:33:02,1018,4,990,27.6104,111.7088,CN,CHN
284,03-10-2020,156.0,Mainland China,China,Anhui,2020-03-08T05:13:06,990,6,984,31.8257,117.2264,CN,CHN
285,03-10-2020,156.0,Mainland China,China,Jiangxi,2020-03-10T01:33:02,935,1,927,27.614,115.7221,CN,CHN
286,03-10-2020,156.0,Mainland China,China,Shandong,2020-03-10T07:33:03,758,6,719,36.3427,118.1498,CN,CHN
287,03-10-2020,156.0,Mainland China,China,Jiangsu,2020-03-10T08:13:08,631,0,627,32.9711,119.455,CN,CHN
288,03-10-2020,156.0,Mainland China,China,Chongqing,2020-03-10T23:53:02,576,6,547,30.0572,107.874,CN,CHN
289,03-10-2020,156.0,Mainland China,China,Sichuan,2020-03-10T10:13:17,539,3,478,30.6171,102.7103,CN,CHN
290,03-10-2020,156.0,Mainland China,China,Heilongjiang,2020-03-10T00:13:18,481,13,434,47.862,127.7615,CN,CHN
291,03-10-2020,156.0,Mainland China,China,Beijing,2020-03-10T01:13:07,429,8,320,40.1824,116.4142,CN,CHN
292,03-10-2020,156.0,Mainland China,China,Shanghai,2020-03-10T06:13:14,344,3,319,31.202,121.4491,CN,CHN
293,03-10-2020,156.0,Mainland China,China,Hebei,2020-03-07T13:03:05,318,6,307,38.0428,114.5149,CN,CHN
294,03-10-2020,156.0,Mainland China,China,Fujian,2020-03-07T13:03:05,296,1,295,26.0789,117.9874,CN,CHN
295,03-10-2020,156.0,Mainland China,China,Guangxi,2020-03-10T00:53:02,252,2,234,23.8298,108.7881,CN,CHN
296,03-10-2020,156.0,Mainland China,China,Shaanxi,2020-03-10T08:53:02,245,1,227,35.1917,108.8701,CN,CHN
297,03-10-2020,156.0,Mainland China,China,Yunnan,2020-03-06T03:23:06,174,2,170,24.974,101.487,CN,CHN
298,03-10-2020,156.0,Mainland China,China,Hainan,2020-03-08T04:33:02,168,6,159,19.1959,109.7453,CN,CHN
299,03-10-2020,156.0,Mainland China,China,Guizhou,2020-03-10T01:13:07,146,2,129,26.8154,106.8748,CN,CHN
300,03-10-2020,156.0,Mainland China,China,Tianjin,2020-03-10T10:13:25,136,3,131,39.3054,117.323,CN,CHN
301,03-10-2020,156.0,Mainland China,China,Shanxi,2020-03-10T23:53:02,133,0,131,37.5777,112.2922,CN,CHN
302,03-10-2020,156.0,Mainland China,China,Gansu,2020-03-10T14:33:13,125,2,88,36.0611,103.8343,CN,CHN
303,03-10-2020,156.0,Mainland China,China,Liaoning,2020-03-10T04:13:09,125,1,111,41.2956,122.6085,CN,CHN
304,03-10-2020,156.0,Mainland China,China,Jilin,2020-03-09T14:33:03,93,1,91,43.6661,126.1923,CN,CHN
305,03-10-2020,156.0,Mainland China,China,Xinjiang,2020-03-08T05:33:02,76,3,73,41.1129,85.2401,CN,CHN
306,03-10-2020,156.0,Mainland China,China,Inner Mongolia,2020-03-08T05:13:06,75,1,70,44.0935,113.9448,CN,CHN
307,03-10-2020,156.0,Mainland China,China,Ningxia,2020-03-06T12:53:03,75,0,71,37.2692,106.1655,CN,CHN
308,03-10-2020,156.0,Mainland China,China,Qinghai,2020-02-21T04:43:02,18,0,18,35.7452,95.9956,CN,CHN
309,03-10-2020,156.0,Mainland China,China,Tibet,2020-02-12T06:43:02,1,0,1,31.6927,88.0924,CN,CHN
310,03-11-2020,156.0,China,China,Hubei,2020-03-11T10:53:02,67773,3046,49134,30.9756,112.2707,CN,CHN
311,03-11-2020,156.0,China,China,Guangdong,2020-03-11T10:13:06,1356,8,1282,23.3417,113.4244,CN,CHN
312,03-11-2020,156.0,China,China,Henan,2020-03-11T08:13:09,1273,22,1249,33.882,113.614,CN,CHN
313,03-11-2020,156.0,China,China,Zhejiang,2020-03-11T09:33:12,1215,1,1195,29.1832,120.0934,CN,CHN
314,03-11-2020,156.0,China,China,Hunan,2020-03-11T02:18:14,1018,4,995,27.6104,111.7088,CN,CHN
315,03-11-2020,156.0,China,China,Anhui,2020-03-11T02:18:14,990,6,984,31.8257,117.2264,CN,CHN
316,03-11-2020,156.0,China,China,Jiangxi,2020-03-11T02:18:14,935,1,932,27.614,115.7221,CN,CHN
317,03-11-2020,156.0,China,China,Shandong,2020-03-11T11:33:07,760,6,726,36.3427,118.1498,CN,CHN
318,03-11-2020,156.0,China,China,Jiangsu,2020-03-11T02:18:14,631,0,627,32.9711,119.455,CN,CHN
319,03-11-2020,156.0,China,China,Chongqing,2020-03-11T23:13:05,576,6,554,30.0572,107.874,CN,CHN
320,03-11-2020,156.0,China,China,Sichuan,2020-03-11T14:33:03,539,3,488,30.6171,102.7103,CN,CHN
321,03-11-2020,156.0,China,China,Heilongjiang,2020-03-11T11:33:07,482,13,436,47.862,127.7615,CN,CHN
322,03-11-2020,156.0,China,China,Beijing,2020-03-11T02:18:14,435,8,326,40.1824,116.4142,CN,CHN
323,03-11-2020,156.0,China,China,Shanghai,2020-03-11T03:13:07,344,3,320,31.202,121.4491,CN,CHN
324,03-11-2020,156.0,China,China,Hebei,2020-03-11T02:18:14,318,6,307,39.549,116.1306,CN,CHN
325,03-11-2020,156.0,China,China,Fujian,2020-03-11T02:18:14,296,1,295,26.0789,117.9874,CN,CHN
326,03-11-2020,156.0,China,China,Guangxi,2020-03-11T11:33:07,252,2,238,23.8298,108.7881,CN,CHN
327,03-11-2020,156.0,China,China,Shaanxi,2020-03-11T09:33:12,245,1,232,35.1917,108.8701,CN,CHN
328,03-11-2020,156.0,China,China,Yunnan,2020-03-11T02:18:14,174,2,170,24.974,101.487,CN,CHN
329,03-11-2020,156.0,China,China,Hainan,2020-03-11T02:18:14,168,6,159,19.1959,109.7453,CN,CHN
330,03-11-2020,156.0,China,China,Guizhou,2020-03-11T02:33:03,146,2,133,26.8154,106.8748,CN,CHN
331,03-11-2020,156.0,China,China,Tianjin,2020-03-11T02:18:14,136,3,131,39.3054,117.323,CN,CHN
332,03-11-2020,156.0,China,China,Shanxi,2020-03-11T02:18:14,133,0,131,37.5777,112.2922,CN,CHN
333,03-11-2020,156.0,China,China,Gansu,2020-03-11T14:33:03,127,2,88,37.8099,101.0583,CN,CHN
334,03-11-2020,156.0,China,China,Hong Kong,2020-03-11T18:52:03,126,3,65,22.3,114.2,CN,CHN
335,03-11-2020,156.0,China,China,Liaoning,2020-03-11T02:18:14,125,1,111,41.2956,122.6085,CN,CHN
336,03-11-2020,156.0,China,China,Jilin,2020-03-11T02:18:14,93,1,91,43.6661,126.1923,CN,CHN
337,03-11-2020,156.0,China,China,Xinjiang,2020-03-11T02:18:14,76,3,73,41.1129,85.2401,CN,CHN
338,03-11-2020,156.0,China,China,Inner Mongolia,2020-03-11T03:53:03,75,1,71,44.0935,113.9448,CN,CHN
339,03-11-2020,156.0,China,China,Ningxia,2020-03-11T09:33:12,75,0,72,37.2692,106.1655,CN,CHN
340,03-11-2020,156.0,China,China,Qinghai,2020-03-11T02:18:14,18,0,18,35.7452,95.9956,CN,CHN
341,03-11-2020,156.0,China,China,Macau,2020-03-11T18:52:03,10,0,10,22.1667,113.55,CN,CHN
342,03-11-2020,156.0,China,China,Tibet,2020-03-11T02:18:14,1,0,1,31.6927,88.0924,CN,CHN
343,03-11-2020,156.0,Mainland China,China,Gansu,2020-03-11T02:18:28,0,0,0,36.0611,103.8343,CN,CHN
344,03-11-2020,156.0,Mainland China,China,Hebei,2020-03-11T02:18:29,0,0,0,38.0428,114.5149,CN,CHN
345,03-12-2020,156.0,China,China,Hubei,2020-03-12T09:53:06,67781,3056,50318,30.9756,112.2707,CN,CHN
346,03-12-2020,156.0,China,China,Guangdong,2020-03-12T03:53:02,1356,8,1289,23.3417,113.4244,CN,CHN
347,03-12-2020,156.0,China,China,Henan,2020-03-11T08:13:09,1273,22,1249,33.882,113.614,CN,CHN
348,03-12-2020,156.0,China,China,Zhejiang,2020-03-12T01:33:02,1215,1,1197,29.1832,120.0934,CN,CHN
349,03-12-2020,156.0,China,China,Hunan,2020-03-12T09:53:06,1018,4,999,27.6104,111.7088,CN,CHN
350,03-12-2020,156.0,China,China,Anhui,2020-03-11T02:18:14,990,6,984,31.8257,117.2264,CN,CHN
351,03-12-2020,156.0,China,China,Jiangxi,2020-03-12T02:13:04,935,1,934,27.614,115.7221,CN,CHN
352,03-12-2020,156.0,China,China,Shandong,2020-03-12T07:53:02,760,6,734,36.3427,118.1498,CN,CHN
353,03-12-2020,156.0,China,China,Jiangsu,2020-03-12T05:13:02,631,0,629,32.9711,119.455,CN,CHN
354,03-12-2020,156.0,China,China,Chongqing,2020-03-12T23:44:32,576,6,564,30.0572,107.874,CN,CHN
355,03-12-2020,156.0,China,China,Sichuan,2020-03-12T12:13:07,539,3,498,30.6171,102.7103,CN,CHN
356,03-12-2020,156.0,China,China,Heilongjiang,2020-03-12T13:13:31,482,13,441,47.862,127.7615,CN,CHN
357,03-12-2020,156.0,China,China,Beijing,2020-03-12T01:13:05,435,8,334,40.1824,116.4142,CN,CHN
358,03-12-2020,156.0,China,China,Shanghai,2020-03-12T07:53:02,344,3,321,31.202,121.4491,CN,CHN
359,03-12-2020,156.0,China,China,Hebei,2020-03-12T05:33:02,318,6,308,39.549,116.1306,CN,CHN
360,03-12-2020,156.0,China,China,Fujian,2020-03-11T02:18:14,296,1,295,26.0789,117.9874,CN,CHN
361,03-12-2020,156.0,China,China,Guangxi,2020-03-12T00:33:06,252,2,241,23.8298,108.7881,CN,CHN
362,03-12-2020,156.0,China,China,Shaanxi,2020-03-12T01:33:02,245,2,232,35.1917,108.8701,CN,CHN
363,03-12-2020,156.0,China,China,Yunnan,2020-03-11T02:18:14,174,2,170,24.974,101.487,CN,CHN
364,03-12-2020,156.0,China,China,Hainan,2020-03-12T03:53:02,168,6,160,19.1959,109.7453,CN,CHN
365,03-12-2020,156.0,China,China,Guizhou,2020-03-12T01:13:06,146,2,137,26.8154,106.8748,CN,CHN
366,03-12-2020,156.0,China,China,Tianjin,2020-03-12T01:53:03,136,3,132,39.3054,117.323,CN,CHN
367,03-12-2020,156.0,China,China,Shanxi,2020-03-12T09:13:24,133,0,132,37.5777,112.2922,CN,CHN
368,03-12-2020,156.0,China,China,Hong Kong,2020-03-12T01:53:02,129,3,67,22.3,114.2,CN,CHN
369,03-12-2020,156.0,China,China,Gansu,2020-03-11T14:33:03,127,2,88,37.8099,101.0583,CN,CHN
370,03-12-2020,156.0,China,China,Liaoning,2020-03-12T09:53:06,125,1,112,41.2956,122.6085,CN,CHN
371,03-12-2020,156.0,China,China,Jilin,2020-03-12T23:44:32,93,1,91,43.6661,126.1923,CN,CHN
372,03-12-2020,156.0,China,China,Xinjiang,2020-03-11T02:18:14,76,3,73,41.1129,85.2401,CN,CHN
373,03-12-2020,156.0,China,China,Inner Mongolia,2020-03-11T03:53:03,75,1,71,44.0935,113.9448,CN,CHN
374,03-12-2020,156.0,China,China,Ningxia,2020-03-11T09:33:12,75,0,72,37.2692,106.1655,CN,CHN
375,03-12-2020,156.0,China,China,Qinghai,2020-03-11T02:18:14,18,0,18,35.7452,95.9956,CN,CHN
376,03-12-2020,156.0,China,China,Macau,2020-03-11T18:52:03,10,0,10,22.1667,113.55,CN,CHN
377,03-12-2020,156.0,China,China,Tibet,2020-03-11T02:18:14,1,0,1,31.6927,88.0924,CN,CHN
378,03-12-2020,156.0,Mainland China,China,Gansu,2020-03-11T02:18:28,0,0,0,36.0611,103.8343,CN,CHN
379,03-12-2020,156.0,Mainland China,China,Hebei,2020-03-11T02:18:29,0,0,0,38.0428,114.5149,CN,CHN
380,03-13-2020,156.0,China,China,Hubei,2020-03-13T11:09:03,67786,3062,51553,30.9756,112.2707,CN,CHN
381,03-13-2020,156.0,China,China,Guangdong,2020-03-13T11:09:03,1356,8,1296,23.3417,113.4244,CN,CHN
382,03-13-2020,156.0,China,China,Henan,2020-03-11T08:13:09,1273,22,1249,33.882,113.61399999999999,CN,CHN
383,03-13-2020,156.0,China,China,Zhejiang,2020-03-12T01:33:02,1215,1,1197,29.1832,120.0934,CN,CHN
384,03-13-2020,156.0,China,China,Hunan,2020-03-13T11:09:03,1018,4,1005,27.6104,111.7088,CN,CHN
385,03-13-2020,156.0,China,China,Anhui,2020-03-11T02:18:14,990,6,984,31.8257,117.2264,CN,CHN
386,03-13-2020,156.0,China,China,Jiangxi,2020-03-12T02:13:04,935,1,934,27.614,115.7221,CN,CHN
387,03-13-2020,156.0,China,China,Shandong,2020-03-13T11:09:03,760,7,739,36.3427,118.1498,CN,CHN
388,03-13-2020,156.0,China,China,Jiangsu,2020-03-13T11:09:03,631,0,630,32.9711,119.455,CN,CHN
389,03-13-2020,156.0,China,China,Chongqing,2020-03-13T23:13:12,576,6,566,30.0572,107.874,CN,CHN
390,03-13-2020,156.0,China,China,Sichuan,2020-03-13T11:09:03,539,3,503,30.6171,102.7103,CN,CHN
391,03-13-2020,156.0,China,China,Heilongjiang,2020-03-13T11:09:03,482,13,446,47.861999999999995,127.7615,CN,CHN
392,03-13-2020,156.0,China,China,Beijing,2020-03-13T11:09:03,436,8,342,40.1824,116.4142,CN,CHN
393,03-13-2020,156.0,China,China,Shanghai,2020-03-13T11:09:03,346,3,324,31.201999999999998,121.4491,CN,CHN
394,03-13-2020,156.0,China,China,Hebei,2020-03-13T11:09:03,318,6,310,38.0428,114.5149,CN,CHN
395,03-13-2020,156.0,China,China,Fujian,2020-03-11T02:18:14,296,1,295,26.0789,117.9874,CN,CHN
396,03-13-2020,156.0,China,China,Guangxi,2020-03-13T11:09:03,252,2,243,23.8298,108.7881,CN,CHN
397,03-13-2020,156.0,China,China,Shaanxi,2020-03-12T01:33:02,245,2,232,35.1917,108.8701,CN,CHN
398,03-13-2020,156.0,China,China,Yunnan,2020-03-11T02:18:14,174,2,170,24.974,101.48700000000001,CN,CHN
399,03-13-2020,156.0,China,China,Hainan,2020-03-12T03:53:02,168,6,160,19.1959,109.7453,CN,CHN
400,03-13-2020,156.0,China,China,Guizhou,2020-03-13T11:09:03,146,2,140,26.8154,106.8748,CN,CHN
401,03-13-2020,156.0,China,China,Tianjin,2020-03-12T01:53:03,136,3,132,39.3054,117.323,CN,CHN
402,03-13-2020,156.0,China,China,Hong Kong,2020-03-13T13:33:03,134,4,77,22.3,114.2,CN,CHN
403,03-13-2020,156.0,China,China,Shanxi,2020-03-13T11:09:03,133,0,133,37.5777,112.2922,CN,CHN
404,03-13-2020,156.0,China,China,Gansu,2020-03-13T11:09:03,127,2,88,36.0611,103.8343,CN,CHN
405,03-13-2020,156.0,China,China,Liaoning,2020-03-12T09:53:06,125,1,112,41.2956,122.6085,CN,CHN
406,03-13-2020,156.0,China,China,Xinjiang,2020-03-11T02:18:14,76,3,73,41.1129,85.2401,CN,CHN
407,03-13-2020,156.0,China,China,Inner Mongolia,2020-03-11T03:53:03,75,1,71,44.0935,113.9448,CN,CHN
408,03-13-2020,156.0,China,China,Ningxia,2020-03-11T09:33:12,75,0,72,37.2692,106.1655,CN,CHN
409,03-13-2020,156.0,China,China,Jilin,2020-03-13T11:09:03,93,1,91,43.6661,126.1923,CN,CHN
410,03-13-2020,156.0,China,China,Qinghai,2020-03-11T02:18:14,18,0,18,35.7452,95.9956,CN,CHN
411,03-13-2020,156.0,China,China,Macau,2020-03-11T18:52:03,10,0,10,22.1667,113.55,CN,CHN
412,03-13-2020,156.0,China,China,Tibet,2020-03-11T02:18:14,1,0,1,31.6927,88.0924,CN,CHN
413,03-14-2020,156.0,China,China,Hubei,2020-03-14T10:13:09,67790,3075,52960,30.9756,112.2707,CN,CHN
414,03-14-2020,156.0,China,China,Guangdong,2020-03-14T01:13:11,1356,8,1299,23.3417,113.4244,CN,CHN
415,03-14-2020,156.0,China,China,Henan,2020-03-14T09:53:08,1273,22,1250,33.882,113.614,CN,CHN
416,03-14-2020,156.0,China,China,Zhejiang,2020-03-14T02:14:15,1227,1,1211,29.1832,120.0934,CN,CHN
417,03-14-2020,156.0,China,China,Hunan,2020-03-14T08:33:03,1018,4,1014,27.6104,111.7088,CN,CHN
418,03-14-2020,156.0,China,China,Anhui,2020-03-11T02:18:14,990,6,984,31.8257,117.2264,CN,CHN
419,03-14-2020,156.0,China,China,Jiangxi,2020-03-12T02:13:04,935,1,934,27.614,115.7221,CN,CHN
420,03-14-2020,156.0,China,China,Shandong,2020-03-14T04:33:02,760,7,741,36.3427,118.1498,CN,CHN
421,03-14-2020,156.0,China,China,Jiangsu,2020-03-13T11:09:03,631,0,630,32.9711,119.455,CN,CHN
422,03-14-2020,156.0,China,China,Chongqing,2020-03-14T23:53:02,576,6,569,30.0572,107.874,CN,CHN
423,03-14-2020,156.0,China,China,Sichuan,2020-03-14T04:33:02,539,3,511,30.6171,102.7103,CN,CHN
424,03-14-2020,156.0,China,China,Heilongjiang,2020-03-14T00:13:05,482,13,447,47.862,127.7615,CN,CHN
425,03-14-2020,156.0,China,China,Beijing,2020-03-14T02:13:47,437,8,349,40.1824,116.4142,CN,CHN
426,03-14-2020,156.0,China,China,Shanghai,2020-03-14T23:53:02,353,3,324,31.202,121.4491,CN,CHN
427,03-14-2020,156.0,China,China,Hebei,2020-03-13T11:09:03,318,6,310,38.0428,114.5149,CN,CHN
428,03-14-2020,156.0,China,China,Fujian,2020-03-11T02:18:14,296,1,295,26.0789,117.9874,CN,CHN
429,03-14-2020,156.0,China,China,Guangxi,2020-03-13T11:09:03,252,2,243,23.8298,108.7881,CN,CHN
430,03-14-2020,156.0,China,China,Shaanxi,2020-03-12T01:33:02,245,2,232,35.1917,108.8701,CN,CHN
431,03-14-2020,156.0,China,China,Yunnan,2020-03-14T23:33:02,174,2,172,24.974,101.487,CN,CHN
432,03-14-2020,156.0,China,China,Hainan,2020-03-12T03:53:02,168,6,160,19.1959,109.7453,CN,CHN
433,03-14-2020,156.0,China,China,Guizhou,2020-03-14T00:53:03,146,2,143,26.8154,106.8748,CN,CHN
434,03-14-2020,156.0,China,China,Hong Kong,2020-03-14T12:53:06,140,4,78,22.3,114.2,CN,CHN
435,03-14-2020,156.0,China,China,Tianjin,2020-03-12T01:53:03,136,3,132,39.3054,117.323,CN,CHN
436,03-14-2020,156.0,China,China,Shanxi,2020-03-13T11:09:03,133,0,133,37.5777,112.2922,CN,CHN
437,03-14-2020,156.0,China,China,Gansu,2020-03-14T03:13:08,129,2,89,36.0611,103.8343,CN,CHN
438,03-14-2020,156.0,China,China,Liaoning,2020-03-14T00:13:05,125,1,113,41.2956,122.6085,CN,CHN
439,03-14-2020,156.0,China,China,Jilin,2020-03-13T11:09:03,93,1,91,43.6661,126.1923,CN,CHN
440,03-14-2020,156.0,China,China,Xinjiang,2020-03-11T02:18:14,76,3,73,41.1129,85.2401,CN,CHN
441,03-14-2020,156.0,China,China,Inner Mongolia,2020-03-11T03:53:03,75,1,71,44.0935,113.9448,CN,CHN
442,03-14-2020,156.0,China,China,Ningxia,2020-03-14T09:53:08,75,0,73,37.2692,106.1655,CN,CHN
443,03-14-2020,156.0,China,China,Qinghai,2020-03-11T02:18:14,18,0,18,35.7452,95.9956,CN,CHN
444,03-14-2020,156.0,China,China,Macau,2020-03-11T18:52:03,10,0,10,22.1667,113.55,CN,CHN
445,03-14-2020,156.0,China,China,Tibet,2020-03-11T02:18:14,1,0,1,31.6927,88.0924,CN,CHN
446,03-15-2020,156.0,China,China,Hubei,2020-03-15T18:20:18,67794,3085,54288,30.9756,112.2707,CN,CHN
447,03-15-2020,156.0,China,China,Guangdong,2020-03-15T18:20:18,1360,8,1304,23.3417,113.4244,CN,CHN
448,03-15-2020,156.0,China,China,Henan,2020-03-14T09:53:08,1273,22,1250,33.882,113.61399999999999,CN,CHN
449,03-15-2020,156.0,China,China,Zhejiang,2020-03-15T01:33:02,1231,1,1211,29.1832,120.0934,CN,CHN
450,03-15-2020,156.0,China,China,Hunan,2020-03-14T08:33:03,1018,4,1014,27.6104,111.7088,CN,CHN
451,03-15-2020,156.0,China,China,Anhui,2020-03-11T02:18:14,990,6,984,31.8257,117.2264,CN,CHN
452,03-15-2020,156.0,China,China,Jiangxi,2020-03-12T02:13:04,935,1,934,27.614,115.7221,CN,CHN
453,03-15-2020,156.0,China,China,Shandong,2020-03-14T04:33:02,760,7,741,36.3427,118.1498,CN,CHN
454,03-15-2020,156.0,China,China,Jiangsu,2020-03-15T01:53:02,631,0,631,32.9711,119.455,CN,CHN
455,03-15-2020,156.0,China,China,Chongqing,2020-03-15T03:53:04,576,6,570,30.0572,107.874,CN,CHN
456,03-15-2020,156.0,China,China,Sichuan,2020-03-15T18:20:18,539,3,516,30.6171,102.7103,CN,CHN
457,03-15-2020,156.0,China,China,Heilongjiang,2020-03-15T00:33:02,482,13,453,47.861999999999995,127.7615,CN,CHN
458,03-15-2020,156.0,China,China,Beijing,2020-03-15T01:13:10,442,8,353,40.1824,116.4142,CN,CHN
459,03-15-2020,156.0,China,China,Shanghai,2020-03-14T23:53:02,353,3,324,31.201999999999998,121.4491,CN,CHN
460,03-15-2020,156.0,China,China,Hebei,2020-03-13T11:09:03,318,6,310,38.0428,114.5149,CN,CHN
461,03-15-2020,156.0,China,China,Fujian,2020-03-11T02:18:14,296,1,295,26.0789,117.9874,CN,CHN
462,03-15-2020,156.0,China,China,Guangxi,2020-03-13T11:09:03,252,2,243,23.8298,108.7881,CN,CHN
463,03-15-2020,156.0,China,China,Shaanxi,2020-03-12T01:33:02,245,2,232,35.1917,108.8701,CN,CHN
464,03-15-2020,156.0,China,China,Yunnan,2020-03-14T23:33:02,174,2,172,24.974,101.48700000000001,CN,CHN
465,03-15-2020,156.0,China,China,Hainan,2020-03-12T03:53:02,168,6,160,19.1959,109.7453,CN,CHN
466,03-15-2020,156.0,China,China,Guizhou,2020-03-14T00:53:03,146,2,143,26.8154,106.8748,CN,CHN
467,03-15-2020,156.0,China,China,Hong Kong,2020-03-15T18:20:18,145,4,81,22.3,114.2,CN,CHN
468,03-15-2020,156.0,China,China,Tianjin,2020-03-15T18:20:18,136,3,133,39.3054,117.323,CN,CHN
469,03-15-2020,156.0,China,China,Gansu,2020-03-15T18:20:18,133,2,91,36.0611,103.8343,CN,CHN
470,03-15-2020,156.0,China,China,Shanxi,2020-03-13T11:09:03,133,0,133,37.5777,112.2922,CN,CHN
471,03-15-2020,156.0,China,China,Liaoning,2020-03-15T04:13:27,125,1,114,41.2956,122.6085,CN,CHN
472,03-15-2020,156.0,China,China,Jilin,2020-03-13T11:09:03,93,1,91,43.6661,126.1923,CN,CHN
473,03-15-2020,156.0,China,China,Xinjiang,2020-03-11T02:18:14,76,3,73,41.1129,85.2401,CN,CHN
474,03-15-2020,156.0,China,China,Inner Mongolia,2020-03-11T03:53:03,75,1,71,44.0935,113.9448,CN,CHN
475,03-15-2020,156.0,China,China,Ningxia,2020-03-14T09:53:08,75,0,73,37.2692,106.1655,CN,CHN
476,03-15-2020,156.0,China,China,Qinghai,2020-03-11T02:18:14,18,0,18,35.7452,95.9956,CN,CHN
477,03-15-2020,156.0,China,China,Macau,2020-03-11T18:52:03,10,0,10,22.1667,113.55,CN,CHN
478,03-15-2020,156.0,China,China,Tibet,2020-03-11T02:18:14,1,0,1,31.6927,88.0924,CN,CHN
479,03-16-2020,156.0,China,China,Hubei,2020-03-16T14:38:45,67798,3099,55142,30.9756,112.2707,CN,CHN
480,03-16-2020,156.0,China,China,Guangdong,2020-03-16T01:53:03,1361,8,1306,23.3417,113.4244,CN,CHN
481,03-16-2020,156.0,China,China,Henan,2020-03-14T09:53:08,1273,22,1250,33.882,113.614,CN,CHN
482,03-16-2020,156.0,China,China,Zhejiang,2020-03-16T14:38:45,1231,1,1216,29.1832,120.0934,CN,CHN
483,03-16-2020,156.0,China,China,Hunan,2020-03-14T08:33:03,1018,4,1014,27.6104,111.7088,CN,CHN
484,03-16-2020,156.0,China,China,Anhui,2020-03-11T02:18:14,990,6,984,31.8257,117.2264,CN,CHN
485,03-16-2020,156.0,China,China,Jiangxi,2020-03-12T02:13:04,935,1,934,27.614,115.7221,CN,CHN
486,03-16-2020,156.0,China,China,Shandong,2020-03-16T14:38:45,760,7,746,36.3427,118.1498,CN,CHN
487,03-16-2020,156.0,China,China,Jiangsu,2020-03-15T01:53:02,631,0,631,32.9711,119.455,CN,CHN
488,03-16-2020,156.0,China,China,Chongqing,2020-03-15T03:53:04,576,6,570,30.0572,107.874,CN,CHN
489,03-16-2020,156.0,China,China,Sichuan,2020-03-15T18:20:18,539,3,516,30.6171,102.7103,CN,CHN
490,03-16-2020,156.0,China,China,Heilongjiang,2020-03-16T14:38:45,482,13,455,47.862,127.7615,CN,CHN
491,03-16-2020,156.0,China,China,Beijing,2020-03-16T14:38:45,452,8,360,40.1824,116.4142,CN,CHN
492,03-16-2020,156.0,China,China,Shanghai,2020-03-16T14:38:45,355,3,325,31.202,121.4491,CN,CHN
493,03-16-2020,156.0,China,China,Hebei,2020-03-13T11:09:03,318,6,310,38.0428,114.5149,CN,CHN
494,03-16-2020,156.0,China,China,Fujian,2020-03-11T02:18:14,296,1,295,26.0789,117.9874,CN,CHN
495,03-16-2020,156.0,China,China,Guangxi,2020-03-16T14:38:45,252,2,248,23.8298,108.7881,CN,CHN
496,03-16-2020,156.0,China,China,Shaanxi,2020-03-16T14:38:45,245,2,233,35.1917,108.8701,CN,CHN
497,03-16-2020,156.0,China,China,Yunnan,2020-03-16T23:53:02,176,2,172,24.974,101.487,CN,CHN
498,03-16-2020,156.0,China,China,Hainan,2020-03-16T14:38:45,168,6,161,19.1959,109.7453,CN,CHN
499,03-16-2020,156.0,China,China,Hong Kong,2020-03-16T14:38:45,155,4,84,22.3,114.2,CN,CHN
500,03-16-2020,156.0,China,China,Guizhou,2020-03-16T14:38:45,146,2,144,26.8154,106.8748,CN,CHN
501,03-16-2020,156.0,China,China,Tianjin,2020-03-15T18:20:18,136,3,133,39.3054,117.323,CN,CHN
502,03-16-2020,156.0,China,China,Gansu,2020-03-15T18:20:18,133,2,91,36.0611,103.8343,CN,CHN
503,03-16-2020,156.0,China,China,Shanxi,2020-03-13T11:09:03,133,0,133,37.5777,112.2922,CN,CHN
504,03-16-2020,156.0,China,China,Liaoning,2020-03-16T14:38:45,125,1,115,41.2956,122.6085,CN,CHN
505,03-16-2020,156.0,China,China,Jilin,2020-03-16T00:22:10,93,1,92,43.6661,126.1923,CN,CHN
506,03-16-2020,156.0,China,China,Xinjiang,2020-03-11T02:18:14,76,3,73,41.1129,85.2401,CN,CHN
507,03-16-2020,156.0,China,China,Inner Mongolia,2020-03-16T14:38:45,75,1,73,44.0935,113.9448,CN,CHN
508,03-16-2020,156.0,China,China,Ningxia,2020-03-16T14:38:45,75,0,75,37.2692,106.1655,CN,CHN
509,03-16-2020,156.0,China,China,Qinghai,2020-03-11T02:18:14,18,0,18,35.7452,95.9956,CN,CHN
510,03-16-2020,156.0,China,China,Macau,2020-03-16T00:22:10,11,0,10,22.1667,113.55,CN,CHN
511,03-16-2020,156.0,China,China,Tibet,2020-03-11T02:18:14,1,0,1,31.6927,88.0924,CN,CHN
512,03-17-2020,156.0,China,China,Hubei,2020-03-17T11:53:10,67799,3111,56003,30.9756,112.2707,CN,CHN
513,03-17-2020,156.0,China,China,Guangdong,2020-03-17T01:53:03,1364,8,1307,23.3417,113.4244,CN,CHN
514,03-17-2020,156.0,China,China,Henan,2020-03-14T09:53:08,1273,22,1250,33.882,113.614,CN,CHN
515,03-17-2020,156.0,China,China,Zhejiang,2020-03-17T02:13:21,1232,1,1216,29.1832,120.0934,CN,CHN
516,03-17-2020,156.0,China,China,Hunan,2020-03-14T08:33:03,1018,4,1014,27.6104,111.7088,CN,CHN
517,03-17-2020,156.0,China,China,Anhui,2020-03-11T02:18:14,990,6,984,31.8257,117.2264,CN,CHN
518,03-17-2020,156.0,China,China,Jiangxi,2020-03-12T02:13:04,935,1,934,27.614,115.7221,CN,CHN
519,03-17-2020,156.0,China,China,Shandong,2020-03-17T00:33:02,761,7,746,36.3427,118.1498,CN,CHN
520,03-17-2020,156.0,China,China,Jiangsu,2020-03-15T01:53:02,631,0,631,32.9711,119.455,CN,CHN
521,03-17-2020,156.0,China,China,Chongqing,2020-03-15T03:53:04,576,6,570,30.0572,107.874,CN,CHN
522,03-17-2020,156.0,China,China,Sichuan,2020-03-17T08:33:02,540,3,520,30.6171,102.7103,CN,CHN
523,03-17-2020,156.0,China,China,Heilongjiang,2020-03-17T01:33:02,482,13,456,47.862,127.7615,CN,CHN
524,03-17-2020,156.0,China,China,Beijing,2020-03-17T10:53:03,456,8,369,40.1824,116.4142,CN,CHN
525,03-17-2020,156.0,China,China,Shanghai,2020-03-17T02:13:20,358,3,325,31.202,121.4491,CN,CHN
526,03-17-2020,156.0,China,China,Hebei,2020-03-13T11:09:03,318,6,310,38.0428,114.5149,CN,CHN
527,03-17-2020,156.0,China,China,Fujian,2020-03-11T02:18:14,296,1,295,26.0789,117.9874,CN,CHN
528,03-17-2020,156.0,China,China,Guangxi,2020-03-17T00:33:02,253,2,248,23.8298,108.7881,CN,CHN
529,03-17-2020,156.0,China,China,Shaanxi,2020-03-17T10:53:03,246,3,236,35.1917,108.8701,CN,CHN
530,03-17-2020,156.0,China,China,Yunnan,2020-03-16T23:53:02,176,2,172,24.974,101.487,CN,CHN
531,03-17-2020,156.0,China,China,Hainan,2020-03-16T14:38:45,168,6,161,19.1959,109.7453,CN,CHN
532,03-17-2020,156.0,China,China,Hong Kong,2020-03-17T10:13:11,162,4,88,22.3,114.2,CN,CHN
533,03-17-2020,156.0,China,China,Guizhou,2020-03-17T07:33:03,147,2,144,26.8154,106.8748,CN,CHN
534,03-17-2020,156.0,China,China,Tianjin,2020-03-15T18:20:18,136,3,133,39.3054,117.323,CN,CHN
535,03-17-2020,156.0,China,China,Gansu,2020-03-15T18:20:18,133,2,91,36.0611,103.8343,CN,CHN
536,03-17-2020,156.0,China,China,Shanxi,2020-03-13T11:09:03,133,0,133,37.5777,112.2922,CN,CHN
537,03-17-2020,156.0,China,China,Liaoning,2020-03-17T12:13:13,125,1,120,41.2956,122.6085,CN,CHN
538,03-17-2020,156.0,China,China,Jilin,2020-03-16T00:22:10,93,1,92,43.6661,126.1923,CN,CHN
539,03-17-2020,156.0,China,China,Xinjiang,2020-03-11T02:18:14,76,3,73,41.1129,85.2401,CN,CHN
540,03-17-2020,156.0,China,China,Inner Mongolia,2020-03-16T14:38:45,75,1,73,44.0935,113.9448,CN,CHN
541,03-17-2020,156.0,China,China,Ningxia,2020-03-16T14:38:45,75,0,75,37.2692,106.1655,CN,CHN
542,03-17-2020,156.0,China,China,Qinghai,2020-03-11T02:18:14,18,0,18,35.7452,95.9956,CN,CHN
543,03-17-2020,156.0,China,China,Macau,2020-03-17T04:32:18,12,0,10,22.1667,113.55,CN,CHN
544,03-17-2020,156.0,China,China,Tibet,2020-03-11T02:18:14,1,0,1,31.6927,88.0924,CN,CHN
545,03-18-2020,156.0,China,China,Hubei,2020-03-18T12:13:09,67800,3122,56927,30.9756,112.2707,CN,CHN
546,03-18-2020,156.0,China,China,Guangdong,2020-03-18T08:53:03,1370,8,1313,23.3417,113.4244,CN,CHN
547,03-18-2020,156.0,China,China,Henan,2020-03-14T09:53:08,1273,22,1250,33.882,113.614,CN,CHN
548,03-18-2020,156.0,China,China,Zhejiang,2020-03-17T02:13:21,1232,1,1216,29.1832,120.0934,CN,CHN
549,03-18-2020,156.0,China,China,Hunan,2020-03-14T08:33:03,1018,4,1014,27.6104,111.7088,CN,CHN
550,03-18-2020,156.0,China,China,Anhui,2020-03-11T02:18:14,990,6,984,31.8257,117.2264,CN,CHN
551,03-18-2020,156.0,China,China,Jiangxi,2020-03-12T02:13:04,935,1,934,27.614,115.7221,CN,CHN
552,03-18-2020,156.0,China,China,Shandong,2020-03-17T00:33:02,761,7,746,36.3427,118.1498,CN,CHN
553,03-18-2020,156.0,China,China,Jiangsu,2020-03-15T01:53:02,631,0,631,32.9711,119.455,CN,CHN
554,03-18-2020,156.0,China,China,Chongqing,2020-03-15T03:53:04,576,6,570,30.0572,107.874,CN,CHN
555,03-18-2020,156.0,China,China,Sichuan,2020-03-18T02:13:05,540,3,525,30.6171,102.7103,CN,CHN
556,03-18-2020,156.0,China,China,Heilongjiang,2020-03-18T11:53:03,482,13,459,47.862,127.7615,CN,CHN
557,03-18-2020,156.0,China,China,Beijing,2020-03-18T05:33:05,469,8,378,40.1824,116.4142,CN,CHN
558,03-18-2020,156.0,China,China,Shanghai,2020-03-18T05:53:25,361,3,326,31.202,121.4491,CN,CHN
559,03-18-2020,156.0,China,China,Hebei,2020-03-13T11:09:03,318,6,310,38.0428,114.5149,CN,CHN
560,03-18-2020,156.0,China,China,Fujian,2020-03-11T02:18:14,296,1,295,26.0789,117.9874,CN,CHN
561,03-18-2020,156.0,China,China,Guangxi,2020-03-18T00:33:02,253,2,250,23.8298,108.7881,CN,CHN
562,03-18-2020,156.0,China,China,Shaanxi,2020-03-18T03:53:02,246,3,237,35.1917,108.8701,CN,CHN
563,03-18-2020,156.0,China,China,Hong Kong,2020-03-18T09:33:05,181,4,92,22.3,114.2,CN,CHN
564,03-18-2020,156.0,China,China,Yunnan,2020-03-16T23:53:02,176,2,172,24.974,101.487,CN,CHN
565,03-18-2020,156.0,China,China,Hainan,2020-03-16T14:38:45,168,6,161,19.1959,109.7453,CN,CHN
566,03-18-2020,156.0,China,China,Guizhou,2020-03-18T01:53:03,146,2,144,26.8154,106.8748,CN,CHN
567,03-18-2020,156.0,China,China,Tianjin,2020-03-15T18:20:18,136,3,133,39.3054,117.323,CN,CHN
568,03-18-2020,156.0,China,China,Gansu,2020-03-15T18:20:18,133,2,91,36.0611,103.8343,CN,CHN
569,03-18-2020,156.0,China,China,Shanxi,2020-03-13T11:09:03,133,0,133,37.5777,112.2922,CN,CHN
570,03-18-2020,156.0,China,China,Liaoning,2020-03-18T02:13:06,125,1,122,41.2956,122.6085,CN,CHN
571,03-18-2020,156.0,China,China,Jilin,2020-03-16T00:22:10,93,1,92,43.6661,126.1923,CN,CHN
572,03-18-2020,156.0,China,China,Xinjiang,2020-03-11T02:18:14,76,3,73,41.1129,85.2401,CN,CHN
573,03-18-2020,156.0,China,China,Inner Mongolia,2020-03-16T14:38:45,75,1,73,44.0935,113.9448,CN,CHN
574,03-18-2020,156.0,China,China,Ningxia,2020-03-16T14:38:45,75,0,75,37.2692,106.1655,CN,CHN
575,03-18-2020,156.0,China,China,Qinghai,2020-03-11T02:18:14,18,0,18,35.7452,95.9956,CN,CHN
576,03-18-2020,156.0,China,China,Macau,2020-03-18T10:33:04,15,0,10,22.1667,113.55,CN,CHN
577,03-18-2020,156.0,China,China,Tibet,2020-03-11T02:18:14,1,0,1,31.6927,88.0924,CN,CHN
578,03-01-2020,410.0,South Korea,Korea (the Republic of),,2020-03-01T23:43:03,3736,17,30,36.0,128.0,KR,KOR
579,03-02-2020,410.0,South Korea,Korea (the Republic of),,2020-03-02T20:23:16,4335,28,30,36.0,128.0,KR,KOR
580,03-03-2020,410.0,South Korea,Korea (the Republic of),,2020-03-03T09:43:02,5186,28,30,36.0,128.0,KR,KOR
581,03-04-2020,410.0,South Korea,Korea (the Republic of),,2020-03-04T19:23:03,5621,35,41,36.0,128.0,KR,KOR
582,03-05-2020,410.0,South Korea,Korea (the Republic of),,2020-03-05T09:03:09,6088,35,41,36.0,128.0,KR,KOR
583,03-06-2020,410.0,South Korea,Korea (the Republic of),,2020-03-06T13:33:03,6593,42,135,36.0,128.0,KR,KOR
584,03-07-2020,410.0,South Korea,Korea (the Republic of),,2020-03-07T10:13:22,7041,44,135,36.0,128.0,KR,KOR
585,03-08-2020,410.0,South Korea,Korea (the Republic of),,2020-03-08T12:53:03,7314,50,118,36.0,128.0,KR,KOR
586,03-09-2020,410.0,South Korea,Korea (the Republic of),,2020-03-09T09:03:03,7478,53,118,36.0,128.0,KR,KOR
587,03-11-2020,410.0,"Korea, South",Korea (the Republic of),,2020-03-11T21:13:18,7755,60,288,36.0,128.0,KR,KOR
588,03-12-2020,410.0,"Korea, South",Korea (the Republic of),,2020-03-12T05:13:02,7869,66,333,36.0,128.0,KR,KOR
589,03-13-2020,410.0,"Korea, South",Korea (the Republic of),,2020-03-11T20:00:00,7979,66,510,35.9078,127.7669,KR,KOR
590,03-14-2020,410.0,"Korea, South",Korea (the Republic of),,2020-03-14T01:33:02,8086,72,510,35.9078,127.7669,KR,KOR
591,03-15-2020,410.0,"Korea, South",Korea (the Republic of),,2020-03-15T18:20:18,8162,75,510,35.9078,127.7669,KR,KOR
592,03-16-2020,410.0,"Korea, South",Korea (the Republic of),,2020-03-16T14:38:45,8236,75,1137,35.9078,127.7669,KR,KOR
593,03-17-2020,410.0,"Korea, South",Korea (the Republic of),,2020-03-17T10:33:03,8320,81,1407,35.9078,127.7669,KR,KOR
594,03-18-2020,410.0,"Korea, South",Korea (the Republic of),,2020-03-18T02:53:03,8413,84,1540,35.9078,127.7669,KR,KOR
595,03-01-2020,380.0,Italy,Italy,,2020-03-01T23:23:02,1694,34,83,43.0,12.0,IT,ITA
596,03-02-2020,380.0,Italy,Italy,,2020-03-02T20:23:16,2036,52,149,43.0,12.0,IT,ITA
597,03-03-2020,380.0,Italy,Italy,,2020-03-03T20:03:06,2502,79,160,43.0,12.0,IT,ITA
598,03-04-2020,380.0,Italy,Italy,,2020-03-04T19:23:03,3089,107,276,43.0,12.0,IT,ITA
599,03-05-2020,380.0,Italy,Italy,,2020-03-05T17:43:03,3858,148,414,43.0,12.0,IT,ITA
600,03-06-2020,380.0,Italy,Italy,,2020-03-06T17:33:03,4636,197,523,43.0,12.0,IT,ITA
601,03-07-2020,380.0,Italy,Italy,,2020-03-07T17:33:03,5883,233,589,43.0,12.0,IT,ITA
602,03-08-2020,380.0,Italy,Italy,,2020-03-08T18:03:04,7375,366,622,43.0,12.0,IT,ITA
603,03-09-2020,380.0,Italy,Italy,,2020-03-09T18:13:11,9172,463,724,43.0,12.0,IT,ITA
604,03-10-2020,380.0,Italy,Italy,,2020-03-10T17:53:02,10149,631,724,43.0,12.0,IT,ITA
605,03-11-2020,380.0,Italy,Italy,,2020-03-11T21:33:02,12462,827,1045,43.0,12.0,IT,ITA
606,03-12-2020,380.0,Italy,Italy,,2020-03-11T21:33:02,12462,827,1045,43.0,12.0,IT,ITA
607,03-13-2020,380.0,Italy,Italy,,2020-03-11T20:00:00,17660,1266,1439,41.8719,12.5674,IT,ITA
608,03-14-2020,380.0,Italy,Italy,,2020-03-14T20:13:16,21157,1441,1966,41.8719,12.5674,IT,ITA
609,03-15-2020,380.0,Italy,Italy,,2020-03-14T20:13:16,24747,1809,2335,41.8719,12.5674,IT,ITA
610,03-16-2020,380.0,Italy,Italy,,2020-03-16T17:33:03,27980,2158,2749,41.8719,12.5674,IT,ITA
611,03-17-2020,380.0,Italy,Italy,,2020-03-17T18:33:02,31506,2503,2941,41.8719,12.5674,IT,ITA
612,03-18-2020,380.0,Italy,Italy,,2020-03-18T17:33:05,35713,2978,4025,41.8719,12.5674,IT,ITA
613,03-01-2020,364.0,Iran,Iran (Islamic Republic of),,2020-03-01T15:33:03,978,54,175,32.0,53.0,IR,IRN
614,03-02-2020,364.0,Iran,Iran (Islamic Republic of),,2020-03-02T20:23:16,1501,66,291,32.0,53.0,IR,IRN
615,03-03-2020,364.0,Iran,Iran (Islamic Republic of),,2020-03-03T14:23:03,2336,77,291,32.0,53.0,IR,IRN
616,03-04-2020,364.0,Iran,Iran (Islamic Republic of),,2020-03-04T12:33:03,2922,92,552,32.0,53.0,IR,IRN
617,03-05-2020,364.0,Iran,Iran (Islamic Republic of),,2020-03-05T13:43:04,3513,107,739,32.0,53.0,IR,IRN
618,03-06-2020,364.0,Iran,Iran (Islamic Republic of),,2020-03-06T12:23:04,4747,124,913,32.0,53.0,IR,IRN
619,03-07-2020,364.0,Iran,Iran (Islamic Republic of),,2020-03-07T17:43:05,5823,145,1669,32.0,53.0,IR,IRN
620,03-08-2020,364.0,Iran,Iran (Islamic Republic of),,2020-03-08T11:03:30,6566,194,2134,32.0,53.0,IR,IRN
621,03-09-2020,364.0,Iran,Iran (Islamic Republic of),,2020-03-09T10:53:03,7161,237,2394,32.0,53.0,IR,IRN
622,03-10-2020,364.0,Iran (Islamic Republic of),Iran (Islamic Republic of),,2020-03-10T19:13:20,8042,291,2731,32.0,53.0,IR,IRN
623,03-11-2020,364.0,Iran,Iran (Islamic Republic of),,2020-03-11T18:52:03,9000,354,2959,32.0,53.0,IR,IRN
624,03-12-2020,364.0,Iran,Iran (Islamic Republic of),,2020-03-12T11:13:27,10075,429,2959,32.0,53.0,IR,IRN
625,03-13-2020,364.0,Iran,Iran (Islamic Republic of),,2020-03-11T20:00:00,11364,514,2959,32.4279,53.688,IR,IRN
626,03-14-2020,364.0,Iran,Iran (Islamic Republic of),,2020-03-14T11:33:06,12729,611,2959,32.4279,53.688,IR,IRN
627,03-15-2020,364.0,Iran,Iran (Islamic Republic of),,2020-03-15T18:20:18,13938,724,4590,32.4279,53.688,IR,IRN
628,03-16-2020,364.0,Iran,Iran (Islamic Republic of),,2020-03-16T14:38:45,14991,853,4590,32.4279,53.688,IR,IRN
629,03-17-2020,364.0,Iran,Iran (Islamic Republic of),,2020-03-17T15:13:09,16169,988,5389,32.4279,53.688,IR,IRN
630,03-18-2020,364.0,Iran,Iran (Islamic Republic of),,2020-03-18T12:33:02,17361,1135,5389,32.4279,53.688,IR,IRN
631,03-01-2020,10000.0,Others,Cruise Ship,Diamond Princess cruise ship,2020-02-29T01:43:02,705,6,10,35.4437,139.638,,
632,03-02-2020,10000.0,Others,Cruise Ship,Diamond Princess cruise ship,2020-03-02T14:33:03,705,6,10,35.4437,139.638,,
633,03-03-2020,10000.0,Others,Cruise Ship,Diamond Princess cruise ship,2020-03-03T03:13:06,706,6,10,35.4437,139.638,,
634,03-04-2020,10000.0,Others,Cruise Ship,Diamond Princess cruise ship,2020-03-03T03:13:06,706,6,10,35.4437,139.638,,
635,03-05-2020,10000.0,Others,Cruise Ship,Diamond Princess cruise ship,2020-03-03T03:13:06,706,6,10,35.4437,139.638,,
636,03-06-2020,10000.0,Others,Cruise Ship,Diamond Princess cruise ship,2020-03-06T01:29:39,696,6,40,35.4437,139.638,,
637,03-07-2020,10000.0,Others,Cruise Ship,Diamond Princess cruise ship,2020-03-06T01:29:39,696,6,40,35.4437,139.638,,
638,03-08-2020,10000.0,Others,Cruise Ship,Diamond Princess cruise ship,2020-03-06T01:29:39,696,6,40,35.4437,139.638,,
639,03-09-2020,10000.0,Others,Cruise Ship,Diamond Princess cruise ship,2020-03-06T01:29:39,696,6,40,35.4437,139.638,,
640,03-10-2020,10000.0,Others,Cruise Ship,Diamond Princess cruise ship,2020-03-06T01:29:39,696,6,40,35.4437,139.638,,
641,03-11-2020,10000.0,Cruise Ship,Cruise Ship,Diamond Princess,2020-03-11T22:13:12,696,7,325,35.4437,139.638,,
642,03-12-2020,10000.0,Cruise Ship,Cruise Ship,Diamond Princess,2020-03-11T22:13:12,696,7,325,35.4437,139.638,,
643,03-13-2020,10000.0,Cruise Ship,Cruise Ship,Diamond Princess,2020-03-11T20:00:00,696,7,325,35.4498,139.6649,,
644,03-14-2020,10000.0,Cruise Ship,Cruise Ship,Diamond Princess,2020-03-13T14:13:25,696,7,325,35.4498,139.6649,,
645,03-15-2020,10000.0,Cruise Ship,Cruise Ship,Diamond Princess,2020-03-13T14:13:25,696,7,325,35.4498,139.6649,,
646,03-16-2020,10000.0,Cruise Ship,Cruise Ship,Diamond Princess,2020-03-13T14:13:25,696,7,325,35.4498,139.6649,,
647,03-17-2020,10000.0,Cruise Ship,Cruise Ship,Diamond Princess,2020-03-13T14:13:25,696,7,325,35.4498,139.6649,,
648,03-18-2020,10000.0,Cruise Ship,Cruise Ship,Diamond Princess,2020-03-18T10:33:04,712,7,325,35.4498,139.6649,,
649,03-01-2020,392.0,Japan,Japan,,2020-03-01T23:33:03,256,6,32,36.0,138.0,JP,JPN
650,03-02-2020,392.0,Japan,Japan,,2020-03-02T20:33:02,274,6,32,36.0,138.0,JP,JPN
651,03-03-2020,392.0,Japan,Japan,,2020-03-03T20:03:06,293,6,43,36.0,138.0,JP,JPN
652,03-04-2020,392.0,Japan,Japan,,2020-03-04T19:23:03,331,6,43,36.0,138.0,JP,JPN
653,03-05-2020,392.0,Japan,Japan,,2020-03-05T13:43:04,360,6,43,36.0,138.0,JP,JPN
654,03-06-2020,392.0,Japan,Japan,,2020-03-06T20:13:13,420,6,46,36.0,138.0,JP,JPN
655,03-07-2020,392.0,Japan,Japan,,2020-03-07T17:43:05,461,6,76,36.0,138.0,JP,JPN
656,03-08-2020,392.0,Japan,Japan,,2020-03-08T14:53:11,502,6,76,36.0,138.0,JP,JPN
657,03-09-2020,392.0,Japan,Japan,,2020-03-09T09:13:17,511,17,76,36.0,138.0,JP,JPN
658,03-10-2020,392.0,Japan,Japan,,2020-03-10T16:13:16,581,10,101,36.0,138.0,JP,JPN
659,03-11-2020,392.0,Japan,Japan,,2020-03-11T21:33:03,639,15,118,36.0,138.0,JP,JPN
660,03-12-2020,392.0,Japan,Japan,,2020-03-12T05:13:02,639,16,118,36.0,138.0,JP,JPN
661,03-13-2020,392.0,Japan,Japan,,2020-03-11T20:00:00,701,19,118,36.2048,138.2529,JP,JPN
662,03-14-2020,392.0,Japan,Japan,,2020-03-14T22:33:03,773,22,118,36.2048,138.2529,JP,JPN
663,03-15-2020,392.0,Japan,Japan,,2020-03-14T22:33:03,839,22,118,36.2048,138.2529,JP,JPN
664,03-16-2020,392.0,Japan,Japan,,2020-03-16T14:38:45,825,27,144,36.2048,138.2529,JP,JPN
665,03-17-2020,392.0,Japan,Japan,,2020-03-17T16:53:04,878,29,144,36.2048,138.2529,JP,JPN
666,03-18-2020,392.0,Japan,Japan,,2020-03-18T12:33:02,889,29,144,36.2048,138.2529,JP,JPN
667,03-01-2020,250.0,France,France,,2020-03-01T20:43:02,130,2,12,47.0,2.0,FR,FRA
668,03-02-2020,250.0,France,France,,2020-03-02T20:33:02,191,3,12,47.0,2.0,FR,FRA
669,03-03-2020,250.0,France,France,,2020-03-03T15:23:03,204,4,12,47.0,2.0,FR,FRA
670,03-04-2020,250.0,France,France,,2020-03-04T20:43:02,285,4,12,47.0,2.0,FR,FRA
671,03-04-2020,250.0,Saint Barthelemy,France,,2020-03-04T02:43:03,3,0,0,17.9,-62.8333,FR,FRA
672,03-05-2020,250.0,France,France,,2020-03-05T15:13:22,377,6,12,47.0,2.0,FR,FRA
673,03-05-2020,250.0,Saint Barthelemy,France,,2020-03-04T02:43:03,3,0,0,17.9,-62.8333,FR,FRA
674,03-06-2020,250.0,France,France,,2020-03-06T20:13:13,653,9,12,47.0,2.0,FR,FRA
675,03-06-2020,250.0,Saint Barthelemy,France,,2020-03-04T02:43:03,3,0,0,17.9,-62.8333,FR,FRA
676,03-07-2020,250.0,France,France,,2020-03-07T20:33:02,949,11,12,47.0,2.0,FR,FRA
677,03-07-2020,250.0,Saint Barthelemy,France,,2020-03-04T02:43:03,3,0,0,17.9,-62.8333,FR,FRA
678,03-08-2020,250.0,France,France,,2020-03-08T18:03:04,1126,19,12,47.0,2.0,FR,FRA
679,03-08-2020,250.0,Saint Barthelemy,France,,2020-03-04T02:43:03,3,0,0,17.9,-62.8333,FR,FRA
680,03-09-2020,250.0,France,France,,2020-03-09T00:43:03,1209,19,12,47.0,2.0,FR,FRA
681,03-09-2020,250.0,Saint Barthelemy,France,,2020-03-09T10:43:06,1,0,0,17.9,-62.8333,FR,FRA
682,03-10-2020,250.0,France,France,,2020-03-10T18:53:02,1784,33,12,47.0,2.0,FR,FRA
683,03-10-2020,250.0,Saint Barthelemy,France,,2020-03-09T10:43:06,1,0,0,17.9,-62.8333,FR,FRA
684,03-11-2020,250.0,France,France,France,2020-03-11T22:53:03,2281,48,12,46.2276,2.2137,FR,FRA
685,03-11-2020,250.0,France,France,St Martin,2020-03-11T20:53:02,2,0,0,18.0708,-63.0501,FR,FRA
686,03-11-2020,250.0,France,France,Saint Barthelemy,2020-03-11T20:53:02,1,0,0,17.9,-62.8333,FR,FRA
687,03-12-2020,250.0,France,France,France,2020-03-11T22:53:03,2281,48,12,46.2276,2.2137,FR,FRA
688,03-12-2020,250.0,France,France,St Martin,2020-03-11T20:53:02,2,0,0,18.0708,-63.0501,FR,FRA
689,03-12-2020,250.0,France,France,Saint Barthelemy,2020-03-11T20:53:02,1,0,0,17.9,-62.8333,FR,FRA
690,03-13-2020,250.0,France,France,France,2020-03-11T20:00:00,3661,79,12,46.2276,2.2137,FR,FRA
691,03-13-2020,250.0,France,France,French Polynesia,2020-03-11T20:00:00,3,0,0,-17.6797,149.4068,FR,FRA
692,03-13-2020,250.0,France,France,Saint Barthelemy,2020-03-11T20:00:00,1,0,0,17.9,-62.8333,FR,FRA
693,03-13-2020,250.0,France,France,St Martin,2020-03-11T20:00:00,2,0,0,18.0708,-63.0501,FR,FRA
694,03-14-2020,250.0,France,France,France,2020-03-14T20:13:16,4469,91,12,46.2276,2.2137,FR,FRA
695,03-14-2020,250.0,France,France,Fench Guiana,2020-03-14T16:53:03,5,0,0,4.0,-53.0,FR,FRA
696,03-14-2020,250.0,France,France,French Polynesia,2020-03-14T16:53:03,3,0,0,-17.6797,149.4068,FR,FRA
697,03-14-2020,250.0,France,France,St Martin,2020-03-14T16:33:03,2,0,0,18.0708,-63.0501,FR,FRA
698,03-14-2020,250.0,France,France,Saint Barthelemy,2020-03-14T16:33:03,1,0,0,17.9,-62.8333,FR,FRA
699,03-15-2020,250.0,France,France,France,2020-03-15T18:20:18,4499,91,12,46.2276,2.2137,FR,FRA
700,03-15-2020,250.0,France,France,French Guiana,2020-03-15T06:53:03,7,0,0,3.9339,-53.1258,FR,FRA
701,03-15-2020,250.0,France,France,French Polynesia,2020-03-15T18:20:19,3,0,0,-17.6797,-149.4068,FR,FRA
702,03-15-2020,250.0,France,France,St Martin,2020-03-14T16:33:03,2,0,0,18.0708,-63.0501,FR,FRA
703,03-15-2020,250.0,France,France,Mayotte,2020-03-14T20:53:03,1,0,0,-12.8275,45.1662,FR,FRA
704,03-15-2020,250.0,France,France,Saint Barthelemy,2020-03-14T16:33:03,1,0,0,17.9,-62.8333,FR,FRA
705,03-16-2020,250.0,France,France,France,2020-03-16T20:13:11,6633,148,12,46.2276,2.2137,FR,FRA
706,03-16-2020,250.0,France,France,French Guiana,2020-03-16T14:38:45,5,0,0,4.0,-53.0,FR,FRA
707,03-16-2020,250.0,France,France,French Polynesia,2020-03-15T18:20:19,3,0,0,-17.6797,-149.4068,FR,FRA
708,03-16-2020,250.0,France,France,Guadeloupe,2020-03-16T14:38:45,3,0,0,16.25,-61.5833,FR,FRA
709,03-16-2020,250.0,France,France,Saint Barthelemy,2020-03-16T14:38:45,3,0,0,17.9,-62.8333,FR,FRA
710,03-16-2020,250.0,France,France,St Martin,2020-03-14T16:33:03,2,0,0,18.0708,-63.0501,FR,FRA
711,03-16-2020,250.0,France,France,Mayotte,2020-03-16T14:38:45,1,0,0,-12.8431,45.1383,FR,FRA
712,03-17-2020,250.0,France,France,France,2020-03-17T19:13:08,7652,148,12,46.2276,2.2137,FR,FRA
713,03-17-2020,250.0,France,France,Reunion,2020-03-17T11:13:29,9,0,0,-21.1351,55.2471,FR,FRA
714,03-17-2020,250.0,France,France,French Guiana,2020-03-17T07:33:03,7,0,0,4.0,-53.0,FR,FRA
715,03-17-2020,250.0,France,France,Guadeloupe,2020-03-17T07:33:03,6,0,0,16.25,-61.5833,FR,FRA
716,03-17-2020,250.0,France,France,French Polynesia,2020-03-15T18:20:19,3,0,0,-17.6797,-149.4068,FR,FRA
717,03-17-2020,250.0,France,France,Saint Barthelemy,2020-03-16T14:38:45,3,0,0,17.9,-62.8333,FR,FRA
718,03-17-2020,250.0,France,France,St Martin,2020-03-14T16:33:03,2,0,0,18.0708,-63.0501,FR,FRA
719,03-17-2020,250.0,France,France,Mayotte,2020-03-16T14:38:45,1,0,0,-12.8431,45.1383,FR,FRA
720,03-18-2020,250.0,France,France,France,2020-03-18T18:33:02,9043,148,12,46.2276,2.2137,FR,FRA
721,03-18-2020,250.0,France,France,French Polynesia,2020-03-15T18:20:19,3,0,0,-17.6797,-149.4068,FR,FRA
722,03-18-2020,250.0,France,France,Saint Barthelemy,2020-03-16T14:38:45,3,0,0,17.9,-62.8333,FR,FRA
723,03-18-2020,250.0,France,France,St Martin,2020-03-18T10:13:16,3,0,0,18.0708,-63.0501,FR,FRA
724,03-18-2020,250.0,France,France,French Guiana,2020-03-18T14:33:15,0,0,0,4.0,-53.0,FR,FRA
725,03-18-2020,250.0,France,France,Guadeloupe,2020-03-18T14:33:15,0,0,0,16.25,-61.5833,FR,FRA
726,03-18-2020,250.0,France,France,Mayotte,2020-03-18T14:33:15,0,0,0,-12.8431,45.1383,FR,FRA
727,03-18-2020,250.0,France,France,Reunion,2020-03-18T14:33:15,0,0,0,-21.1351,55.2471,FR,FRA
728,03-01-2020,276.0,Germany,Germany,,2020-03-01T23:23:02,130,0,16,51.0,9.0,DE,DEU
729,03-02-2020,276.0,Germany,Germany,,2020-03-02T20:33:02,159,0,16,51.0,9.0,DE,DEU
730,03-03-2020,276.0,Germany,Germany,,2020-03-03T20:03:06,196,0,16,51.0,9.0,DE,DEU
731,03-04-2020,276.0,Germany,Germany,,2020-03-04T19:33:03,262,0,16,51.0,9.0,DE,DEU
732,03-05-2020,276.0,Germany,Germany,,2020-03-05T17:43:03,482,0,16,51.0,9.0,DE,DEU
733,03-06-2020,276.0,Germany,Germany,,2020-03-06T17:53:03,670,0,17,51.0,9.0,DE,DEU
734,03-07-2020,276.0,Germany,Germany,,2020-03-07T17:43:05,799,0,18,51.0,9.0,DE,DEU
735,03-08-2020,276.0,Germany,Germany,,2020-03-08T21:03:03,1040,0,18,51.0,9.0,DE,DEU
736,03-09-2020,276.0,Germany,Germany,,2020-03-09T18:13:11,1176,2,18,51.0,9.0,DE,DEU
737,03-10-2020,276.0,Germany,Germany,,2020-03-10T18:53:02,1457,2,18,51.0,9.0,DE,DEU
738,03-11-2020,276.0,Germany,Germany,,2020-03-11T19:13:17,1908,3,25,51.0,9.0,DE,DEU
739,03-12-2020,276.0,Germany,Germany,,2020-03-12T09:53:06,2078,3,25,51.0,9.0,DE,DEU
740,03-13-2020,276.0,Germany,Germany,,2020-03-11T20:00:00,3675,7,46,51.1657,10.4515,DE,DEU
741,03-14-2020,276.0,Germany,Germany,,2020-03-14T22:13:11,4585,9,46,51.1657,10.4515,DE,DEU
742,03-15-2020,276.0,Germany,Germany,,2020-03-15T18:20:18,5795,11,46,51.1657,10.4515,DE,DEU
743,03-16-2020,276.0,Germany,Germany,,2020-03-16T20:13:11,7272,17,67,51.1657,10.4515,DE,DEU
744,03-17-2020,276.0,Germany,Germany,,2020-03-17T18:53:02,9257,24,67,51.1657,10.4515,DE,DEU
745,03-18-2020,276.0,Germany,Germany,,2020-03-18T19:33:02,12327,28,105,51.1657,10.4515,DE,DEU
746,03-01-2020,702.0,Singapore,Singapore,,2020-03-01T23:23:02,106,0,72,1.2833,103.8333,SG,SGP
747,03-02-2020,702.0,Singapore,Singapore,,2020-03-02T20:33:02,108,0,78,1.2833,103.8333,SG,SGP
748,03-03-2020,702.0,Singapore,Singapore,,2020-03-03T15:23:03,110,0,78,1.2833,103.8333,SG,SGP
749,03-04-2020,702.0,Singapore,Singapore,,2020-03-03T15:23:03,110,0,78,1.2833,103.8333,SG,SGP
750,03-05-2020,702.0,Singapore,Singapore,,2020-03-05T13:43:04,117,0,78,1.2833,103.8333,SG,SGP
751,03-06-2020,702.0,Singapore,Singapore,,2020-03-06T13:03:12,130,0,78,1.2833,103.8333,SG,SGP
752,03-07-2020,702.0,Singapore,Singapore,,2020-03-07T17:53:03,138,0,78,1.2833,103.8333,SG,SGP
753,03-08-2020,702.0,Singapore,Singapore,,2020-03-08T13:33:13,150,0,78,1.2833,103.8333,SG,SGP
754,03-09-2020,702.0,Singapore,Singapore,,2020-03-08T13:33:13,150,0,78,1.2833,103.8333,SG,SGP
755,03-10-2020,702.0,Singapore,Singapore,,2020-03-10T05:13:07,160,0,78,1.2833,103.8333,SG,SGP
756,03-11-2020,702.0,Singapore,Singapore,,2020-03-11T13:53:24,178,0,96,1.2833,103.8333,SG,SGP
757,03-12-2020,702.0,Singapore,Singapore,,2020-03-11T13:53:24,178,0,96,1.2833,103.8333,SG,SGP
758,03-13-2020,702.0,Singapore,Singapore,,2020-03-11T20:00:00,200,0,97,1.3521,103.8198,SG,SGP
759,03-14-2020,702.0,Singapore,Singapore,,2020-03-14T16:14:30,212,0,105,1.3521,103.8198,SG,SGP
760,03-15-2020,702.0,Singapore,Singapore,,2020-03-15T18:20:18,226,0,105,1.3521,103.8198,SG,SGP
761,03-16-2020,702.0,Singapore,Singapore,,2020-03-16T14:38:45,243,0,109,1.3521,103.8198,SG,SGP
762,03-17-2020,702.0,Singapore,Singapore,,2020-03-17T15:33:06,266,0,114,1.3521,103.8198,SG,SGP
763,03-18-2020,702.0,Singapore,Singapore,,2020-03-18T13:33:12,313,0,114,1.3521,103.8198,SG,SGP
764,03-01-2020,344.0,Hong Kong,Hong Kong,Hong Kong,2020-03-01T14:33:16,96,2,36,22.3,114.2,HK,HKG
765,03-02-2020,344.0,Hong Kong,Hong Kong,Hong Kong,2020-03-02T23:53:02,100,2,36,22.3,114.2,HK,HKG
766,03-03-2020,344.0,Hong Kong,Hong Kong,Hong Kong,2020-03-03T11:53:01,100,2,37,22.3,114.2,HK,HKG
767,03-04-2020,344.0,Hong Kong,Hong Kong,Hong Kong,2020-03-04T23:23:01,105,2,37,22.3,114.2,HK,HKG
768,03-05-2020,344.0,Hong Kong,Hong Kong,Hong Kong,2020-03-05T00:23:07,105,2,43,22.3,114.2,HK,HKG
769,03-06-2020,344.0,Hong Kong,Hong Kong,Hong Kong,2020-03-06T23:13:06,107,2,46,22.3,114.2,HK,HKG
770,03-07-2020,344.0,Hong Kong,Hong Kong,Hong Kong,2020-03-07T10:13:22,108,2,51,22.3,114.2,HK,HKG
771,03-08-2020,344.0,Hong Kong,Hong Kong,Hong Kong,2020-03-08T14:43:03,114,3,58,22.3,114.2,HK,HKG
772,03-09-2020,344.0,Hong Kong,Hong Kong,Hong Kong,2020-03-09T10:03:17,115,3,59,22.3,114.2,HK,HKG
773,03-10-2020,344.0,Hong Kong SAR,Hong Kong,Hong Kong,2020-03-10T23:53:02,120,3,65,22.3,114.2,HK,HKG
774,03-01-2020,724.0,Spain,Spain,,2020-03-01T23:33:03,84,0,2,40.0,-4.0,ES,ESP
775,03-02-2020,724.0,Spain,Spain,,2020-03-02T14:43:05,120,0,2,40.0,-4.0,ES,ESP
776,03-03-2020,724.0,Spain,Spain,,2020-03-03T23:53:03,165,1,2,40.0,-4.0,ES,ESP
777,03-04-2020,724.0,Spain,Spain,,2020-03-04T20:43:02,222,2,2,40.0,-4.0,ES,ESP
778,03-05-2020,724.0,Spain,Spain,,2020-03-05T17:43:03,259,3,2,40.0,-4.0,ES,ESP
779,03-06-2020,724.0,Spain,Spain,,2020-03-06T20:13:13,400,5,2,40.0,-4.0,ES,ESP
780,03-07-2020,724.0,Spain,Spain,,2020-03-07T17:43:05,500,10,30,40.0,-4.0,ES,ESP
781,03-08-2020,724.0,Spain,Spain,,2020-03-08T20:33:02,673,17,30,40.0,-4.0,ES,ESP
782,03-09-2020,724.0,Spain,Spain,,2020-03-09T18:13:11,1073,28,32,40.0,-4.0,ES,ESP
783,03-10-2020,724.0,Spain,Spain,,2020-03-10T23:53:02,1695,35,32,40.0,-4.0,ES,ESP
784,03-11-2020,724.0,Spain,Spain,,2020-03-11T20:53:02,2277,54,183,40.0,-4.0,ES,ESP
785,03-12-2020,724.0,Spain,Spain,,2020-03-12T01:17:58,2277,55,183,40.0,-4.0,ES,ESP
786,03-13-2020,724.0,Spain,Spain,,2020-03-11T20:00:00,5232,133,193,40.4637,-3.7492,ES,ESP
787,03-14-2020,724.0,Spain,Spain,,2020-03-14T22:13:11,6391,195,517,40.4637,-3.7492,ES,ESP
788,03-15-2020,724.0,Spain,Spain,,2020-03-15T18:20:18,7798,289,517,40.4637,-3.7492,ES,ESP
789,03-16-2020,724.0,Spain,Spain,,2020-03-16T20:13:11,9942,342,530,40.4637,-3.7492,ES,ESP
790,03-17-2020,724.0,Spain,Spain,,2020-03-17T20:53:02,11748,533,1028,40.4637,-3.7492,ES,ESP
791,03-18-2020,724.0,Spain,Spain,,2020-03-18T13:13:13,13910,623,1081,40.4637,-3.7492,ES,ESP
792,03-01-2020,48.0,Bahrain,Bahrain,,2020-03-01T23:33:03,47,0,0,26.0275,50.55,BH,BHR
793,03-02-2020,48.0,Bahrain,Bahrain,,2020-03-02T20:33:02,49,0,0,26.0275,50.55,BH,BHR
794,03-03-2020,48.0,Bahrain,Bahrain,,2020-03-02T20:33:02,49,0,0,26.0275,50.55,BH,BHR
795,03-04-2020,48.0,Bahrain,Bahrain,,2020-03-04T19:33:03,52,0,0,26.0275,50.55,BH,BHR
796,03-05-2020,48.0,Bahrain,Bahrain,,2020-03-05T13:53:03,55,0,0,26.0275,50.55,BH,BHR
797,03-06-2020,48.0,Bahrain,Bahrain,,2020-03-06T15:33:03,60,0,4,26.0275,50.55,BH,BHR
798,03-07-2020,48.0,Bahrain,Bahrain,,2020-03-07T18:13:26,85,0,4,26.0275,50.55,BH,BHR
799,03-08-2020,48.0,Bahrain,Bahrain,,2020-03-07T18:13:26,85,0,4,26.0275,50.55,BH,BHR
800,03-09-2020,48.0,Bahrain,Bahrain,,2020-03-09T10:03:17,95,0,14,26.0275,50.55,BH,BHR
801,03-10-2020,48.0,Bahrain,Bahrain,,2020-03-10T18:53:02,110,0,22,26.0275,50.55,BH,BHR
802,03-11-2020,48.0,Bahrain,Bahrain,,2020-03-11T22:33:03,195,0,35,26.0275,50.55,BH,BHR
803,03-12-2020,48.0,Bahrain,Bahrain,,2020-03-11T22:33:03,195,0,35,26.0275,50.55,BH,BHR
804,03-13-2020,48.0,Bahrain,Bahrain,,2020-03-11T20:00:00,189,0,44,26.0667,50.5577,BH,BHR
805,03-14-2020,48.0,Bahrain,Bahrain,,2020-03-14T11:53:29,210,0,44,26.0667,50.5577,BH,BHR
806,03-15-2020,48.0,Bahrain,Bahrain,,2020-03-14T11:53:29,214,0,60,26.0667,50.5577,BH,BHR
807,03-16-2020,48.0,Bahrain,Bahrain,,2020-03-16T20:33:03,214,1,77,26.0667,50.5577,BH,BHR
808,03-17-2020,48.0,Bahrain,Bahrain,,2020-03-17T03:13:15,228,1,81,26.0667,50.5577,BH,BHR
809,03-18-2020,48.0,Bahrain,Bahrain,,2020-03-18T12:33:02,256,1,88,26.0667,50.5577,BH,BHR
810,03-01-2020,414.0,Kuwait,Kuwait,,2020-02-28T16:23:03,45,0,0,29.5,47.75,KW,KWT
811,03-02-2020,414.0,Kuwait,Kuwait,,2020-03-02T20:33:02,56,0,0,29.5,47.75,KW,KWT
812,03-03-2020,414.0,Kuwait,Kuwait,,2020-03-02T20:33:02,56,0,0,29.5,47.75,KW,KWT
813,03-04-2020,414.0,Kuwait,Kuwait,,2020-03-02T20:33:02,56,0,0,29.5,47.75,KW,KWT
814,03-05-2020,414.0,Kuwait,Kuwait,,2020-03-05T13:43:04,58,0,0,29.5,47.75,KW,KWT
815,03-06-2020,414.0,Kuwait,Kuwait,,2020-03-05T13:43:04,58,0,0,29.5,47.75,KW,KWT
816,03-07-2020,414.0,Kuwait,Kuwait,,2020-03-07T18:13:26,61,0,0,29.5,47.75,KW,KWT
817,03-08-2020,414.0,Kuwait,Kuwait,,2020-03-08T15:33:04,64,0,1,29.5,47.75,KW,KWT
818,03-09-2020,414.0,Kuwait,Kuwait,,2020-03-08T15:33:04,64,0,1,29.5,47.75,KW,KWT
819,03-10-2020,414.0,Kuwait,Kuwait,,2020-03-10T10:13:28,69,0,1,29.5,47.75,KW,KWT
820,03-11-2020,414.0,Kuwait,Kuwait,,2020-03-11T09:53:03,72,0,2,29.5,47.75,KW,KWT
821,03-12-2020,414.0,Kuwait,Kuwait,,2020-03-12T09:13:24,80,0,5,29.5,47.75,KW,KWT
822,03-13-2020,414.0,Kuwait,Kuwait,,2020-03-11T20:00:00,80,0,5,29.3117,47.4818,KW,KWT
823,03-14-2020,414.0,Kuwait,Kuwait,,2020-03-14T16:14:34,104,0,5,29.3117,47.4818,KW,KWT
824,03-15-2020,414.0,Kuwait,Kuwait,,2020-03-15T18:20:18,112,0,5,29.3117,47.4818,KW,KWT
825,03-16-2020,414.0,Kuwait,Kuwait,,2020-03-16T14:38:45,123,0,9,29.3117,47.4818,KW,KWT
826,03-17-2020,414.0,Kuwait,Kuwait,,2020-03-17T10:53:03,130,0,9,29.3117,47.4818,KW,KWT
827,03-18-2020,414.0,Kuwait,Kuwait,,2020-03-18T10:53:02,142,0,15,29.3117,47.4818,KW,KWT
828,03-01-2020,840.0,US,United States of America (the),Unassigned Location (From Diamond Princess),2020-02-28T20:03:03,44,0,0,35.4437,139.638,US,USA
829,03-01-2020,840.0,US,United States of America (the),"Seattle, WA",2020-03-01T21:13:12,9,1,1,47.6062,-122.3321,US,USA
830,03-01-2020,840.0,US,United States of America (the),"Chicago, IL",2020-03-01T03:53:02,3,0,2,41.8781,-87.6298,US,USA
831,03-01-2020,840.0,US,United States of America (the),"Santa Clara, CA",2020-02-29T01:33:03,3,0,1,37.3541,-121.9552,US,USA
832,03-01-2020,840.0,US,United States of America (the),"Sacramento County, CA",2020-02-27T20:33:02,2,0,0,38.4747,-121.3542,US,USA
833,03-01-2020,840.0,US,United States of America (the),"San Benito, CA",2020-02-03T03:53:02,2,0,0,36.5761,-120.9876,US,USA
834,03-01-2020,840.0,US,United States of America (the),"San Diego County, CA",2020-02-21T05:43:02,2,0,1,32.7157,-117.1611,US,USA
835,03-01-2020,840.0,US,United States of America (the),"Snohomish County, WA",2020-03-01T20:23:06,2,0,0,48.033,-121.8339,US,USA
836,03-01-2020,840.0,US,United States of America (the),"Boston, MA",2020-02-28T21:13:12,1,0,1,42.3601,-71.0589,US,USA
837,03-01-2020,840.0,US,United States of America (the),"Humboldt County, CA",2020-02-21T05:13:09,1,0,0,40.745,-123.8695,US,USA
838,03-01-2020,840.0,US,United States of America (the),"Los Angeles, CA",2020-02-01T19:53:03,1,0,0,34.0522,-118.2437,US,USA
839,03-01-2020,840.0,US,United States of America (the),"Madison, WI",2020-02-05T21:53:02,1,0,0,43.0731,-89.4012,US,USA
840,03-01-2020,840.0,US,United States of America (the),"Orange, CA",2020-02-01T19:53:03,1,0,0,33.7879,-117.8531,US,USA
841,03-01-2020,840.0,US,United States of America (the),"Portland, OR",2020-02-29T02:23:11,1,0,0,45.5051,-122.675,US,USA
842,03-01-2020,840.0,US,United States of America (the),"Providence, RI",2020-03-01T15:33:03,1,0,0,41.824,-71.4128,US,USA
843,03-01-2020,840.0,US,United States of America (the),"San Antonio, TX",2020-02-13T18:53:02,1,0,0,29.4241,-98.4936,US,USA
844,03-01-2020,840.0,US,United States of America (the),"Tempe, AZ",2020-02-25T21:23:03,1,0,1,33.4255,-111.94,US,USA
845,03-01-2020,840.0,US,United States of America (the),"Lackland, TX (From Diamond Princess)",2020-02-24T23:33:02,0,0,0,29.3829,-98.6134,US,USA
846,03-01-2020,840.0,US,United States of America (the),"Omaha, NE (From Diamond Princess)",2020-02-24T23:33:02,0,0,0,41.2545,-95.9758,US,USA
847,03-01-2020,840.0,US,United States of America (the),"Travis, CA (From Diamond Princess)",2020-02-24T23:33:02,0,0,0,38.2721,-121.9399,US,USA
848,03-02-2020,840.0,US,United States of America (the),Unassigned Location (From Diamond Princess),2020-03-02T19:53:03,45,0,0,35.4437,139.638,US,USA
849,03-02-2020,840.0,US,United States of America (the),"King County, WA",2020-03-02T20:23:16,14,5,1,47.548,-121.9836,US,USA
850,03-02-2020,840.0,US,United States of America (the),"Santa Clara, CA",2020-03-02T20:33:02,9,0,1,37.3541,-121.9552,US,USA
851,03-02-2020,840.0,US,United States of America (the),"Cook County, IL",2020-03-02T20:33:02,4,0,2,41.7377,-87.6976,US,USA
852,03-02-2020,840.0,US,United States of America (the),"Snohomish County, WA",2020-03-02T20:53:02,4,1,0,48.033,-121.8339,US,USA
853,03-02-2020,840.0,US,United States of America (the),"Portland, OR",2020-03-02T03:33:08,2,0,0,45.5051,-122.675,US,USA
854,03-02-2020,840.0,US,United States of America (the),"Providence, RI",2020-03-02T03:43:02,2,0,0,41.824,-71.4128,US,USA
855,03-02-2020,840.0,US,United States of America (the),"Sacramento County, CA",2020-02-27T20:33:02,2,0,0,38.4747,-121.3542,US,USA
856,03-02-2020,840.0,US,United States of America (the),"San Benito, CA",2020-02-03T03:53:02,2,0,0,36.5761,-120.9876,US,USA
857,03-02-2020,840.0,US,United States of America (the),"San Diego County, CA",2020-02-21T05:43:02,2,0,1,32.7157,-117.1611,US,USA
858,03-02-2020,840.0,US,United States of America (the),"Boston, MA",2020-02-28T21:13:12,1,0,1,42.3601,-71.0589,US,USA
859,03-02-2020,840.0,US,United States of America (the),"Grafton County, NH",2020-03-02T20:33:02,1,0,0,43.9088,-71.826,US,USA
860,03-02-2020,840.0,US,United States of America (the),"Hillsborough, FL",2020-03-02T03:13:25,1,0,0,27.9904,-82.3018,US,USA
861,03-02-2020,840.0,US,United States of America (the),"Humboldt County, CA",2020-02-21T05:13:09,1,0,0,40.745,-123.8695,US,USA
862,03-02-2020,840.0,US,United States of America (the),"Los Angeles, CA",2020-02-01T19:53:03,1,0,0,34.0522,-118.2437,US,USA
863,03-02-2020,840.0,US,United States of America (the),"Madison, WI",2020-02-05T21:53:02,1,0,0,43.0731,-89.4012,US,USA
864,03-02-2020,840.0,US,United States of America (the),"New York City, NY",2020-03-02T01:53:03,1,0,0,40.7128,-74.006,US,USA
865,03-02-2020,840.0,US,United States of America (the),"Orange, CA",2020-02-01T19:53:03,1,0,0,33.7879,-117.8531,US,USA
866,03-02-2020,840.0,US,United States of America (the),"Placer County, CA",2020-03-02T23:53:02,1,0,0,39.0916,-120.8039,US,USA
867,03-02-2020,840.0,US,United States of America (the),"San Antonio, TX",2020-02-13T18:53:02,1,0,0,29.4241,-98.4936,US,USA
868,03-02-2020,840.0,US,United States of America (the),"San Mateo, CA",2020-03-02T20:43:02,1,0,0,37.563,-122.3255,US,USA
869,03-02-2020,840.0,US,United States of America (the),"Sarasota, FL",2020-03-02T03:23:06,1,0,0,27.3364,-82.5307,US,USA
870,03-02-2020,840.0,US,United States of America (the),"Sonoma County, CA",2020-03-02T20:53:02,1,0,0,38.578,-122.9888,US,USA
871,03-02-2020,840.0,US,United States of America (the),"Tempe, AZ",2020-02-25T21:23:03,1,0,1,33.4255,-111.94,US,USA
872,03-02-2020,840.0,US,United States of America (the),"Umatilla, OR",2020-03-02T20:23:16,1,0,0,45.775,-118.7606,US,USA
873,03-02-2020,840.0,US,United States of America (the),"Lackland, TX (From Diamond Princess)",2020-02-24T23:33:02,0,0,0,29.3829,-98.6134,US,USA
874,03-02-2020,840.0,US,United States of America (the),"Omaha, NE (From Diamond Princess)",2020-02-24T23:33:02,0,0,0,41.2545,-95.9758,US,USA
875,03-02-2020,840.0,US,United States of America (the),"Travis, CA (From Diamond Princess)",2020-02-24T23:33:02,0,0,0,38.2721,-121.9399,US,USA
876,03-03-2020,840.0,US,United States of America (the),Unassigned Location (From Diamond Princess),2020-03-02T19:53:03,45,0,0,35.4437,139.638,US,USA
877,03-03-2020,840.0,US,United States of America (the),"King County, WA",2020-03-03T20:23:05,21,6,1,47.548,-121.9836,US,USA
878,03-03-2020,840.0,US,United States of America (the),"Santa Clara, CA",2020-03-03T23:33:03,11,0,1,37.3541,-121.9552,US,USA
879,03-03-2020,840.0,US,United States of America (the),"Snohomish County, WA",2020-03-03T20:23:05,6,1,0,48.033,-121.8339,US,USA
880,03-03-2020,840.0,US,United States of America (the),"Cook County, IL",2020-03-02T20:33:02,4,0,2,41.7377,-87.6976,US,USA
881,03-03-2020,840.0,US,United States of America (the),"Fulton County, GA",2020-03-03T03:33:02,2,0,0,33.8034,-84.3963,US,USA
882,03-03-2020,840.0,US,United States of America (the),"Grafton County, NH",2020-03-03T23:33:03,2,0,0,43.9088,-71.826,US,USA
883,03-03-2020,840.0,US,United States of America (the),"Hillsborough, FL",2020-03-03T18:33:02,2,0,0,27.9904,-82.3018,US,USA
884,03-03-2020,840.0,US,United States of America (the),"Providence, RI",2020-03-02T03:43:02,2,0,0,41.824,-71.4128,US,USA
885,03-03-2020,840.0,US,United States of America (the),"Sacramento County, CA",2020-02-27T20:33:02,2,0,0,38.4747,-121.3542,US,USA
886,03-03-2020,840.0,US,United States of America (the),"San Benito, CA",2020-02-03T03:53:02,2,0,0,36.5761,-120.9876,US,USA
887,03-03-2020,840.0,US,United States of America (the),"San Diego County, CA",2020-02-21T05:43:02,2,0,1,32.7157,-117.1611,US,USA
888,03-03-2020,840.0,US,United States of America (the),"San Mateo, CA",2020-03-03T00:43:02,2,0,0,37.563,-122.3255,US,USA
889,03-03-2020,840.0,US,United States of America (the),"Washington County, OR",2020-03-03T03:03:02,2,0,0,45.547,-123.1386,US,USA
890,03-03-2020,840.0,US,United States of America (the)," Norfolk County, MA",2020-03-03T14:33:03,1,0,0,42.1767,-71.1449,US,USA
891,03-03-2020,840.0,US,United States of America (the),"Berkeley, CA",2020-03-03T23:53:03,1,0,0,37.8715,-122.273,US,USA
892,03-03-2020,840.0,US,United States of America (the),"Boston, MA",2020-02-28T21:13:12,1,0,1,42.3601,-71.0589,US,USA
893,03-03-2020,840.0,US,United States of America (the),"Humboldt County, CA",2020-02-21T05:13:09,1,0,0,40.745,-123.8695,US,USA
894,03-03-2020,840.0,US,United States of America (the),"Los Angeles, CA",2020-02-01T19:53:03,1,0,0,34.0522,-118.2437,US,USA
895,03-03-2020,840.0,US,United States of America (the),"Madison, WI",2020-03-03T15:53:03,1,0,1,43.0731,-89.4012,US,USA
896,03-03-2020,840.0,US,United States of America (the),"Maricopa County, AZ",2020-03-03T17:33:02,1,0,0,33.2918,-112.4291,US,USA
897,03-03-2020,840.0,US,United States of America (the),"New York City, NY",2020-03-02T01:53:03,1,0,0,40.7128,-74.006,US,USA
898,03-03-2020,840.0,US,United States of America (the),"Orange, CA",2020-02-01T19:53:03,1,0,0,33.7879,-117.8531,US,USA
899,03-03-2020,840.0,US,United States of America (the),"Placer County, CA",2020-03-02T23:53:02,1,0,0,39.0916,-120.8039,US,USA
900,03-03-2020,840.0,US,United States of America (the),"San Antonio, TX",2020-02-13T18:53:02,1,0,0,29.4241,-98.4936,US,USA
901,03-03-2020,840.0,US,United States of America (the),"Sarasota, FL",2020-03-02T03:23:06,1,0,0,27.3364,-82.5307,US,USA
902,03-03-2020,840.0,US,United States of America (the),"Sonoma County, CA",2020-03-02T20:53:02,1,0,0,38.578,-122.9888,US,USA
903,03-03-2020,840.0,US,United States of America (the),"Tempe, AZ",2020-02-25T21:23:03,1,0,1,33.4255,-111.94,US,USA
904,03-03-2020,840.0,US,United States of America (the),"Umatilla, OR",2020-03-02T20:23:16,1,0,0,45.775,-118.7606,US,USA
905,03-03-2020,840.0,US,United States of America (the),"Wake County, NC",2020-03-03T20:53:02,1,0,0,35.8032,-78.5661,US,USA
906,03-03-2020,840.0,US,United States of America (the),"Westchester County, NY",2020-03-03T14:43:03,1,0,0,41.122,-73.7949,US,USA
907,03-03-2020,840.0,US,United States of America (the),"Lackland, TX (From Diamond Princess)",2020-02-24T23:33:02,0,0,0,29.3829,-98.6134,US,USA
908,03-03-2020,840.0,US,United States of America (the),"Omaha, NE (From Diamond Princess)",2020-02-24T23:33:02,0,0,0,41.2545,-95.9758,US,USA
909,03-03-2020,840.0,US,United States of America (the),"Travis, CA (From Diamond Princess)",2020-02-24T23:33:02,0,0,0,38.2721,-121.9399,US,USA
910,03-04-2020,840.0,US,United States of America (the),Unassigned Location (From Diamond Princess),2020-03-02T19:53:03,45,0,0,35.4437,139.638,US,USA
911,03-04-2020,840.0,US,United States of America (the),"King County, WA",2020-03-04T19:53:02,31,9,1,47.548,-121.9836,US,USA
912,03-04-2020,840.0,US,United States of America (the),"Santa Clara, CA",2020-03-03T23:33:03,11,0,1,37.3541,-121.9552,US,USA
913,03-04-2020,840.0,US,United States of America (the),"Westchester County, NY",2020-03-04T21:23:10,10,0,0,41.122,-73.7949,US,USA
914,03-04-2020,840.0,US,United States of America (the),"Snohomish County, WA",2020-03-04T19:53:02,8,1,0,48.033,-121.8339,US,USA
915,03-04-2020,840.0,US,United States of America (the),"Los Angeles, CA",2020-03-04T18:13:18,7,0,0,34.0522,-118.2437,US,USA
916,03-04-2020,840.0,US,United States of America (the),"Cook County, IL",2020-03-02T20:33:02,4,0,2,41.7377,-87.6976,US,USA
917,03-04-2020,840.0,US,United States of America (the),"Orange County, CA",2020-03-04T02:13:11,3,0,0,33.7879,-117.8531,US,USA
918,03-04-2020,840.0,US,United States of America (the),"Fulton County, GA",2020-03-03T03:33:02,2,0,0,33.8034,-84.3963,US,USA
919,03-04-2020,840.0,US,United States of America (the),"Grafton County, NH",2020-03-03T23:33:03,2,0,0,43.9088,-71.826,US,USA
920,03-04-2020,840.0,US,United States of America (the),"Hillsborough, FL",2020-03-03T18:33:02,2,0,0,27.9904,-82.3018,US,USA
921,03-04-2020,840.0,US,United States of America (the),"Placer County, CA",2020-03-04T19:53:02,2,1,0,39.0916,-120.8039,US,USA
922,03-04-2020,840.0,US,United States of America (the),"Providence, RI",2020-03-02T03:43:02,2,0,0,41.824,-71.4128,US,USA
923,03-04-2020,840.0,US,United States of America (the),"Sacramento County, CA",2020-02-27T20:33:02,2,0,0,38.4747,-121.3542,US,USA
924,03-04-2020,840.0,US,United States of America (the),"San Benito, CA",2020-02-03T03:53:02,2,0,0,36.5761,-120.9876,US,USA
925,03-04-2020,840.0,US,United States of America (the),"San Diego County, CA",2020-02-21T05:43:02,2,0,1,32.7157,-117.1611,US,USA
926,03-04-2020,840.0,US,United States of America (the),"San Mateo, CA",2020-03-03T00:43:02,2,0,0,37.563,-122.3255,US,USA
927,03-04-2020,840.0,US,United States of America (the),"Washington County, OR",2020-03-03T03:03:02,2,0,0,45.547,-123.1386,US,USA
928,03-04-2020,840.0,US,United States of America (the)," Norfolk County, MA",2020-03-03T14:33:03,1,0,0,42.1767,-71.1449,US,USA
929,03-04-2020,840.0,US,United States of America (the),"Berkeley, CA",2020-03-03T23:53:03,1,0,0,37.8715,-122.273,US,USA
930,03-04-2020,840.0,US,United States of America (the),"Boston, MA",2020-02-28T21:13:12,1,0,1,42.3601,-71.0589,US,USA
931,03-04-2020,840.0,US,United States of America (the),"Contra Costa County, CA",2020-03-04T04:23:05,1,0,0,37.8534,-121.9018,US,USA
932,03-04-2020,840.0,US,United States of America (the),"Humboldt County, CA",2020-02-21T05:13:09,1,0,0,40.745,-123.8695,US,USA
933,03-04-2020,840.0,US,United States of America (the),"Madison, WI",2020-03-03T15:53:03,1,0,1,43.0731,-89.4012,US,USA
934,03-04-2020,840.0,US,United States of America (the),"Maricopa County, AZ",2020-03-03T17:33:02,1,0,0,33.2918,-112.4291,US,USA
935,03-04-2020,840.0,US,United States of America (the),"New York City, NY",2020-03-02T01:53:03,1,0,0,40.7128,-74.006,US,USA
936,03-04-2020,840.0,US,United States of America (the),"San Antonio, TX",2020-02-13T18:53:02,1,0,0,29.4241,-98.4936,US,USA
937,03-04-2020,840.0,US,United States of America (the),"Sarasota, FL",2020-03-02T03:23:06,1,0,0,27.3364,-82.5307,US,USA
938,03-04-2020,840.0,US,United States of America (the),"Sonoma County, CA",2020-03-02T20:53:02,1,0,0,38.578,-122.9888,US,USA
939,03-04-2020,840.0,US,United States of America (the),"Tempe, AZ",2020-02-25T21:23:03,1,0,1,33.4255,-111.94,US,USA
940,03-04-2020,840.0,US,United States of America (the),"Umatilla, OR",2020-03-02T20:23:16,1,0,0,45.775,-118.7606,US,USA
941,03-04-2020,840.0,US,United States of America (the),"Wake County, NC",2020-03-03T20:53:02,1,0,0,35.8032,-78.5661,US,USA
942,03-04-2020,840.0,US,United States of America (the),"Lackland, TX (From Diamond Princess)",2020-02-24T23:33:02,0,0,0,29.3829,-98.6134,US,USA
943,03-04-2020,840.0,US,United States of America (the),"Omaha, NE (From Diamond Princess)",2020-02-24T23:33:02,0,0,0,41.2545,-95.9758,US,USA
944,03-04-2020,840.0,US,United States of America (the),"Travis, CA (From Diamond Princess)",2020-02-24T23:33:02,0,0,0,38.2721,-121.9399,US,USA
945,03-05-2020,840.0,US,United States of America (the),"King County, WA",2020-03-05T22:03:17,51,10,1,47.548,-121.9836,US,USA
946,03-05-2020,840.0,US,United States of America (the),Unassigned Location (From Diamond Princess),2020-03-02T19:53:03,45,0,0,35.4437,139.638,US,USA
947,03-05-2020,840.0,US,United States of America (the),"Santa Clara, CA",2020-03-05T22:53:03,20,0,1,37.3541,-121.9552,US,USA
948,03-05-2020,840.0,US,United States of America (the),"Snohomish County, WA",2020-03-05T20:23:07,18,1,0,48.033,-121.8339,US,USA
949,03-05-2020,840.0,US,United States of America (the),"Westchester County, NY",2020-03-05T21:33:03,18,0,0,41.122,-73.7949,US,USA
950,03-05-2020,840.0,US,United States of America (the),"Los Angeles, CA",2020-03-05T21:03:14,11,0,0,34.0522,-118.2437,US,USA
951,03-05-2020,840.0,US,United States of America (the),"Cook County, IL",2020-03-05T18:33:03,5,0,2,41.7377,-87.6976,US,USA
952,03-05-2020,840.0,US,United States of America (the),"New York City, NY",2020-03-05T21:03:13,4,0,0,40.7128,-74.006,US,USA
953,03-05-2020,840.0,US,United States of America (the),"Orange County, CA",2020-03-04T02:13:11,3,0,0,33.7879,-117.8531,US,USA
954,03-05-2020,840.0,US,United States of America (the),"San Diego County, CA",2020-03-05T20:33:03,3,0,1,32.7157,-117.1611,US,USA
955,03-05-2020,840.0,US,United States of America (the),"Bergen County, NJ",2020-03-05T21:03:12,2,0,0,40.9263,-74.077,US,USA
956,03-05-2020,840.0,US,United States of America (the),"Fulton County, GA",2020-03-03T03:33:02,2,0,0,33.8034,-84.3963,US,USA
957,03-05-2020,840.0,US,United States of America (the),"Grafton County, NH",2020-03-03T23:33:03,2,0,0,43.9088,-71.826,US,USA
958,03-05-2020,840.0,US,United States of America (the),"Harris County, TX",2020-03-05T21:53:02,2,0,0,29.7752,-95.3103,US,USA
959,03-05-2020,840.0,US,United States of America (the),"Hillsborough, FL",2020-03-03T18:33:02,2,0,0,27.9904,-82.3018,US,USA
960,03-05-2020,840.0,US,United States of America (the),"Placer County, CA",2020-03-04T19:53:02,2,1,0,39.0916,-120.8039,US,USA
961,03-05-2020,840.0,US,United States of America (the),"Providence, RI",2020-03-02T03:43:02,2,0,0,41.824,-71.4128,US,USA
962,03-05-2020,840.0,US,United States of America (the),"Sacramento County, CA",2020-02-27T20:33:02,2,0,0,38.4747,-121.3542,US,USA
963,03-05-2020,840.0,US,United States of America (the),"San Benito, CA",2020-02-03T03:53:02,2,0,0,36.5761,-120.9876,US,USA
964,03-05-2020,840.0,US,United States of America (the),"San Francisco County, CA",2020-03-05T20:33:03,2,0,0,37.7749,-122.4194,US,USA
965,03-05-2020,840.0,US,United States of America (the),"San Mateo, CA",2020-03-03T00:43:02,2,0,0,37.563,-122.3255,US,USA
966,03-05-2020,840.0,US,United States of America (the),"Washington County, OR",2020-03-03T03:03:02,2,0,0,45.547,-123.1386,US,USA
967,03-05-2020,840.0,US,United States of America (the)," Norfolk County, MA",2020-03-03T14:33:03,1,0,0,42.1767,-71.1449,US,USA
968,03-05-2020,840.0,US,United States of America (the),"Berkeley, CA",2020-03-03T23:53:03,1,0,0,37.8715,-122.273,US,USA
969,03-05-2020,840.0,US,United States of America (the),"Boston, MA",2020-02-28T21:13:12,1,0,1,42.3601,-71.0589,US,USA
970,03-05-2020,840.0,US,United States of America (the),"Clark County, NV",2020-03-05T20:53:03,1,0,0,36.0796,-115.094,US,USA
971,03-05-2020,840.0,US,United States of America (the),"Contra Costa County, CA",2020-03-04T04:23:05,1,0,0,37.8534,-121.9018,US,USA
972,03-05-2020,840.0,US,United States of America (the),"Fort Bend County, TX",2020-03-05T01:16:59,1,0,0,29.5693,-95.8143,US,USA
973,03-05-2020,840.0,US,United States of America (the),"Grant County, WA",2020-03-05T20:23:07,1,0,0,47.1981,-119.3732,US,USA
974,03-05-2020,840.0,US,United States of America (the),"Humboldt County, CA",2020-02-21T05:13:09,1,0,0,40.745,-123.8695,US,USA
975,03-05-2020,840.0,US,United States of America (the),"Madison, WI",2020-03-03T15:53:03,1,0,1,43.0731,-89.4012,US,USA
976,03-05-2020,840.0,US,United States of America (the),"Maricopa County, AZ",2020-03-03T17:33:02,1,0,0,33.2918,-112.4291,US,USA
